user_input,retrieved_contexts,response,reference,context_precision,context_recall,faithfulness,answer_relevancy
Como faço para cancelar uma reserva de refeição?,"['Acesse o menu: ATIVIDADES ESTUDANTIS - Restaurante Institucional - Minhas Reservas Busque a reserva que deseja cancelar Clique no botão Cancelar Nota: O aluno pode cancelar sua reserva até 30 min antes do horário de encerramento das reservas. - Caso o aluno faça uma reserva e não consumir, ele fica sem poder reservar posteriormente o mesmo tipo de refeição não consumida até que se justifique no setor responsável. Área do Aluno\n\nAcesse o menu: ATIVIDADES ESTUDANTIS - Restaurante Institucional - Minhas Reservas Busque pela reserva Clique no botão Ver Justificativa Tela da Justificativa Área do Aluno\n\nAcesse sua conta do suap Acesse o menu: ATIVIDADES ESTUDANTIS - Restaurante Institucional - Reservar Refeições Clique no botão Reservar da refeição disponível para reserva Nota: Para que a reserva seja realizada com sucesso é necessário atender os requisitos abaixo: - Aluno precisa está matriculado - A quantidade de reservas não podem ser igual a quantidade da refeição liberada - Aguarde o início das reservas - Reservar antes do horário de encerramento das reservas Reserva realizada com sucesso Área do Aluno']","Para cancelar uma reserva de refeição no Restaurante Institucional do SUAP, siga os passos abaixo:

1. Acesse sua conta no SUAP.
2. Vá até o menu ATIVIDADES ESTUDANTIS > Restaurante Institucional > Minhas Reservas.
3. Busque pela reserva que deseja cancelar.
4. Clique no botão ""Cancelar"".

Lembrando que o aluno pode cancelar sua reserva até 30 minutos antes do horário de encerramento das reservas. Caso o aluno faça uma reserva e não consuma, ele ficará sem poder reservar posteriormente o mesmo tipo de refeição não consumida até que se justifique no setor responsável.","Para cancelar, acesse o menu: ATIVIDADES ESTUDANTIS - Restaurante Institucional - Minhas Reservas, busque a reserva e clique no botão Cancelar.",0.9999999999,1.0,0.8571428571428571,0.8126643801286725
Onde vejo a justificativa de uma refeição não consumida?,"['Acesse: ATIVIDADES ESTUDANTIS - Restaurante Institucional - Reservas Refeições Preencha a o formulário de justificativa e salve. Visualizar justificativa Tela da Justificativa Área Nutricionista\n\nManual direcionado ao "" Justificador de Reservas de Refeições não Consumidas"" Área Justificador de Reservas de Refeições não Consumidas\n\nAcesse: ATIVIDADES ESTUDANTIS - Restaurante Institucional - Reservas Refeições Preencha a o formulário de justificativa e salve. Visualizar justificativa Tela da Justificativa']","Para visualizar a justificativa de uma refeição não consumida no SUAP, você deve acessar o menu ""ATIVIDADES ESTUDANTIS"", em seguida selecionar ""Restaurante Institucional"" e depois ""Reservas Refeições"". Nessa tela, você poderá preencher o formulário de justificativa e salvar. Após salvar a justificativa, você poderá visualizá-la na opção ""Visualizar justificativa"" na tela da Justificativa, na área destinada ao Nutricionista.","Você deve acessar o menu ATIVIDADES ESTUDANTIS - Restaurante Institucional - Minhas Reservas, buscar pela reserva e clicar no botão Ver Justificativa.",0.9999999999,1.0,1.0,0.8021185194880202
