user_input,retrieved_contexts,response,reference,context_precision,context_recall,faithfulness,answer_relevancy
Solicito o detalhamento do procedimento institucional para que discentes possam efetuar a assinatura de documentos eletrônicos via PEN Suap.,"['Tutorial para que os alunos possam assinar documentos no PEN Suap Lembre-se de que, para utilizar o PEN Suap, é necessário ter um cadastro ativo e estar vinculado a uma instituição de ensino que utilize a plataforma. Além disso, é importante seguir as orientações de segurança e manter suas informações de login em segurança. 1º PASSO: Para acessar o Suap, o discente deve seguir o primeiro passo, que é realizar a conexão com o Suap-EDU. Para isso, é necessário inserir as suas credenciais de login, que consistem em um usuário e senha previamente cadastrados no sistema. 2º PASSO: Na página inicial do Suap, procure no canto superior esquerdo um alerta informando que há um documento eletrônico aguardando sua assinatura. Clique no alerta para acessar o documento\n\n. 8. Disponível em: https://www.ifpi.edu.br/pen-suap/manuais/manual-pen-suap-para-o-operador-modulo-documento-eletronico/view IMPORTANTE: QUEM PODE ASSINAR? Os Egressos, Pessoa Física e Pessoa Jurídica(representante) terão a permissão apenas para “assinar” documentos internos/nato digitais. Exemplos de documentos internos/nato digitais: • Acordos; • Contratos; • Atas; • Outros afins. ACESSE AS INSTRUÇÕES: Fonte: https://www.ifpi.edu.br/pen-suap/manuais COMO SOLICITAR O CADASTRO DE USUÁRIOS EXTERNOS PARA ASSINATURA DE DOCUMENTOS INTERNOS PARA O MÓDULO DE DOCUMENTOS ELETRÔNICOS? Acesse: https://suap.ifpi.edu.br/centralservicos/listar_area_servico/ O QUE PODE SER FEITO PELA CENTRAL DE SERVIÇOS > PRESTADOR: Acesse o link: https://suap.ifpi.edu\n\nObjetivo: Fornecer instruções claras e precisas para que o usuário externo possa assinar digitalmente um documento no PEN Suap, seguindo um passo a passo simples e fácil de entender. 1º PASSO: O usuário deverá acessar o SUAP (acesse aqui) utilizando sua conta do G o v . B R . 2º PASSO: O usuário deverá realizar o login através do portal do G o v . B R . Para isso, será necessário informar o número do CPF como usuário e, em seguida, clicar em Continuar. O sistema redirecionará o usuário para a página de autenticação do G o v . B R . 3º PASSO: Na tela seguinte, o usuário deverá digitar a sua senha cadastrada no G o v . B R e clicar em ""Entrar"" para acessar o SUAP']","1. Acesse o Suap utilizando suas credenciais de login.
2. Procure o alerta na página inicial indicando um documento aguardando assinatura e clique nele para acessar o documento.
3. Siga as orientações específicas do documento para realizar a assinatura eletrônica.","Para que os discentes possam assinar documentos eletrônicos no PEN Suap, eles devem primeiramente realizar a conexão com o Suap-EDU utilizando suas credenciais. Em seguida, na página inicial, devem localizar e clicar no alerta que informa a existência de um documento eletrônico aguardando assinatura. Após visualizar o documento clicando na lupa na coluna 'Ações', o discente deve clicar no botão 'Assinar' no canto superior direito para iniciar o processo, definir um identificador e, por fim, autenticar a assinatura com a senha do Suap-Edu.",0.9999999999,1.0,0.6666666666666666,0.7420693826974828
Quais são os pré-requisitos formais para que um discente esteja apto a utilizar a funcionalidade de assinatura no PEN Suap?,"['Tutorial para que os alunos possam assinar documentos no PEN Suap Lembre-se de que, para utilizar o PEN Suap, é necessário ter um cadastro ativo e estar vinculado a uma instituição de ensino que utilize a plataforma. Além disso, é importante seguir as orientações de segurança e manter suas informações de login em segurança. 1º PASSO: Para acessar o Suap, o discente deve seguir o primeiro passo, que é realizar a conexão com o Suap-EDU. Para isso, é necessário inserir as suas credenciais de login, que consistem em um usuário e senha previamente cadastrados no sistema. 2º PASSO: Na página inicial do Suap, procure no canto superior esquerdo um alerta informando que há um documento eletrônico aguardando sua assinatura. Clique no alerta para acessar o documento\n\n. 8. Disponível em: https://www.ifpi.edu.br/pen-suap/manuais/manual-pen-suap-para-o-operador-modulo-documento-eletronico/view IMPORTANTE: QUEM PODE ASSINAR? Os Egressos, Pessoa Física e Pessoa Jurídica(representante) terão a permissão apenas para “assinar” documentos internos/nato digitais. Exemplos de documentos internos/nato digitais: • Acordos; • Contratos; • Atas; • Outros afins. ACESSE AS INSTRUÇÕES: Fonte: https://www.ifpi.edu.br/pen-suap/manuais COMO SOLICITAR O CADASTRO DE USUÁRIOS EXTERNOS PARA ASSINATURA DE DOCUMENTOS INTERNOS PARA O MÓDULO DE DOCUMENTOS ELETRÔNICOS? Acesse: https://suap.ifpi.edu.br/centralservicos/listar_area_servico/ O QUE PODE SER FEITO PELA CENTRAL DE SERVIÇOS > PRESTADOR: Acesse o link: https://suap.ifpi.edu\n\nObjetivo: Fornecer instruções claras e precisas para que o usuário externo possa assinar digitalmente um documento no PEN Suap, seguindo um passo a passo simples e fácil de entender. 1º PASSO: O usuário deverá acessar o SUAP (acesse aqui) utilizando sua conta do G o v . B R . 2º PASSO: O usuário deverá realizar o login através do portal do G o v . B R . Para isso, será necessário informar o número do CPF como usuário e, em seguida, clicar em Continuar. O sistema redirecionará o usuário para a página de autenticação do G o v . B R . 3º PASSO: Na tela seguinte, o usuário deverá digitar a sua senha cadastrada no G o v . B R e clicar em ""Entrar"" para acessar o SUAP']","Os pré-requisitos formais para que um discente esteja apto a utilizar a funcionalidade de assinatura no PEN Suap são: ter um cadastro ativo no sistema, estar vinculado a uma instituição de ensino que utilize a plataforma, seguir as orientações de segurança e manter suas informações de login em segurança.","Para utilizar o PEN Suap, o discente deve possuir um cadastro ativo e estar vinculado a uma instituição de ensino que utilize a plataforma.",0.9999999999,1.0,1.0,0.9968013975458003
Qual é o primeiro passo que um discente deve seguir para acessar o Suap-EDU com o propósito de assinar um documento?,"['Tutorial para que os alunos possam assinar documentos no PEN Suap Lembre-se de que, para utilizar o PEN Suap, é necessário ter um cadastro ativo e estar vinculado a uma instituição de ensino que utilize a plataforma. Além disso, é importante seguir as orientações de segurança e manter suas informações de login em segurança. 1º PASSO: Para acessar o Suap, o discente deve seguir o primeiro passo, que é realizar a conexão com o Suap-EDU. Para isso, é necessário inserir as suas credenciais de login, que consistem em um usuário e senha previamente cadastrados no sistema. 2º PASSO: Na página inicial do Suap, procure no canto superior esquerdo um alerta informando que há um documento eletrônico aguardando sua assinatura. Clique no alerta para acessar o documento\n\n. Aqui, localize o botão ""Definir Identificador"" e clique nele. Isso permitirá que você crie um identificador exclusivo que será usado para assinar o documento. 6º PASSO: Na próxima tela, você precisará inserir sua senha de acesso ao Suap-Edu para autenticar sua assinatura. Digite sua senha no campo fornecido e clique em "" Assinar Documento "". Certifique-se de verificar todas as informações na tela antes de assinar o documento, pois não será possível fazer alterações após a assinatura. 7º PASSO: Parabéns! Agora o documento foi assinado com sucesso e está pronto. Certifique-se de verificar se todas as informações estão corretas e de salvar uma cópia para seus registros. Lembre-se de manter suas informações de acesso seguras e não compartilhá-las com ninguém.\n\n. A seguir são apresentados os passos para a importação do certificado digital ICPEdu para o SUAP. 1º PASSO: Acessar o sistema SUAP pelo link https://suap.ifpi.edu.br/ . Em seguida navegar no menu esquerdo pelo caminho TEC. DA INFORMAÇÃO -> Serviços -> Assinatura Digital -> Certificados Digitais, como mostra a imagem abaixo. OBSERVAÇÃO: Caso essa opção não esteja disponível, é provável que o usuário não possui um dos seguintes perfis: Reitor, Diretor Geral ou Coordenador de Registros Acadêmicos. Para resolver esse problema, abra um chamado na central de serviços como mostra o tutorial Abrindo chamados na Central de Serviços solicitando a adição do perfil necessário para ter acesso a essa funcionalidade']",O primeiro passo que um discente deve seguir para acessar o Suap-EDU com o propósito de assinar um documento é realizar a conexão com o Suap-EDU inserindo suas credenciais de login (usuário e senha previamente cadastrados no sistema).,"O discente deve realizar a conexão com o Suap-EDU, inserindo suas credenciais de login (usuário e senha) previamente cadastradas no sistema.",0.9999999999,1.0,0.6666666666666666,0.9868408442387514
"Após o acesso ao Suap, como o discente deve proceder para localizar um documento eletrônico que requer sua assinatura?","['Tutorial para que os alunos possam assinar documentos no PEN Suap Lembre-se de que, para utilizar o PEN Suap, é necessário ter um cadastro ativo e estar vinculado a uma instituição de ensino que utilize a plataforma. Além disso, é importante seguir as orientações de segurança e manter suas informações de login em segurança. 1º PASSO: Para acessar o Suap, o discente deve seguir o primeiro passo, que é realizar a conexão com o Suap-EDU. Para isso, é necessário inserir as suas credenciais de login, que consistem em um usuário e senha previamente cadastrados no sistema. 2º PASSO: Na página inicial do Suap, procure no canto superior esquerdo um alerta informando que há um documento eletrônico aguardando sua assinatura. Clique no alerta para acessar o documento\n\n. B R . 3º PASSO: Na tela seguinte, o usuário deverá digitar a sua senha cadastrada no G o v . B R e clicar em ""Entrar"" para acessar o SUAP . 4º PASSO: Ao acessar a página inicial do SUAP , o usuário será notificado com uma mensagem informando que há um Documento Eletrônico aguardando assinatura na seção ""ATRIBUÍDOS A MIM"" . Clique sobre a mensagem para acessar o documento e realizar a assinatura eletrônica. 5º PASSO: Na tela seguinte, o usuário deve clicar no ícone de lupa, localizado na coluna ""Ações"" , ao lado do documento que deseja assinar, para acessar a tela de assinatura. 6º PASSO: Após ler o conteúdo do documento, o usuário deve clicar no botão ""Assinar"" e, em seguida, selecionar a opção assinar ""Com G o v\n\n. Aqui, localize o botão ""Definir Identificador"" e clique nele. Isso permitirá que você crie um identificador exclusivo que será usado para assinar o documento. 6º PASSO: Na próxima tela, você precisará inserir sua senha de acesso ao Suap-Edu para autenticar sua assinatura. Digite sua senha no campo fornecido e clique em "" Assinar Documento "". Certifique-se de verificar todas as informações na tela antes de assinar o documento, pois não será possível fazer alterações após a assinatura. 7º PASSO: Parabéns! Agora o documento foi assinado com sucesso e está pronto. Certifique-se de verificar se todas as informações estão corretas e de salvar uma cópia para seus registros. Lembre-se de manter suas informações de acesso seguras e não compartilhá-las com ninguém.']","1. Na página inicial do Suap, procure no canto superior esquerdo um alerta informando que há um documento eletrônico aguardando sua assinatura.
2. Clique no alerta para acessar o documento.
3. Na tela seguinte, clique sobre a mensagem que informa que há um Documento Eletrônico aguardando assinatura na seção ""ATRIBUÍDOS A MIM"" para acessar o documento e realizar a assinatura eletrônica.","Na página inicial do Suap, o discente deve procurar no canto superior esquerdo um alerta indicando a existência de um documento eletrônico aguardando sua assinatura e clicar nele para acessá-lo.",0.9999999999,1.0,1.0,0.7612662872705119
"Após a visualização do documento, qual é a ação subsequente para iniciar o processo de assinatura por parte do discente?","['. Clique no alerta para acessar o documento. Certifique-se de verificar todas as informações do documento antes de prosseguir com a assinatura. 3º PASSO: Na página de Documentos de Texto, localize a Lupa na coluna ""Ações"" ao lado do documento que você deseja visualizar e clique nela. 4º PASSO: Na página seguinte, você verá o documento que precisa ser assinado. Localize o botão ""Assinar"" que fica no canto superior direito. Clique nele para iniciar o processo de assinatura. Certifique-se de seguir todas as instruções na tela com atenção e de fornecer todas as informações necessárias antes de concluir o processo de assinatura."" 5º PASSO: Depois de clicar em ""Assinar com senha"", você será redirecionado para a próxima tela. Aqui, localize o botão ""Definir Identificador"" e clique nele\n\n. Aqui, localize o botão ""Definir Identificador"" e clique nele. Isso permitirá que você crie um identificador exclusivo que será usado para assinar o documento. 6º PASSO: Na próxima tela, você precisará inserir sua senha de acesso ao Suap-Edu para autenticar sua assinatura. Digite sua senha no campo fornecido e clique em "" Assinar Documento "". Certifique-se de verificar todas as informações na tela antes de assinar o documento, pois não será possível fazer alterações após a assinatura. 7º PASSO: Parabéns! Agora o documento foi assinado com sucesso e está pronto. Certifique-se de verificar se todas as informações estão corretas e de salvar uma cópia para seus registros. Lembre-se de manter suas informações de acesso seguras e não compartilhá-las com ninguém.\n\n. Localize o Candidato e clique no botão Documentação do Aluno Visualize a documentação enviada pelo aluno clicando em Documentação Caso a documentação esteja em conformidade , retorne a página da inscrição do aluno e registre a entrega da documentação selecionando o aluno e clicando em Ação >> Registrar entrega de documentação >> Aplicar Registre a data da entrega e clique em Enviar Se toda documentação for entregue e realizado o registro acima, você poderá avançar para a próxima etapa: Visualizar respostas do aluno no Formulário de Caracterização/Inscrição Caso seja identificado alguma pendência na documentação, você poderá possibilitar ao aluno o reenvio do arquivo, alterando o parecer para Pendente de Documentação clicando em adicionar parecer > Pendente de documentação > Salvar']","1. Localize o botão ""Assinar"" na página do documento.
2. Clique no botão ""Assinar"" para iniciar o processo de assinatura.
3. Siga todas as instruções na tela e forneça as informações necessárias.
4. Clique em ""Assinar com senha"" e em seguida clique no botão ""Definir Identificador"".
5. Insira sua senha de acesso ao Suap-Edu e clique em ""Assinar Documento"".","Na página do documento, o discente deve localizar e clicar no botão 'Assinar', que se encontra no canto superior direito, para iniciar o processo.",0.9999999999,1.0,0.4,0.6996554360527106
É possível realizar alterações em um documento eletrônico no Suap após a sua assinatura ser autenticada pelo discente?,"['. Aqui, localize o botão ""Definir Identificador"" e clique nele. Isso permitirá que você crie um identificador exclusivo que será usado para assinar o documento. 6º PASSO: Na próxima tela, você precisará inserir sua senha de acesso ao Suap-Edu para autenticar sua assinatura. Digite sua senha no campo fornecido e clique em "" Assinar Documento "". Certifique-se de verificar todas as informações na tela antes de assinar o documento, pois não será possível fazer alterações após a assinatura. 7º PASSO: Parabéns! Agora o documento foi assinado com sucesso e está pronto. Certifique-se de verificar se todas as informações estão corretas e de salvar uma cópia para seus registros. Lembre-se de manter suas informações de acesso seguras e não compartilhá-las com ninguém.\n\nTutorial para que os alunos possam assinar documentos no PEN Suap Lembre-se de que, para utilizar o PEN Suap, é necessário ter um cadastro ativo e estar vinculado a uma instituição de ensino que utilize a plataforma. Além disso, é importante seguir as orientações de segurança e manter suas informações de login em segurança. 1º PASSO: Para acessar o Suap, o discente deve seguir o primeiro passo, que é realizar a conexão com o Suap-EDU. Para isso, é necessário inserir as suas credenciais de login, que consistem em um usuário e senha previamente cadastrados no sistema. 2º PASSO: Na página inicial do Suap, procure no canto superior esquerdo um alerta informando que há um documento eletrônico aguardando sua assinatura. Clique no alerta para acessar o documento\n\n. 8. Disponível em: https://www.ifpi.edu.br/pen-suap/manuais/manual-pen-suap-para-o-operador-modulo-documento-eletronico/view IMPORTANTE: QUEM PODE ASSINAR? Os Egressos, Pessoa Física e Pessoa Jurídica(representante) terão a permissão apenas para “assinar” documentos internos/nato digitais. Exemplos de documentos internos/nato digitais: • Acordos; • Contratos; • Atas; • Outros afins. ACESSE AS INSTRUÇÕES: Fonte: https://www.ifpi.edu.br/pen-suap/manuais COMO SOLICITAR O CADASTRO DE USUÁRIOS EXTERNOS PARA ASSINATURA DE DOCUMENTOS INTERNOS PARA O MÓDULO DE DOCUMENTOS ELETRÔNICOS? Acesse: https://suap.ifpi.edu.br/centralservicos/listar_area_servico/ O QUE PODE SER FEITO PELA CENTRAL DE SERVIÇOS > PRESTADOR: Acesse o link: https://suap.ifpi.edu']",Não será possível fazer alterações em um documento eletrônico no Suap após a sua assinatura ser autenticada pelo discente.,"Não, após a autenticação da assinatura com a senha do Suap-Edu, não será possível fazer alterações no documento.",0.9999999999,1.0,1.0,0.9980158808194751
"Após clicar em 'Assinar com senha', qual é a etapa para que o discente crie o identificador exclusivo para a assinatura do documento?","['. Aqui, localize o botão ""Definir Identificador"" e clique nele. Isso permitirá que você crie um identificador exclusivo que será usado para assinar o documento. 6º PASSO: Na próxima tela, você precisará inserir sua senha de acesso ao Suap-Edu para autenticar sua assinatura. Digite sua senha no campo fornecido e clique em "" Assinar Documento "". Certifique-se de verificar todas as informações na tela antes de assinar o documento, pois não será possível fazer alterações após a assinatura. 7º PASSO: Parabéns! Agora o documento foi assinado com sucesso e está pronto. Certifique-se de verificar se todas as informações estão corretas e de salvar uma cópia para seus registros. Lembre-se de manter suas informações de acesso seguras e não compartilhá-las com ninguém.\n\n. Clique no alerta para acessar o documento. Certifique-se de verificar todas as informações do documento antes de prosseguir com a assinatura. 3º PASSO: Na página de Documentos de Texto, localize a Lupa na coluna ""Ações"" ao lado do documento que você deseja visualizar e clique nela. 4º PASSO: Na página seguinte, você verá o documento que precisa ser assinado. Localize o botão ""Assinar"" que fica no canto superior direito. Clique nele para iniciar o processo de assinatura. Certifique-se de seguir todas as instruções na tela com atenção e de fornecer todas as informações necessárias antes de concluir o processo de assinatura."" 5º PASSO: Depois de clicar em ""Assinar com senha"", você será redirecionado para a próxima tela. Aqui, localize o botão ""Definir Identificador"" e clique nele\n\n. 6º PASSO: Após ler o conteúdo do documento, o usuário deve clicar no botão ""Assinar"" e, em seguida, selecionar a opção assinar ""Com G o v . B R "" , conforme demonstrado na imagem abaixo: 7º PASSO: Na tela de Assinatura de Documento, o usuário deverá selecionar o * Perfil de Usuário Externo. Em seguida, terá a opção de receber o código de verificação através do aplicativo do G o v . B R (requer instalação prévia no Smartphone) ou por e-mail cadastrado no G o v . B R . Ao receber o código, o usuário deverá inseri-lo no campo de * código de verificação e clicar em ""Assinar Documento - G o v . B R ""']","1. Na próxima tela, o discente deve localizar o botão ""Definir Identificador"" e clicar nele.","O discente será redirecionado para uma nova tela, onde deverá localizar e clicar no botão 'Definir Identificador' para criar seu identificador exclusivo.",0.9999999999,1.0,0.5,0.3597243849232678
Qual é o procedimento inicial para acessar a funcionalidade de Consulta Pública de Processos Eletrônicos no Suap?,"['Passo 01 : Na página inicial do Suap, acessada em suap.ifpi.edu.br , vá até o menu lateral esquerdo e clique em Processos Eletrônicos. Essa funcionalidade também está disponível no portal institucional ifpi.edu.br , no menu Consulta de Processos https://www.ifpi.edu.br/consulta-de-processos , opção Consulta de processos eletrônicos. Passo 02 : Na página digite os dados do processo que você deseja consultar. Será exigido pelo módulo pelo menos um campo preenchido. O usuário poderá fazer a pesquisa com o Número do processo , o Tipo de processo ou mesmo o Assunto , nesse último caso o campo de consulta deverá ser preenchido com no mínimo três palavras\n\n. Por fim, selecione o perfil apropriado, assine com a senha de acesso ao Suap e clique no botão "" ENVIAR "". 7º PASSO: Você será redirecionado para a página com todas as solicitações, e nessa parte da página será exibido o número do processo gerado, conforme ilustrado na imagem abaixo: 8º PASSO: Pronto! O procedimento foi realizado com sucesso, e o processo foi enviado para o setor selecionado pelo usuário inicialmente. Caso você precise visualizar com mais detalhes, basta clicar na lupa, e você será direcionado para a tela com toda a análise, conforme ilustrado na imagem abaixo:\n\n. Clique em Não sou um robô e depois clique em Enviar para consultar Passo 03: Na tela abaixo são listados todos os processos pesquisados pelo usuário, onde pode visualizar o processo com mais detalhes dos trâmites, documentos e a opção “visualizar processo”. OBSERVAÇÃO: processos que contenham documentos públicos serão visualizados na integralidade, contudo, caso contenham documentos restritos, com hipótese legal justificada, a visualização do processo será parcial, sendo visualizados os documentos públicos e tendo limitação de visualização para os documentos restritos. O módulo SUAP ainda não possui a funcionalidade de publicação de documentos restritos com uso de tarjamento nos dados sensíveis como no SEI.']","O procedimento inicial para acessar a funcionalidade de Consulta Pública de Processos Eletrônicos no Suap é acessar a página inicial do Suap em suap.ifpi.edu.br, ir até o menu lateral esquerdo e clicar em Processos Eletrônicos. Além disso, essa funcionalidade também está disponível no portal institucional ifpi.edu.br, no menu Consulta de Processos, opção Consulta de processos eletrônicos.","Na página inicial do Suap (suap.ifpi.edu.br), deve-se acessar o menu lateral esquerdo e clicar em 'Processos Eletrônicos'.",0.9999999999,1.0,0.8333333333333334,1.0
"Além do acesso direto pelo Suap, existe algum outro canal institucional para a Consulta Pública de Processos Eletrônicos?","['Passo 01 : Na página inicial do Suap, acessada em suap.ifpi.edu.br , vá até o menu lateral esquerdo e clique em Processos Eletrônicos. Essa funcionalidade também está disponível no portal institucional ifpi.edu.br , no menu Consulta de Processos https://www.ifpi.edu.br/consulta-de-processos , opção Consulta de processos eletrônicos. Passo 02 : Na página digite os dados do processo que você deseja consultar. Será exigido pelo módulo pelo menos um campo preenchido. O usuário poderá fazer a pesquisa com o Número do processo , o Tipo de processo ou mesmo o Assunto , nesse último caso o campo de consulta deverá ser preenchido com no mínimo três palavras\n\n. Clique em Não sou um robô e depois clique em Enviar para consultar Passo 03: Na tela abaixo são listados todos os processos pesquisados pelo usuário, onde pode visualizar o processo com mais detalhes dos trâmites, documentos e a opção “visualizar processo”. OBSERVAÇÃO: processos que contenham documentos públicos serão visualizados na integralidade, contudo, caso contenham documentos restritos, com hipótese legal justificada, a visualização do processo será parcial, sendo visualizados os documentos públicos e tendo limitação de visualização para os documentos restritos. O módulo SUAP ainda não possui a funcionalidade de publicação de documentos restritos com uso de tarjamento nos dados sensíveis como no SEI.\n\n. Por fim, selecione o perfil apropriado, assine com a senha de acesso ao Suap e clique no botão "" ENVIAR "". 7º PASSO: Você será redirecionado para a página com todas as solicitações, e nessa parte da página será exibido o número do processo gerado, conforme ilustrado na imagem abaixo: 8º PASSO: Pronto! O procedimento foi realizado com sucesso, e o processo foi enviado para o setor selecionado pelo usuário inicialmente. Caso você precise visualizar com mais detalhes, basta clicar na lupa, e você será direcionado para a tela com toda a análise, conforme ilustrado na imagem abaixo:']","Sim, além do acesso direto pelo Suap, é possível acessar a Consulta Pública de Processos Eletrônicos através do portal institucional ifpi.edu.br, no menu Consulta de Processos, na opção Consulta de processos eletrônicos.","Sim, essa funcionalidade também está disponível no portal institucional ifpi.edu.br, no menu 'Consulta de Processos'.",0.9999999999,1.0,1.0,0.7398937073549923
Quais são as orientações de segurança institucional que devem ser repassadas aos discentes quanto ao uso de suas credenciais de acesso ao Suap para assinatura de documentos?,"['Tutorial para que os alunos possam assinar documentos no PEN Suap Lembre-se de que, para utilizar o PEN Suap, é necessário ter um cadastro ativo e estar vinculado a uma instituição de ensino que utilize a plataforma. Além disso, é importante seguir as orientações de segurança e manter suas informações de login em segurança. 1º PASSO: Para acessar o Suap, o discente deve seguir o primeiro passo, que é realizar a conexão com o Suap-EDU. Para isso, é necessário inserir as suas credenciais de login, que consistem em um usuário e senha previamente cadastrados no sistema. 2º PASSO: Na página inicial do Suap, procure no canto superior esquerdo um alerta informando que há um documento eletrônico aguardando sua assinatura. Clique no alerta para acessar o documento\n\n. Aqui, localize o botão ""Definir Identificador"" e clique nele. Isso permitirá que você crie um identificador exclusivo que será usado para assinar o documento. 6º PASSO: Na próxima tela, você precisará inserir sua senha de acesso ao Suap-Edu para autenticar sua assinatura. Digite sua senha no campo fornecido e clique em "" Assinar Documento "". Certifique-se de verificar todas as informações na tela antes de assinar o documento, pois não será possível fazer alterações após a assinatura. 7º PASSO: Parabéns! Agora o documento foi assinado com sucesso e está pronto. Certifique-se de verificar se todas as informações estão corretas e de salvar uma cópia para seus registros. Lembre-se de manter suas informações de acesso seguras e não compartilhá-las com ninguém.\n\nO passo a passo para fazer o processo de autenticação do usuário no sistema SUAP 1º PASSO : Dependendo do caso, o usuário vai ser o SIAPE para o servidor, MATRÍCULA no caso do aluno e o CPF para os terceirizados, bolsistas e afins. 2º PASSO : O processo de autenticação sendo bem-sucedido. O acesso às funcionalidades do sistema será liberado da forma apresentada na tela abaixo, constando no menu esquerdo a foto com o nome do usuário logado e o link "" SAIR "" para fechar a sessão. Caso apareça uma tela com uma mensagem de erro, o usuário deverá rever: - A senha ou usuário estão errados; - O usuário não está cadastrado no sistema; - O usuário está inativo ou sem permissões de acessar o sistema;']",As orientações de segurança institucional que devem ser repassadas aos discentes quanto ao uso de suas credenciais de acesso ao Suap para assinatura de documentos são: manter suas informações de login em segurança e não compartilhá-las com ninguém.,"É fundamental que os discentes sigam as orientações de segurança, mantenham suas informações de login em segurança e não as compartilhem com ninguém.",0.9999999999,1.0,0.75,0.9999999999999999
Quais são os pré-requisitos formais para a geração do crachá institucional via sistema SUAP?,"['Tutorial para geração do crachá Para gerar o crachá, é necessário que o servidor possua foto no perfil do SUAP e que o dado do tipo sanguíneo esteja preenchido. 1 - Clique sobre o seu nome, conforme indicado na imagem abaixo: 2 - Na página seguinte, o servidor deverá clicar em ""Outras Opções"" e, em seguida, selecionar a opção ""Crachá"". 3 - Ao clicar em ""Crachá"" , o servidor deverá escolher um local de salvamento do arquivo. No exemplo, a pasta escolhida foi ""Downloads"" . 4 - O arquivo do crachá pode ser armazenado no Smartphone para apresentação no campus ou pode ser impresso, pois o arquivo está em formato PDF .\n\n. A seguir são apresentados os passos para a importação do certificado digital ICPEdu para o SUAP. 1º PASSO: Acessar o sistema SUAP pelo link https://suap.ifpi.edu.br/ . Em seguida navegar no menu esquerdo pelo caminho TEC. DA INFORMAÇÃO -> Serviços -> Assinatura Digital -> Certificados Digitais, como mostra a imagem abaixo. OBSERVAÇÃO: Caso essa opção não esteja disponível, é provável que o usuário não possui um dos seguintes perfis: Reitor, Diretor Geral ou Coordenador de Registros Acadêmicos. Para resolver esse problema, abra um chamado na central de serviços como mostra o tutorial Abrindo chamados na Central de Serviços solicitando a adição do perfil necessário para ter acesso a essa funcionalidade\n\nQuem faz : Aluno Para realizar os procedimentos a seguir é necessário está logado no sistema SUAP, para mais informações ver: Como fazer Login no SUAP Edu ? Inscrever-se em um Programa Na tela inicial do SUAP na seção de notificações ( Fique Atento! ), inscreva-se clicando no programa com período de inscrição aberto. Para inscrever-se em editais de Benefícios é obrigatório está com a caracterização socioeconômica atualizada Preencha a caraterização socioeconômica e o questionário de inscrição e em seguida clique e Enviar Na próxima seção, preencha corretamente os dados da inscrição com atenção ao quadro de composição do grupo familiar ao final, clique novamente em Continuar Anexe a documentação comprobatória e clique em Continuar Os tipos de arquivos permitidos são: .pdf, .jpeg, .jpg,']","Para gerar o crachá institucional via sistema SUAP, é necessário que o servidor possua foto no perfil do SUAP e que o dado do tipo sanguíneo esteja preenchido.","Para a geração do crachá institucional, é mandatório que o servidor possua foto registrada em seu perfil no SUAP e que o dado referente ao tipo sanguíneo esteja devidamente preenchido.",0.9999999999,1.0,0.5,0.9328608303792504
Qual é a sequência de passos iniciais para acessar a funcionalidade de geração de crachá institucional no sistema SUAP?,"['O passo a passo para fazer o processo de autenticação do usuário no sistema SUAP 1º PASSO : Dependendo do caso, o usuário vai ser o SIAPE para o servidor, MATRÍCULA no caso do aluno e o CPF para os terceirizados, bolsistas e afins. 2º PASSO : O processo de autenticação sendo bem-sucedido. O acesso às funcionalidades do sistema será liberado da forma apresentada na tela abaixo, constando no menu esquerdo a foto com o nome do usuário logado e o link "" SAIR "" para fechar a sessão. Caso apareça uma tela com uma mensagem de erro, o usuário deverá rever: - A senha ou usuário estão errados; - O usuário não está cadastrado no sistema; - O usuário está inativo ou sem permissões de acessar o sistema;\n\nTutorial para geração do crachá Para gerar o crachá, é necessário que o servidor possua foto no perfil do SUAP e que o dado do tipo sanguíneo esteja preenchido. 1 - Clique sobre o seu nome, conforme indicado na imagem abaixo: 2 - Na página seguinte, o servidor deverá clicar em ""Outras Opções"" e, em seguida, selecionar a opção ""Crachá"". 3 - Ao clicar em ""Crachá"" , o servidor deverá escolher um local de salvamento do arquivo. No exemplo, a pasta escolhida foi ""Downloads"" . 4 - O arquivo do crachá pode ser armazenado no Smartphone para apresentação no campus ou pode ser impresso, pois o arquivo está em formato PDF .\n\n. A seguir são apresentados os passos para a importação do certificado digital ICPEdu para o SUAP. 1º PASSO: Acessar o sistema SUAP pelo link https://suap.ifpi.edu.br/ . Em seguida navegar no menu esquerdo pelo caminho TEC. DA INFORMAÇÃO -> Serviços -> Assinatura Digital -> Certificados Digitais, como mostra a imagem abaixo. OBSERVAÇÃO: Caso essa opção não esteja disponível, é provável que o usuário não possui um dos seguintes perfis: Reitor, Diretor Geral ou Coordenador de Registros Acadêmicos. Para resolver esse problema, abra um chamado na central de serviços como mostra o tutorial Abrindo chamados na Central de Serviços solicitando a adição do perfil necessário para ter acesso a essa funcionalidade']","1. Clique sobre o seu nome.
2. Na página seguinte, clique em ""Outras Opções"" e selecione a opção ""Crachá"".
3. Escolha um local de salvamento do arquivo.
4. O arquivo do crachá pode ser armazenado no Smartphone ou impresso, pois está em formato PDF.","O procedimento inicia-se clicando sobre o seu nome no sistema. Subsequentemente, na página seguinte, deve-se selecionar a opção 'Outras Opções' e, em seguida, clicar em 'Crachá'.",0.9999999999,1.0,1.0,0.5108505333188593
Em qual formato o arquivo do crachá institucional é disponibilizado e quais são as opções para seu armazenamento e utilização?,"['Tutorial para geração do crachá Para gerar o crachá, é necessário que o servidor possua foto no perfil do SUAP e que o dado do tipo sanguíneo esteja preenchido. 1 - Clique sobre o seu nome, conforme indicado na imagem abaixo: 2 - Na página seguinte, o servidor deverá clicar em ""Outras Opções"" e, em seguida, selecionar a opção ""Crachá"". 3 - Ao clicar em ""Crachá"" , o servidor deverá escolher um local de salvamento do arquivo. No exemplo, a pasta escolhida foi ""Downloads"" . 4 - O arquivo do crachá pode ser armazenado no Smartphone para apresentação no campus ou pode ser impresso, pois o arquivo está em formato PDF .\n\n. Clique no botão ""Enviar Portfólio"" , selecione o arquivo do relatório final (PDF, máx. 10 MB) e clique em Salvar para concluir o envio. Tela do estudante com a aba ""Estágios e Afins"" selecionada, mostrando as seções: Registros de Estágios, Registros de Aprendizagem, Atividade Profissional Efetiva e Registros de Estágios Docentes com botão ""Enviar Portfólio"". Ao clicar em ""Enviar Portfólio"" , o sistema abrirá um formulário para anexar o relatório final de estágio. Selecione o arquivo no campo Portfólio (PDF, máx. 10 MB) e clique em Salvar para concluir o envio. Atenção: o portfólio deve ser enviado somente após a aprovação do Professor Coordenador de Estágio Docente ou professor orientador. Fique atento ao prazo indicado no campo ""Data Final para Envio do Portfólio""\n\n.pdf, .jpeg, .jpg, .png Tamanho máximo permitido: 20.0 MB Escreva resumidamente o motivo da sua inscrição e clique em Enviar Ao término você receberá a mensagem de confirmação e poderá acompanhar o andamento através da opção Visualize suas inscrições Acompanhe o andamento e resultado da inscrição clicando no perfil do Aluno, na guia Atividades Estudantis Leia com atenção o edital para se informar em relação ao coronograma da seleção Benefícios POLAE - Procedimentos do Aluno']",O arquivo do crachá institucional é disponibilizado no formato PDF. Ele pode ser armazenado no Smartphone para apresentação no campus ou pode ser impresso.,"O arquivo do crachá institucional é disponibilizado no formato PDF. Ele pode ser armazenado em um Smartphone para apresentação no campus ou ser impresso, conforme a necessidade.",0.9999999999,1.0,1.0,0.906830143810898
Qual é a finalidade do cadastro de prestadores de serviço no SUAP e quem são os usuários habilitados para realizar as etapas desse processo?,"['Objetivo: Este manual tem como objetivo orientar os usuários através do processo de cadastro de professores prestadores no SUAP, fornecendo instruções detalhadas e visuais para cada etapa do procedimento. Descrição do Processo: O cadastro de professores prestadores é um processo essencial para o gerenciamento de profissionais externos que prestarão serviços educacionais. Este procedimento garante que todas as informações necessárias sejam coletadas e organizadas de forma adequada no SUAP. ========================================================================================================== 1º PASSO - Busca no Menu Principal Na tela principal do SUAP, no canto superior direito no campo ""Busca menu"" , o servidor irá digitar ""Professor"" e em Ensino clicar no menu Professor\n\nEste tutorial possui 2 etapas Etapa cadastro de prestadores de serviços Para os Cadastradores habilitados (Protocolos Campi) Etapa criação de documentos e solicitação de assinatura Para Setores que criam documentos para serem assinados pelos prestadores de serviços Perfil de Prestadores de Serviço Estagiários e Terceirizados Setor no SUAP: setor ao qual se vinculam Representantes legais de empresas (Pessoa Jurídica) Setor no SUAP: SETOR - EXTERNO-IFPI Egressos* (que necessitam assinar atas de Comissões, Comitês e Conselhos) Setor no SUAP: SETOR - EXTERNO-IFPI Teresina mar/2023 Etapa cadastro de prestadores de serviços: ATENÇÃO: AS SOLICITAÇÕES DE INCLUSÃO DE USUÁRIOS EXTERNOS PARA ASSINATURA DE DOCUMENTOS SERÁ PELA CENTRAL DE SERVIÇOS https://suap.ifpi.edu\n\n. É importante destacar que todas as Categorias, Grupos e Serviços já estarão previamente cadastrados no SUAP. O servidor deve, então, clicar na aba "" Sistemas "". 4º PASSO: Na aba "" Sistemas "", o servidor irá clicar em "" SUAP "" e, em seguida, selecionar o serviço "" Sincronizar Prestador de Serviço "". 5º PASSO: Na página do serviço, o servidor deverá descrever a necessidade de sincronizar o prestador de serviço/avaliador externo, incluindo o nome e CPF na área de "" Descrição "". Em seguida, deve escolher o ""Interessado"" relacionado ao chamado. Se necessário, pode anexar uma captura de tela clicando em "" Anexar Arquivos "" e fazendo o upload do arquivo desejado. Ao finalizar, clique em "" Confirmar "". 6º PASSO: Chamado aberto com sucesso. Na página, será fornecido o número do chamado']",A finalidade do cadastro de prestadores de serviço no SUAP é o gerenciamento de profissionais externos que prestarão serviços educacionais. Os usuários habilitados para realizar as etapas desse processo são os Cadastradores habilitados (Protocolos Campi) e Setores que criam documentos para serem assinados pelos prestadores de serviços.,"O cadastro de prestadores de serviço visa solicitar a assinatura de documentos eletrônicos. O tutorial possui duas etapas: o cadastro de prestadores de serviços é para os Cadastradores habilitados (Protocolos Campi), e a criação de documentos e solicitação de assinatura é para Setores que criam documentos para serem assinados pelos prestadores de serviços.",0.9999999999,1.0,0.3333333333333333,0.9082358886256134
"Quais são os perfis de prestadores de serviço que podem ser cadastrados no sistema SUAP e qual o respectivo setor de vinculação para cada um, conforme as diretrizes institucionais?","['Este tutorial possui 2 etapas Etapa cadastro de prestadores de serviços Para os Cadastradores habilitados (Protocolos Campi) Etapa criação de documentos e solicitação de assinatura Para Setores que criam documentos para serem assinados pelos prestadores de serviços Perfil de Prestadores de Serviço Estagiários e Terceirizados Setor no SUAP: setor ao qual se vinculam Representantes legais de empresas (Pessoa Jurídica) Setor no SUAP: SETOR - EXTERNO-IFPI Egressos* (que necessitam assinar atas de Comissões, Comitês e Conselhos) Setor no SUAP: SETOR - EXTERNO-IFPI Teresina mar/2023 Etapa cadastro de prestadores de serviços: ATENÇÃO: AS SOLICITAÇÕES DE INCLUSÃO DE USUÁRIOS EXTERNOS PARA ASSINATURA DE DOCUMENTOS SERÁ PELA CENTRAL DE SERVIÇOS https://suap.ifpi.edu\n\n. É importante destacar que todas as Categorias, Grupos e Serviços já estarão previamente cadastrados no SUAP. O servidor deve, então, clicar na aba "" Sistemas "". 4º PASSO: Na aba "" Sistemas "", o servidor irá clicar em "" SUAP "" e, em seguida, selecionar o serviço "" Sincronizar Prestador de Serviço "". 5º PASSO: Na página do serviço, o servidor deverá descrever a necessidade de sincronizar o prestador de serviço/avaliador externo, incluindo o nome e CPF na área de "" Descrição "". Em seguida, deve escolher o ""Interessado"" relacionado ao chamado. Se necessário, pode anexar uma captura de tela clicando em "" Anexar Arquivos "" e fazendo o upload do arquivo desejado. Ao finalizar, clique em "" Confirmar "". 6º PASSO: Chamado aberto com sucesso. Na página, será fornecido o número do chamado\n\n. No campo ""Nome de Registro"" , insira o nome do prestador. É importante lembrar que os campos CPF, Sexo, Nacionalidade e Setor são obrigatórios. 3.1.b - No campo ""Setor"" , selecione o setor ""SETOR EXTERNO-IFPI"" , pois não há um setor específico para esses tipos de prestadores de serviço. No campo ""E-mail Secundário"", adicione o e-mail secundário do prestador para que, no primeiro acesso ao Suap, ele possa solicitar a senha de acesso. Após preencher todos os campos obrigatórios, clique em ""Salvar"" . 4º Passo: Para adicionar o setor e a função do prestador, consulte o nome do mesmo na lista de prestadores cadastrados. Você pode fazer isso acessando a opção ""Acesse o Cadastro"" na barra central acima ou clicando na lupa ao lado do lápis']","1. Estagiários e Terceirizados: Setor de vinculação no SUAP: setor ao qual se vinculam.
2. Representantes legais de empresas (Pessoa Jurídica): Setor de vinculação no SUAP: SETOR - EXTERNO-IFPI.
3. Egressos (que necessitam assinar atas de Comissões, Comitês e Conselhos): Setor de vinculação no SUAP: SETOR - EXTERNO-IFPI.","Os perfis incluem Estagiários e Terceirizados, vinculados ao setor ao qual se ligam; Representantes legais de empresas (Pessoa Jurídica), vinculados ao SETOR - EXTERNO-IFPI; e Egressos que necessitam assinar atas de Comissões, Comitês e Conselhos, também vinculados ao SETOR - EXTERNO-IFPI.",0.9999999999,1.0,0.6666666666666666,0.7001451770993193
"Para iniciar o processo de cadastro de um prestador de serviço no SUAP, qual é o primeiro passo administrativo a ser executado no menu lateral do sistema?","['. É importante destacar que todas as Categorias, Grupos e Serviços já estarão previamente cadastrados no SUAP. O servidor deve, então, clicar na aba "" Sistemas "". 4º PASSO: Na aba "" Sistemas "", o servidor irá clicar em "" SUAP "" e, em seguida, selecionar o serviço "" Sincronizar Prestador de Serviço "". 5º PASSO: Na página do serviço, o servidor deverá descrever a necessidade de sincronizar o prestador de serviço/avaliador externo, incluindo o nome e CPF na área de "" Descrição "". Em seguida, deve escolher o ""Interessado"" relacionado ao chamado. Se necessário, pode anexar uma captura de tela clicando em "" Anexar Arquivos "" e fazendo o upload do arquivo desejado. Ao finalizar, clique em "" Confirmar "". 6º PASSO: Chamado aberto com sucesso. Na página, será fornecido o número do chamado\n\n. No campo ""Nome de Registro "", insira o nome do prestador. É importante lembrar que os campos CPF, Sexo, Nacionalidade e Setor são obrigatórios. 3.1.a - No campo ""Setor "", selecione o setor em que o prestador de serviço ficará lotado. No campo ""E-mail Secundário"" , adicione o e-mail secundário do prestador para que, no primeiro acesso ao Suap, ele possa solicitar a senha de acesso. Após preencher todos os campos obrigatórios, clique em ""Salvar"" . 3º Passo B (para Representantes de Pessoas Jurídicas, Autônomos, Pessoas Física e Egressos): Na tela de cadastro, preencha os dados do Prestador de Serviço solicitados. No campo ""Nome de Registro"" , insira o nome do prestador. É importante lembrar que os campos CPF, Sexo, Nacionalidade e Setor são obrigatórios. 3.1\n\n. No campo ""Nome de Registro"" , insira o nome do prestador. É importante lembrar que os campos CPF, Sexo, Nacionalidade e Setor são obrigatórios. 3.1.b - No campo ""Setor"" , selecione o setor ""SETOR EXTERNO-IFPI"" , pois não há um setor específico para esses tipos de prestadores de serviço. No campo ""E-mail Secundário"", adicione o e-mail secundário do prestador para que, no primeiro acesso ao Suap, ele possa solicitar a senha de acesso. Após preencher todos os campos obrigatórios, clique em ""Salvar"" . 4º Passo: Para adicionar o setor e a função do prestador, consulte o nome do mesmo na lista de prestadores cadastrados. Você pode fazer isso acessando a opção ""Acesse o Cadastro"" na barra central acima ou clicando na lupa ao lado do lápis']","1. Clicar na aba ""Sistemas"".","O primeiro passo é acessar a opção ADMINISTRAÇÃO no menu lateral, em seguida selecionar 'Cadastros' e, posteriormente, clicar em 'Prestadores de Serviço'.",0.9999999999,1.0,1.0,0.0
"Após navegar até a tela de 'Prestadores de Serviço', qual é a ação subsequente para incluir um novo registro de prestador no sistema?","['. Descrição: Este botão dará acesso ao formulário de cadastro do novo professor prestador. ----------------------------------------------------------------------------------------------------------------------------------- 3º PASSO - Preenchimento dos Dados Pessoais Na tela ""Adicionar Professor Prestador de Serviço"" , o servidor vai cadastrar o docente prestador com os dados obrigatórios como nome, nacionalidade, sexo e naturalidade. Descrição: Preencha todos os campos obrigatórios relacionados às informações pessoais do professor prestador\n\n.ifpi.edu.br/centralservicos/listar_area_servico/ , selecione a aba criada para essa finalidade. 1º Passo: No menu lateral, acesse a opção ADMINISTRAÇÃO e selecione Cadastros. Em seguida, clique em Prestadores de Serviço . 2º Passo: Na tela de Prestadores de Serviço, clique no botão Adicionar Prestadores de serviço , localizado no canto superior direito da página. A URL para acessar essa tela é https://suap.ifpi.edu.br/admin/comum/prestadorservico/ 3º Passo A (Estagiários e Terceirizados): Na tela de cadastro, preencha os dados do Prestador de Serviço solicitados. No campo ""Nome de Registro "", insira o nome do prestador. É importante lembrar que os campos CPF, Sexo, Nacionalidade e Setor são obrigatórios. 3.1\n\n. No campo ""Nome de Registro"" , insira o nome do prestador. É importante lembrar que os campos CPF, Sexo, Nacionalidade e Setor são obrigatórios. 3.1.b - No campo ""Setor"" , selecione o setor ""SETOR EXTERNO-IFPI"" , pois não há um setor específico para esses tipos de prestadores de serviço. No campo ""E-mail Secundário"", adicione o e-mail secundário do prestador para que, no primeiro acesso ao Suap, ele possa solicitar a senha de acesso. Após preencher todos os campos obrigatórios, clique em ""Salvar"" . 4º Passo: Para adicionar o setor e a função do prestador, consulte o nome do mesmo na lista de prestadores cadastrados. Você pode fazer isso acessando a opção ""Acesse o Cadastro"" na barra central acima ou clicando na lupa ao lado do lápis']","Para incluir um novo registro de prestador no sistema após navegar até a tela de 'Prestadores de Serviço', a ação subsequente é preencher os dados do Prestador de Serviço solicitados, como nome, CPF, Sexo, Nacionalidade e Setor. Após preencher esses campos obrigatórios, clique em ""Salvar"".","Na tela de Prestadores de Serviço, o próximo passo é clicar no botão 'Adicionar Prestadores de serviço', que se encontra no canto superior direito da página.",0.9999999999,1.0,1.0,0.765534354192253
"No processo de cadastro de Estagiários e Terceirizados, quais são os campos de preenchimento obrigatório na tela de inclusão de prestadores de serviço?","['.ifpi.edu.br/centralservicos/listar_area_servico/ , selecione a aba criada para essa finalidade. 1º Passo: No menu lateral, acesse a opção ADMINISTRAÇÃO e selecione Cadastros. Em seguida, clique em Prestadores de Serviço . 2º Passo: Na tela de Prestadores de Serviço, clique no botão Adicionar Prestadores de serviço , localizado no canto superior direito da página. A URL para acessar essa tela é https://suap.ifpi.edu.br/admin/comum/prestadorservico/ 3º Passo A (Estagiários e Terceirizados): Na tela de cadastro, preencha os dados do Prestador de Serviço solicitados. No campo ""Nome de Registro "", insira o nome do prestador. É importante lembrar que os campos CPF, Sexo, Nacionalidade e Setor são obrigatórios. 3.1\n\n. No campo ""Nome de Registro "", insira o nome do prestador. É importante lembrar que os campos CPF, Sexo, Nacionalidade e Setor são obrigatórios. 3.1.a - No campo ""Setor "", selecione o setor em que o prestador de serviço ficará lotado. No campo ""E-mail Secundário"" , adicione o e-mail secundário do prestador para que, no primeiro acesso ao Suap, ele possa solicitar a senha de acesso. Após preencher todos os campos obrigatórios, clique em ""Salvar"" . 3º Passo B (para Representantes de Pessoas Jurídicas, Autônomos, Pessoas Física e Egressos): Na tela de cadastro, preencha os dados do Prestador de Serviço solicitados. No campo ""Nome de Registro"" , insira o nome do prestador. É importante lembrar que os campos CPF, Sexo, Nacionalidade e Setor são obrigatórios. 3.1\n\n. Descrição: Preencha todos os campos obrigatórios relacionados às informações pessoais do professor prestador. ----------------------------------------------------------------------------------------------------------------------------------- 4º PASSO - Preenchimento dos Dados Complementares Na tela ""Adicionar Professor Prestador de Serviço"" , logo mais abaixo, o servidor vai cadastrar também os dados de contatos, dados do professor e dados da formação. Ao final, clique no botão ""Salvar"" . Descrição: Complete o cadastro com informações de contato, dados profissionais e formação acadêmica antes de salvar']","Os campos de preenchimento obrigatório na tela de inclusão de prestadores de serviço para Estagiários e Terceirizados são: ""Nome de Registro"", CPF, Sexo, Nacionalidade e Setor.","Para o cadastro de Estagiários e Terceirizados, os campos obrigatórios são 'Nome de Registro', CPF, Sexo, Nacionalidade e Setor.",0.9999999999,1.0,1.0,0.9240194330855418
Qual a função do campo 'E-mail Secundário' no cadastro de prestadores de serviço e quando ele deve ser utilizado?,"['. No campo ""Nome de Registro "", insira o nome do prestador. É importante lembrar que os campos CPF, Sexo, Nacionalidade e Setor são obrigatórios. 3.1.a - No campo ""Setor "", selecione o setor em que o prestador de serviço ficará lotado. No campo ""E-mail Secundário"" , adicione o e-mail secundário do prestador para que, no primeiro acesso ao Suap, ele possa solicitar a senha de acesso. Após preencher todos os campos obrigatórios, clique em ""Salvar"" . 3º Passo B (para Representantes de Pessoas Jurídicas, Autônomos, Pessoas Física e Egressos): Na tela de cadastro, preencha os dados do Prestador de Serviço solicitados. No campo ""Nome de Registro"" , insira o nome do prestador. É importante lembrar que os campos CPF, Sexo, Nacionalidade e Setor são obrigatórios. 3.1\n\n. No campo ""Nome de Registro"" , insira o nome do prestador. É importante lembrar que os campos CPF, Sexo, Nacionalidade e Setor são obrigatórios. 3.1.b - No campo ""Setor"" , selecione o setor ""SETOR EXTERNO-IFPI"" , pois não há um setor específico para esses tipos de prestadores de serviço. No campo ""E-mail Secundário"", adicione o e-mail secundário do prestador para que, no primeiro acesso ao Suap, ele possa solicitar a senha de acesso. Após preencher todos os campos obrigatórios, clique em ""Salvar"" . 4º Passo: Para adicionar o setor e a função do prestador, consulte o nome do mesmo na lista de prestadores cadastrados. Você pode fazer isso acessando a opção ""Acesse o Cadastro"" na barra central acima ou clicando na lupa ao lado do lápis\n\n.ifpi.edu.br/centralservicos/listar_area_servico/ , selecione a aba criada para essa finalidade. 1º Passo: No menu lateral, acesse a opção ADMINISTRAÇÃO e selecione Cadastros. Em seguida, clique em Prestadores de Serviço . 2º Passo: Na tela de Prestadores de Serviço, clique no botão Adicionar Prestadores de serviço , localizado no canto superior direito da página. A URL para acessar essa tela é https://suap.ifpi.edu.br/admin/comum/prestadorservico/ 3º Passo A (Estagiários e Terceirizados): Na tela de cadastro, preencha os dados do Prestador de Serviço solicitados. No campo ""Nome de Registro "", insira o nome do prestador. É importante lembrar que os campos CPF, Sexo, Nacionalidade e Setor são obrigatórios. 3.1']","A função do campo 'E-mail Secundário' no cadastro de prestadores de serviço é permitir que, no primeiro acesso ao Suap, o prestador possa solicitar a senha de acesso. Ele deve ser utilizado para fornecer um e-mail alternativo para contato e recuperação de senha.",O campo 'E-mail Secundário' deve ser preenchido para que o prestador de serviço possa solicitar a senha de acesso no seu primeiro acesso ao Suap.,0.9999999999,1.0,0.5,0.9326254730711289
Onde devem ser protocoladas as solicitações de inclusão de usuários externos para fins de assinatura de documentos no SUAP?,"['. 8. Disponível em: https://www.ifpi.edu.br/pen-suap/manuais/manual-pen-suap-para-o-operador-modulo-documento-eletronico/view IMPORTANTE: QUEM PODE ASSINAR? Os Egressos, Pessoa Física e Pessoa Jurídica(representante) terão a permissão apenas para “assinar” documentos internos/nato digitais. Exemplos de documentos internos/nato digitais: • Acordos; • Contratos; • Atas; • Outros afins. ACESSE AS INSTRUÇÕES: Fonte: https://www.ifpi.edu.br/pen-suap/manuais COMO SOLICITAR O CADASTRO DE USUÁRIOS EXTERNOS PARA ASSINATURA DE DOCUMENTOS INTERNOS PARA O MÓDULO DE DOCUMENTOS ELETRÔNICOS? Acesse: https://suap.ifpi.edu.br/centralservicos/listar_area_servico/ O QUE PODE SER FEITO PELA CENTRAL DE SERVIÇOS > PRESTADOR: Acesse o link: https://suap.ifpi.edu\n\nObjetivo: Fornecer instruções claras e precisas para que o usuário externo possa assinar digitalmente um documento no PEN Suap, seguindo um passo a passo simples e fácil de entender. 1º PASSO: O usuário deverá acessar o SUAP (acesse aqui) utilizando sua conta do G o v . B R . 2º PASSO: O usuário deverá realizar o login através do portal do G o v . B R . Para isso, será necessário informar o número do CPF como usuário e, em seguida, clicar em Continuar. O sistema redirecionará o usuário para a página de autenticação do G o v . B R . 3º PASSO: Na tela seguinte, o usuário deverá digitar a sua senha cadastrada no G o v . B R e clicar em ""Entrar"" para acessar o SUAP\n\nEste tutorial possui 2 etapas Etapa cadastro de prestadores de serviços Para os Cadastradores habilitados (Protocolos Campi) Etapa criação de documentos e solicitação de assinatura Para Setores que criam documentos para serem assinados pelos prestadores de serviços Perfil de Prestadores de Serviço Estagiários e Terceirizados Setor no SUAP: setor ao qual se vinculam Representantes legais de empresas (Pessoa Jurídica) Setor no SUAP: SETOR - EXTERNO-IFPI Egressos* (que necessitam assinar atas de Comissões, Comitês e Conselhos) Setor no SUAP: SETOR - EXTERNO-IFPI Teresina mar/2023 Etapa cadastro de prestadores de serviços: ATENÇÃO: AS SOLICITAÇÕES DE INCLUSÃO DE USUÁRIOS EXTERNOS PARA ASSINATURA DE DOCUMENTOS SERÁ PELA CENTRAL DE SERVIÇOS https://suap.ifpi.edu']","As solicitações de inclusão de usuários externos para assinatura de documentos no SUAP devem ser protocoladas pela Central de Serviços, acessando o link: https://suap.ifpi.edu.","As solicitações de inclusão de usuários externos para assinatura de documentos devem ser realizadas pela Central de Serviços, acessível em https://suap.ifpi.edu.br/centralservicos/listar_area_servico/, selecionando a aba específica para essa finalidade.",0.9999999999,1.0,0.5,0.9758817851339391
Qual o procedimento formal para cadastrar um novo edital de projetos de ensino no sistema?,"['Cadastro do edital para seleção de projetos de ensino. Ação executada pelo Gerente Sistêmico de Projetos de Ensino ou Coordenador de Projetos de Ensino. 1º PASSO: Acesso o menu ""Ensino :: Projetos :: Editais :: Gerenciar Editais"" 2º PASSO: Vejo a página ""Editais"" 3º PASSO: Clico no botão ""Adicionar Edital"" 4º PASSO: Vejo a página ""Adicionar Edital"" 5º PASSO: Preencho o formulário com os dados 6º PASSO: Clico no botão ""Salvar"" 7º PASSO: Vejo mensagem de sucesso ""Edital cadastrado com sucesso.""\n\nCadastro do edital para seleção de projetos de ensino. Ação executada pelo Gerente Sistêmico de Projetos de Ensino ou Coordenador de Projetos de Ensino. 1º PASSO: Acesso o menu ""Ensino :: Projetos :: Editais :: Gerenciar Editais"" 2º PASSO: Vejo a página ""Editais"" 3º PASSO: Clico no botão ""Adicionar Edital"" 4º PASSO: Vejo a página ""Adicionar Edital"" 5º PASSO: Preencho o formulário com os dados 6º PASSO: Clico no botão ""Salvar"" 7º PASSO: Vejo mensagem de sucesso ""Edital cadastrado com sucesso.""\n\n. Ação executada pelo Gerente Sistêmico de Projetos de Ensino ou Coordenador de Projetos de Ensino. 1º PASSO: Acesso o menu ""Ensino :: Projetos :: Editais :: Gerenciar Editais"" 2º PASSO: Vejo a página ""Editais"" 3º PASSO: Olho para a listagem 4º PASSO: Olho a linha ""Nome do edital"" 5º PASSO: Clico no ícone de exibição 6º PASSO: Vejo a página ""Nome do edital - Edital de Ensino"" 7º PASSO: Clico na aba ""Fonte de Recursos"" 8º PASSO: Clico no botão ""Adicionar Recurso"" 9º PASSO: Preencho o formulário com os dados 10º PASSO: Clico no botão ""Salvar"" 11º PASSO: Vejo mensagem de sucesso ""Recurso adicionado com sucesso.""']","Para cadastrar um novo edital de projetos de ensino no sistema, siga os passos abaixo:
1. Acesse o menu ""Ensino :: Projetos :: Editais :: Gerenciar Editais"".
2. Clique no botão ""Adicionar Edital"".
3. Preencha o formulário com os dados necessários.
4. Clique no botão ""Salvar"".
5. Aguarde a mensagem de sucesso ""Edital cadastrado com sucesso.""","O procedimento para cadastrar um novo edital de projetos de ensino inicia-se acessando o menu ""Ensino :: Projetos :: Editais :: Gerenciar Editais"", seguido de clicar em ""Adicionar Edital"", preencher o formulário com os dados requeridos e, por fim, clicar em ""Salvar"".",0.9999999999,1.0,1.0,0.9474382238384372
Quais são os perfis de usuário autorizados a realizar o cadastro de um edital para seleção de projetos de ensino?,"['Cadastro do edital para seleção de projetos de ensino. Ação executada pelo Gerente Sistêmico de Projetos de Ensino ou Coordenador de Projetos de Ensino. 1º PASSO: Acesso o menu ""Ensino :: Projetos :: Editais :: Gerenciar Editais"" 2º PASSO: Vejo a página ""Editais"" 3º PASSO: Clico no botão ""Adicionar Edital"" 4º PASSO: Vejo a página ""Adicionar Edital"" 5º PASSO: Preencho o formulário com os dados 6º PASSO: Clico no botão ""Salvar"" 7º PASSO: Vejo mensagem de sucesso ""Edital cadastrado com sucesso.""\n\nCadastro do edital para seleção de projetos de ensino. Ação executada pelo Gerente Sistêmico de Projetos de Ensino ou Coordenador de Projetos de Ensino. 1º PASSO: Acesso o menu ""Ensino :: Projetos :: Editais :: Gerenciar Editais"" 2º PASSO: Vejo a página ""Editais"" 3º PASSO: Clico no botão ""Adicionar Edital"" 4º PASSO: Vejo a página ""Adicionar Edital"" 5º PASSO: Preencho o formulário com os dados 6º PASSO: Clico no botão ""Salvar"" 7º PASSO: Vejo mensagem de sucesso ""Edital cadastrado com sucesso.""\n\nDefinição dos critérios que serão utilizados para avaliar os projetos submetidos. Ação executada pelo Gerente Sistêmico de Projetos de Ensino ou Coordenador de Projetos de Ensino. 1º PASSO: Acesso o menu ""Ensino :: Projetos :: Editais :: Gerenciar Editais"" 2º PASSO: Vejo a página ""Editais"" 3º PASSO: Olho para a listagem 4º PASSO: Olho a linha ""Nome do edital"" 5º PASSO: Clico no ícone de exibição 6º PASSO: Vejo a página ""Nome do edital - Edital de Ensino"" 7º PASSO: Clico na aba ""Critérios de Avaliação da Qualificação do Projeto"" 8º PASSO: Clico no botão ""Adicionar Critério de Avaliação"" 9º PASSO: Preencho o formulário com os dados 10º PASSO: Clico no botão ""Salvar"" 11º PASSO: Vejo mensagem de sucesso ""Critério de avaliação adicionado com sucesso.""']",Os perfis de usuário autorizados a realizar o cadastro de um edital para seleção de projetos de ensino são o Gerente Sistêmico de Projetos de Ensino e o Coordenador de Projetos de Ensino.,O cadastro de um edital para seleção de projetos de ensino é uma ação executada pelo Gerente Sistêmico de Projetos de Ensino ou pelo Coordenador de Projetos de Ensino.,0.9999999999,1.0,1.0,1.0
Como devo proceder para adicionar um plano de oferta por campus a um edital já existente?,"['O Plano de Oferta define a abrangência do edital. Apenas servidores dos campi inseridos no Plano de Oferta poderão submeter projetos. Ação executada pelo Gerente Sistêmico de Projetos de Ensino ou Coordenador de Projetos de Ensino. 1º PASSO: Acesso o menu ""Ensino :: Projetos :: Editais :: Gerenciar Editais"" 2º PASSO: Vejo a página ""Editais"" 3º PASSO: Olho para a listagem 4º PASSO: Olho a linha ""Nome do edital"" 5º PASSO: Clico no ícone de exibição 6º PASSO: Vejo a página ""Nome do edital - Edital de Ensino"" 7º PASSO: Clico na aba ""Plano de Oferta por Campus"" 8º PASSO: Clico no botão ""Adicionar Oferta"" 9º PASSO: Preencho o formulário com os dados 10º PASSO: Clico no botão ""Salvar"" 11º PASSO: Vejo mensagem de sucesso ""Oferta adicionada com sucesso.""\n\nO Plano de Oferta define a abrangência do edital. Apenas servidores dos campi inseridos no Plano de Oferta poderão submeter projetos. Ação executada pelo Gerente Sistêmico de Projetos de Ensino ou Coordenador de Projetos de Ensino. 1º PASSO: Acesso o menu ""Ensino :: Projetos :: Editais :: Gerenciar Editais"" 2º PASSO: Vejo a página ""Editais"" 3º PASSO: Olho para a listagem 4º PASSO: Olho a linha ""Nome do edital"" 5º PASSO: Clico no ícone de exibição 6º PASSO: Vejo a página ""Nome do edital - Edital de Ensino"" 7º PASSO: Clico na aba ""Plano de Oferta por Campus"" 8º PASSO: Clico no botão ""Adicionar Oferta"" 9º PASSO: Preencho o formulário com os dados 10º PASSO: Clico no botão ""Salvar"" 11º PASSO: Vejo mensagem de sucesso ""Oferta adicionada com sucesso.""\n\n. Exemplo: CANG Edital 01/2023 - 1 Semestre Descrição : Nesse campo é necessário informar os dados básicos do edital (número, período de vigência, data de inscrição, modalidade de auxílios ofertados, público e outras informações que o campus julgas necessário) Campus : Selecionar a sigla do campus correspondente. Atendimentos Incluídos : Selecionar os auxílios oferecidos no edital, inclusive o de mesmo nome do beneficio ofertado , e clicar em ""escolher"". Caso haja alguma seleção errada, selecionar a modalidade e selecionar ""remover"". Impedir que aluno solicite benefício ? NÃO SELECIONAR Público-Alvo : Selecionar a sigla do campus correspondente e clicar em ""escolher"" Acione o botão Salvar Benefícios POLAE - Procedimentos do setor de Serviço Social ou Comissão de Assistência Estudantil']","1. Acesse o menu ""Ensino :: Projetos :: Editais :: Gerenciar Editais"".
2. Na página ""Editais"", clique no ícone de exibição do edital desejado.
3. Na página do edital, clique na aba ""Plano de Oferta por Campus"".
4. Clique no botão ""Adicionar Oferta"".
5. Preencha o formulário com os dados necessários.
6. Clique no botão ""Salvar"".
7. Verifique a mensagem de sucesso ""Oferta adicionada com sucesso"".","Para adicionar um plano de oferta por campus, acesse ""Ensino :: Projetos :: Editais :: Gerenciar Editais"", localize o edital na listagem e clique no ícone de exibição. Na página do edital, selecione a aba ""Plano de Oferta por Campus"", clique em ""Adicionar Oferta"", preencha o formulário e salve.",0.9999999999,1.0,1.0,0.5853327624535128
Qual a finalidade do cadastro do Plano de Oferta por Campus em um edital de projetos de ensino?,"['O Plano de Oferta define a abrangência do edital. Apenas servidores dos campi inseridos no Plano de Oferta poderão submeter projetos. Ação executada pelo Gerente Sistêmico de Projetos de Ensino ou Coordenador de Projetos de Ensino. 1º PASSO: Acesso o menu ""Ensino :: Projetos :: Editais :: Gerenciar Editais"" 2º PASSO: Vejo a página ""Editais"" 3º PASSO: Olho para a listagem 4º PASSO: Olho a linha ""Nome do edital"" 5º PASSO: Clico no ícone de exibição 6º PASSO: Vejo a página ""Nome do edital - Edital de Ensino"" 7º PASSO: Clico na aba ""Plano de Oferta por Campus"" 8º PASSO: Clico no botão ""Adicionar Oferta"" 9º PASSO: Preencho o formulário com os dados 10º PASSO: Clico no botão ""Salvar"" 11º PASSO: Vejo mensagem de sucesso ""Oferta adicionada com sucesso.""\n\nO Plano de Oferta define a abrangência do edital. Apenas servidores dos campi inseridos no Plano de Oferta poderão submeter projetos. Ação executada pelo Gerente Sistêmico de Projetos de Ensino ou Coordenador de Projetos de Ensino. 1º PASSO: Acesso o menu ""Ensino :: Projetos :: Editais :: Gerenciar Editais"" 2º PASSO: Vejo a página ""Editais"" 3º PASSO: Olho para a listagem 4º PASSO: Olho a linha ""Nome do edital"" 5º PASSO: Clico no ícone de exibição 6º PASSO: Vejo a página ""Nome do edital - Edital de Ensino"" 7º PASSO: Clico na aba ""Plano de Oferta por Campus"" 8º PASSO: Clico no botão ""Adicionar Oferta"" 9º PASSO: Preencho o formulário com os dados 10º PASSO: Clico no botão ""Salvar"" 11º PASSO: Vejo mensagem de sucesso ""Oferta adicionada com sucesso.""\n\nCadastro do edital para seleção de projetos de ensino. Ação executada pelo Gerente Sistêmico de Projetos de Ensino ou Coordenador de Projetos de Ensino. 1º PASSO: Acesso o menu ""Ensino :: Projetos :: Editais :: Gerenciar Editais"" 2º PASSO: Vejo a página ""Editais"" 3º PASSO: Clico no botão ""Adicionar Edital"" 4º PASSO: Vejo a página ""Adicionar Edital"" 5º PASSO: Preencho o formulário com os dados 6º PASSO: Clico no botão ""Salvar"" 7º PASSO: Vejo mensagem de sucesso ""Edital cadastrado com sucesso.""']","O cadastro do Plano de Oferta por Campus em um edital de projetos de ensino tem como finalidade definir a abrangência do edital, permitindo que apenas servidores dos campi inseridos nesse plano possam submeter projetos.","O Plano de Oferta por Campus define a abrangência do edital, sendo que apenas servidores dos campi inseridos nesse plano estarão aptos a submeter projetos.",0.9999999999,1.0,1.0,1.0
Poderia detalhar os passos para o cadastramento de fontes de recurso para um edital específico?,"['. Ação executada pelo Gerente Sistêmico de Projetos de Ensino ou Coordenador de Projetos de Ensino. 1º PASSO: Acesso o menu ""Ensino :: Projetos :: Editais :: Gerenciar Editais"" 2º PASSO: Vejo a página ""Editais"" 3º PASSO: Olho para a listagem 4º PASSO: Olho a linha ""Nome do edital"" 5º PASSO: Clico no ícone de exibição 6º PASSO: Vejo a página ""Nome do edital - Edital de Ensino"" 7º PASSO: Clico na aba ""Fonte de Recursos"" 8º PASSO: Clico no botão ""Adicionar Recurso"" 9º PASSO: Preencho o formulário com os dados 10º PASSO: Clico no botão ""Salvar"" 11º PASSO: Vejo mensagem de sucesso ""Recurso adicionado com sucesso.""\n\n. Ação executada pelo Gerente Sistêmico de Projetos de Ensino ou Coordenador de Projetos de Ensino. 1º PASSO: Acesso o menu ""Ensino :: Projetos :: Editais :: Gerenciar Editais"" 2º PASSO: Vejo a página ""Editais"" 3º PASSO: Olho para a listagem 4º PASSO: Olho a linha ""Nome do edital"" 5º PASSO: Clico no ícone de exibição 6º PASSO: Vejo a página ""Nome do edital - Edital de Ensino"" 7º PASSO: Clico na aba ""Fonte de Recursos"" 8º PASSO: Clico no botão ""Adicionar Recurso"" 9º PASSO: Preencho o formulário com os dados 10º PASSO: Clico no botão ""Salvar"" 11º PASSO: Vejo mensagem de sucesso ""Recurso adicionado com sucesso.""\n\nCadastro do edital para seleção de projetos de ensino. Ação executada pelo Gerente Sistêmico de Projetos de Ensino ou Coordenador de Projetos de Ensino. 1º PASSO: Acesso o menu ""Ensino :: Projetos :: Editais :: Gerenciar Editais"" 2º PASSO: Vejo a página ""Editais"" 3º PASSO: Clico no botão ""Adicionar Edital"" 4º PASSO: Vejo a página ""Adicionar Edital"" 5º PASSO: Preencho o formulário com os dados 6º PASSO: Clico no botão ""Salvar"" 7º PASSO: Vejo mensagem de sucesso ""Edital cadastrado com sucesso.""']","1. Acesse o menu ""Ensino :: Projetos :: Editais :: Gerenciar Editais"";
2. Na página ""Editais"", clique no ícone de exibição do edital desejado;
3. Na página do edital, clique na aba ""Fonte de Recursos"";
4. Clique no botão ""Adicionar Recurso"";
5. Preencha o formulário com os dados necessários;
6. Clique no botão ""Salvar"";
7. Verifique a mensagem de sucesso ""Recurso adicionado com sucesso"".","O cadastramento de fontes de recurso para um edital específico envolve acessar ""Ensino :: Projetos :: Editais :: Gerenciar Editais"", selecionar o edital desejado clicando no ícone de exibição, ir para a aba ""Fonte de Recursos"", clicar em ""Adicionar Recurso"", preencher o formulário com os dados e, em seguida, clicar em ""Salvar"".",0.9999999999,1.0,1.0,0.731192425613243
Qual a implicação do valor informado ao cadastrar as fontes de recurso de um edital?,"[""O valor informado deverá ser o máximo que cada projeto aprovado poderá gastar na respectiva despesa(rubrica). Este valor servirá como base para o coordenador do projeto definir a memória de cálculo e o plano de desembolso. Ação executada pelo Gerente Sistêmico de Projetos de Ensino ou Coordenador de Projetos de Ensino\n\nO valor informado deverá ser o máximo que cada projeto aprovado poderá gastar na respectiva despesa(rubrica). Este valor servirá como base para o coordenador do projeto definir a memória de cálculo e o plano de desembolso. Ação executada pelo Gerente Sistêmico de Projetos de Ensino ou Coordenador de Projetos de Ensino\n\nA memória de cálculo serve para descrever em detalhes os gastos que serão realizados no projeto. Nesta aba do projeto existe o Demonstrativo do Plano de Aplicação/Memória de Cálculo e Desembolso, onde, na coluna 'Valor Reservado' consta o valor total disponível para o projeto na rubrica em específico, conforme cadastrado na fonte de recurso do edital. Na seção 'Planejado', a coluna 'Valor Planejado' exibe a soma de todas as memórias de cálculo cadastradas pelo coordenador do projeto. Já na coluna 'Valor Distribuído' consta a soma de todos os desembolsos que foram cadastrados pelo coordenador e na coluna 'Valor Disponível' consta a diferença entre a soma das memórias de cálculo e a soma dos desembolsos""]",A implicação do valor informado ao cadastrar as fontes de recurso de um edital é que esse valor será o máximo que cada projeto aprovado poderá gastar na respectiva despesa (rubrica). Esse valor servirá como base para o coordenador do projeto definir a memória de cálculo e o plano de desembolso.,"O valor informado no cadastro das fontes de recurso do edital representa o montante máximo que cada projeto aprovado poderá gastar na respectiva despesa (rubrica), servindo como base para o coordenador do projeto definir a memória de cálculo e o plano de desembolso.",0.9999999999,1.0,1.0,0.9953078268701278
Qual a função da seção de Cadastro dos Critérios de Avaliação do Edital?,"['Definição dos critérios que serão utilizados para avaliar os projetos submetidos. Ação executada pelo Gerente Sistêmico de Projetos de Ensino ou Coordenador de Projetos de Ensino. 1º PASSO: Acesso o menu ""Ensino :: Projetos :: Editais :: Gerenciar Editais"" 2º PASSO: Vejo a página ""Editais"" 3º PASSO: Olho para a listagem 4º PASSO: Olho a linha ""Nome do edital"" 5º PASSO: Clico no ícone de exibição 6º PASSO: Vejo a página ""Nome do edital - Edital de Ensino"" 7º PASSO: Clico na aba ""Critérios de Avaliação da Qualificação do Projeto"" 8º PASSO: Clico no botão ""Adicionar Critério de Avaliação"" 9º PASSO: Preencho o formulário com os dados 10º PASSO: Clico no botão ""Salvar"" 11º PASSO: Vejo mensagem de sucesso ""Critério de avaliação adicionado com sucesso.""\n\nDefinição dos critérios que serão utilizados para avaliar os projetos submetidos. Ação executada pelo Gerente Sistêmico de Projetos de Ensino ou Coordenador de Projetos de Ensino. 1º PASSO: Acesso o menu ""Ensino :: Projetos :: Editais :: Gerenciar Editais"" 2º PASSO: Vejo a página ""Editais"" 3º PASSO: Olho para a listagem 4º PASSO: Olho a linha ""Nome do edital"" 5º PASSO: Clico no ícone de exibição 6º PASSO: Vejo a página ""Nome do edital - Edital de Ensino"" 7º PASSO: Clico na aba ""Critérios de Avaliação da Qualificação do Projeto"" 8º PASSO: Clico no botão ""Adicionar Critério de Avaliação"" 9º PASSO: Preencho o formulário com os dados 10º PASSO: Clico no botão ""Salvar"" 11º PASSO: Vejo mensagem de sucesso ""Critério de avaliação adicionado com sucesso.""\n\nInclusão de mais um avaliador na comissão de avaliação do edital. Ação executada pelo Gerente Sistêmico de Projetos de Ensino ou Coordenador de Projetos de Ensino. 1º PASSO: Acesso o menu ""Ensino :: Projetos :: Editais :: Comissão de Avaliação"" 2º PASSO: Vejo a página ""Comissões de Avaliação"" 3º PASSO: Olho para a listagem 4º PASSO: Olho a linha ""Nome do edital - Edital de Ensino"" 5º PASSO: Clico no ícone de edição 6º PASSO: Vejo a página ""Editar Comissão do Nome do edital"" 7º PASSO: Preencho o formulário com os dados 8º PASSO: Clico no botão ""Salvar"" 9º PASSO: Vejo mensagem de sucesso ""Atualização realizada com sucesso.""']","A seção de Cadastro dos Critérios de Avaliação do Edital tem a função de definir os critérios que serão utilizados para avaliar os projetos submetidos, sendo uma ação executada pelo Gerente Sistêmico de Projetos de Ensino ou Coordenador de Projetos de Ensino.",A seção de Cadastro dos Critérios de Avaliação do Edital destina-se à definição dos critérios que serão empregados para a avaliação dos projetos submetidos.,0.9999999999,1.0,1.0,0.6657080605598744
Quem é o responsável pela execução da ação de Cadastro dos Critérios de Avaliação do Edital?,"['Inclusão de mais um avaliador na comissão de avaliação do edital. Ação executada pelo Gerente Sistêmico de Projetos de Ensino ou Coordenador de Projetos de Ensino. 1º PASSO: Acesso o menu ""Ensino :: Projetos :: Editais :: Comissão de Avaliação"" 2º PASSO: Vejo a página ""Comissões de Avaliação"" 3º PASSO: Olho para a listagem 4º PASSO: Olho a linha ""Nome do edital - Edital de Ensino"" 5º PASSO: Clico no ícone de edição 6º PASSO: Vejo a página ""Editar Comissão do Nome do edital"" 7º PASSO: Preencho o formulário com os dados 8º PASSO: Clico no botão ""Salvar"" 9º PASSO: Vejo mensagem de sucesso ""Atualização realizada com sucesso.""\n\nInclusão de mais um avaliador na comissão de avaliação do edital. Ação executada pelo Gerente Sistêmico de Projetos de Ensino ou Coordenador de Projetos de Ensino. 1º PASSO: Acesso o menu ""Ensino :: Projetos :: Editais :: Comissão de Avaliação"" 2º PASSO: Vejo a página ""Comissões de Avaliação"" 3º PASSO: Olho para a listagem 4º PASSO: Olho a linha ""Nome do edital - Edital de Ensino"" 5º PASSO: Clico no ícone de edição 6º PASSO: Vejo a página ""Editar Comissão do Nome do edital"" 7º PASSO: Preencho o formulário com os dados 8º PASSO: Clico no botão ""Salvar"" 9º PASSO: Vejo mensagem de sucesso ""Atualização realizada com sucesso.""\n\nDefinição dos critérios que serão utilizados para avaliar os projetos submetidos. Ação executada pelo Gerente Sistêmico de Projetos de Ensino ou Coordenador de Projetos de Ensino. 1º PASSO: Acesso o menu ""Ensino :: Projetos :: Editais :: Gerenciar Editais"" 2º PASSO: Vejo a página ""Editais"" 3º PASSO: Olho para a listagem 4º PASSO: Olho a linha ""Nome do edital"" 5º PASSO: Clico no ícone de exibição 6º PASSO: Vejo a página ""Nome do edital - Edital de Ensino"" 7º PASSO: Clico na aba ""Critérios de Avaliação da Qualificação do Projeto"" 8º PASSO: Clico no botão ""Adicionar Critério de Avaliação"" 9º PASSO: Preencho o formulário com os dados 10º PASSO: Clico no botão ""Salvar"" 11º PASSO: Vejo mensagem de sucesso ""Critério de avaliação adicionado com sucesso.""']",O responsável pela execução da ação de Cadastro dos Critérios de Avaliação do Edital é o Gerente Sistêmico de Projetos de Ensino ou Coordenador de Projetos de Ensino.,A ação de Cadastro dos Critérios de Avaliação do Edital é executada pelo Gerente Sistêmico de Projetos de Ensino ou pelo Coordenador de Projetos de Ensino.,0.9999999999,1.0,1.0,0.9999995798175686
Qual é o caminho de menu padrão para gerenciar os editais de projetos de ensino?,"['. Ação executada pelo Gerente Sistêmico de Projetos de Ensino ou Coordenador de Projetos de Ensino. 1º PASSO: Acesso o menu ""Ensino :: Projetos :: Editais :: Gerenciar Editais"" 2º PASSO: Vejo a página ""Editais"" 3º PASSO: Olho para a listagem 4º PASSO: Olho a linha ""Nome do edital"" 5º PASSO: Clico no ícone de exibição 6º PASSO: Vejo a página ""Nome do edital - Edital de Ensino"" 7º PASSO: Clico na aba ""Fonte de Recursos"" 8º PASSO: Clico no botão ""Adicionar Recurso"" 9º PASSO: Preencho o formulário com os dados 10º PASSO: Clico no botão ""Salvar"" 11º PASSO: Vejo mensagem de sucesso ""Recurso adicionado com sucesso.""\n\n. Ação executada pelo Gerente Sistêmico de Projetos de Ensino ou Coordenador de Projetos de Ensino. 1º PASSO: Acesso o menu ""Ensino :: Projetos :: Editais :: Gerenciar Editais"" 2º PASSO: Vejo a página ""Editais"" 3º PASSO: Olho para a listagem 4º PASSO: Olho a linha ""Nome do edital"" 5º PASSO: Clico no ícone de exibição 6º PASSO: Vejo a página ""Nome do edital - Edital de Ensino"" 7º PASSO: Clico na aba ""Fonte de Recursos"" 8º PASSO: Clico no botão ""Adicionar Recurso"" 9º PASSO: Preencho o formulário com os dados 10º PASSO: Clico no botão ""Salvar"" 11º PASSO: Vejo mensagem de sucesso ""Recurso adicionado com sucesso.""\n\nCadastro do edital para seleção de projetos de ensino. Ação executada pelo Gerente Sistêmico de Projetos de Ensino ou Coordenador de Projetos de Ensino. 1º PASSO: Acesso o menu ""Ensino :: Projetos :: Editais :: Gerenciar Editais"" 2º PASSO: Vejo a página ""Editais"" 3º PASSO: Clico no botão ""Adicionar Edital"" 4º PASSO: Vejo a página ""Adicionar Edital"" 5º PASSO: Preencho o formulário com os dados 6º PASSO: Clico no botão ""Salvar"" 7º PASSO: Vejo mensagem de sucesso ""Edital cadastrado com sucesso.""']","O caminho de menu padrão para gerenciar os editais de projetos de ensino é: ""Ensino :: Projetos :: Editais :: Gerenciar Editais"".","O acesso padrão para gerenciar os editais de projetos de ensino é através do menu ""Ensino :: Projetos :: Editais :: Gerenciar Editais"".",0.9999999999,1.0,1.0,0.9999999999999998
Qual a mensagem de confirmação esperada após a conclusão bem-sucedida do cadastro de um novo edital?,"['Cadastro do edital para seleção de projetos de ensino. Ação executada pelo Gerente Sistêmico de Projetos de Ensino ou Coordenador de Projetos de Ensino. 1º PASSO: Acesso o menu ""Ensino :: Projetos :: Editais :: Gerenciar Editais"" 2º PASSO: Vejo a página ""Editais"" 3º PASSO: Clico no botão ""Adicionar Edital"" 4º PASSO: Vejo a página ""Adicionar Edital"" 5º PASSO: Preencho o formulário com os dados 6º PASSO: Clico no botão ""Salvar"" 7º PASSO: Vejo mensagem de sucesso ""Edital cadastrado com sucesso.""\n\nCadastro do edital para seleção de projetos de ensino. Ação executada pelo Gerente Sistêmico de Projetos de Ensino ou Coordenador de Projetos de Ensino. 1º PASSO: Acesso o menu ""Ensino :: Projetos :: Editais :: Gerenciar Editais"" 2º PASSO: Vejo a página ""Editais"" 3º PASSO: Clico no botão ""Adicionar Edital"" 4º PASSO: Vejo a página ""Adicionar Edital"" 5º PASSO: Preencho o formulário com os dados 6º PASSO: Clico no botão ""Salvar"" 7º PASSO: Vejo mensagem de sucesso ""Edital cadastrado com sucesso.""\n\nEsta etapa deve ser realizada após o término das análises da documentação e dos formulários de inscrição , pois estarão aptos a participarem os candidatos que tiverem registro de entrega de documentação e parecer deferido . Acesse o programa: No menu, abra: ATIVIDADES ESTUDANTIS >> Serviço Social >> Programas >> Programas Na tela do programa clique em Gerenciar Participações Selecione o aluno a adicionar e clique no botão Adicionar Participação Preencha as informações com a data e o motivo da entrada e em seguida em Enviar Uma mensagem de confirmação é exibida na barra de status da página Benefícios POLAE - Procedimentos do setor de Serviço Social ou Comissão de Assistência Estudantil']","A mensagem de confirmação esperada após a conclusão bem-sucedida do cadastro de um novo edital é: ""Edital cadastrado com sucesso.""","Após a conclusão bem-sucedida do cadastro de um novo edital, a mensagem de sucesso esperada é ""Edital cadastrado com sucesso."".",0.9999999999,1.0,1.0,0.996496349783751
"E aí, tô meio perdido aqui. Oq é esse tal de 'programa' no SUAP? É tipo um edital, né? Tô confuso.","['Quem faz : Aluno Para realizar os procedimentos a seguir é necessário está logado no sistema SUAP, para mais informações ver: Como fazer Login no SUAP Edu ? Inscrever-se em um Programa Na tela inicial do SUAP na seção de notificações ( Fique Atento! ), inscreva-se clicando no programa com período de inscrição aberto. Para inscrever-se em editais de Benefícios é obrigatório está com a caracterização socioeconômica atualizada Preencha a caraterização socioeconômica e o questionário de inscrição e em seguida clique e Enviar Na próxima seção, preencha corretamente os dados da inscrição com atenção ao quadro de composição do grupo familiar ao final, clique novamente em Continuar Anexe a documentação comprobatória e clique em Continuar Os tipos de arquivos permitidos são: .pdf, .jpeg, .jpg,\n\nO conceito de edital , utilizado nas Resoluções do POLAE ( IFPI ), no Suap, são considerados identificados com a nomenclatura de "" programas "", como o sistema foi construído pelo IFRN. Na prática, ao cadastrar o Programa , você estará cadastrando o edital, conforme as resoluções do IFPI. Quem Faz: Assistente Social, Coordenador e Diretoria de Assistência Estudantil (Reitoria) Adicione um Programa No menu, abra: ATIVIDADES ESTUDANTIS >> Serviço Social >> Programas >> Programas >> acione o botão Adicionar Programa Preencha as Informações Tipo de Programa : Escolha o tipo de benefício a ser concedido, ex: ""Benefício Permanente"" Título: Sigla do Campus + Edital Nº XX/ANO - Nº Semestre\n\nA definição do período de inscrição do edital se faz necessária para que a opção de inscrição esteja ativa no perfil de acesso do estudante no SUAP. Durante o período em que estiver aberta as inscrições, o estudante poderá alterar as informações, mesmo já tendo finalizado a inscrição. Eles preencherão o formulário de ""Caracterização Social"" e, posteriormente, podrão se inscrever nos programas. Quem faz? Assistente Social, Coordenador/Presidente de Comissão e Diretoria de Assistência Estudantil (Reitoria) Necessário ter um Edital cadastrado 1. Crie um Período de Inscrição No menu, abra: ATIVIDADES ESTUDANTIS >> Serviço Social >> Programas >> Período de Inscrição >> acione o botão ""Adicionar Período de Inscrição "" 2']","Sim, no SUAP, o conceito de ""programa"" é utilizado para identificar os editais, conforme as resoluções do IFPI. Ao cadastrar um programa, você estará cadastrando um edital. Portanto, o programa no SUAP é equivalente ao edital nas Resoluções do POLAE do IFPI.","No SUAP, o termo 'programa' é utilizado para se referir ao que conhecemos como 'edital' nas resoluções do POLAE do IFPI. Basicamente, quando você vê 'programa' no sistema, entenda que é um edital de benefícios.",0.9999999999,0.8,1.0,0.5849474744424601
"Mano, tô querendo me inscrever num benefício, mas não sei por onde começar. Como faço pra me inscrever num edital de benefícios, ou programa, sei lá?","['Quem faz : Aluno Para realizar os procedimentos a seguir é necessário está logado no sistema SUAP, para mais informações ver: Como fazer Login no SUAP Edu ? Inscrever-se em um Programa Na tela inicial do SUAP na seção de notificações ( Fique Atento! ), inscreva-se clicando no programa com período de inscrição aberto. Para inscrever-se em editais de Benefícios é obrigatório está com a caracterização socioeconômica atualizada Preencha a caraterização socioeconômica e o questionário de inscrição e em seguida clique e Enviar Na próxima seção, preencha corretamente os dados da inscrição com atenção ao quadro de composição do grupo familiar ao final, clique novamente em Continuar Anexe a documentação comprobatória e clique em Continuar Os tipos de arquivos permitidos são: .pdf, .jpeg, .jpg,\n\nO conceito de edital , utilizado nas Resoluções do POLAE ( IFPI ), no Suap, são considerados identificados com a nomenclatura de "" programas "", como o sistema foi construído pelo IFRN. Na prática, ao cadastrar o Programa , você estará cadastrando o edital, conforme as resoluções do IFPI. Quem Faz: Assistente Social, Coordenador e Diretoria de Assistência Estudantil (Reitoria) Adicione um Programa No menu, abra: ATIVIDADES ESTUDANTIS >> Serviço Social >> Programas >> Programas >> acione o botão Adicionar Programa Preencha as Informações Tipo de Programa : Escolha o tipo de benefício a ser concedido, ex: ""Benefício Permanente"" Título: Sigla do Campus + Edital Nº XX/ANO - Nº Semestre\n\n. Acesse as Inscrições No menu, abra: ATIVIDADES ESTUDANTIS >> Serviço Social >> Programas >> Programas 2. Filtre o Programa 3. Clique na Lupa para ver detalhamento do programa Acessando a página de Participações 4. Clique em Gerenciar Participações Selecione o participante e clique em Adicionar Contemplação Caso deseje alterar ou excluir uma contemplação de forma individual, você poderá visualizando-a aqui Configurando e aplicando a contemplação individual 5. Preencha os dados referentes a contemplação conforme instruções a seguir: Inscrição Relacionada : selecione o período de inscrição referente ao programa que o aluno se inscreveu; Auxílio Contemplado : selecione o auxílio em que o aluno foi contemplado']","Para se inscrever em um edital de benefícios ou programa no SUAP, siga os passos abaixo:

1. Acesse o SUAP e faça login no sistema.
2. Na tela inicial, na seção de notificações, clique no programa com período de inscrição aberto.
3. Preencha a caracterização socioeconômica e o questionário de inscrição.
4. Preencha corretamente os dados da inscrição, atentando-se ao quadro de composição do grupo familiar.
5. Anexe a documentação comprobatória nos formatos .pdf, .jpeg, .jpg.
6. Clique em Enviar para finalizar a inscrição.

Lembrando que para inscrever-se em editais de benefícios é obrigatório ter a caracterização socioeconômica atualizada.","Para se inscrever em um edital de benefícios (ou 'programa', como é chamado no SUAP), você precisa seguir os 'Procedimentos do Aluno', que incluem a etapa de 'Realizando Inscrição em um Edital de Benefícios'.",0.9999999999,1.0,1.0,0.6957248358098421
"Tá, mas e depois que eu me inscrevo, oq mais eu tenho que fazer pra conseguir o benefício? Tem mais alguma etapa pra mim?","['Quem faz : Aluno Para realizar os procedimentos a seguir é necessário está logado no sistema SUAP, para mais informações ver: Como fazer Login no SUAP Edu ? Inscrever-se em um Programa Na tela inicial do SUAP na seção de notificações ( Fique Atento! ), inscreva-se clicando no programa com período de inscrição aberto. Para inscrever-se em editais de Benefícios é obrigatório está com a caracterização socioeconômica atualizada Preencha a caraterização socioeconômica e o questionário de inscrição e em seguida clique e Enviar Na próxima seção, preencha corretamente os dados da inscrição com atenção ao quadro de composição do grupo familiar ao final, clique novamente em Continuar Anexe a documentação comprobatória e clique em Continuar Os tipos de arquivos permitidos são: .pdf, .jpeg, .jpg,\n\nEsta etapa deve ser realizada após o término das análises da documentação e dos formulários de inscrição , pois estarão aptos a participarem os candidatos que tiverem registro de entrega de documentação e parecer deferido . Acesse o programa: No menu, abra: ATIVIDADES ESTUDANTIS >> Serviço Social >> Programas >> Programas Na tela do programa clique em Gerenciar Participações Selecione o aluno a adicionar e clique no botão Adicionar Participação Preencha as informações com a data e o motivo da entrada e em seguida em Enviar Uma mensagem de confirmação é exibida na barra de status da página Benefícios POLAE - Procedimentos do setor de Serviço Social ou Comissão de Assistência Estudantil\n\nEsta etapa deve ser realizada após a verificação da documentação e análise dos questionários de inscrição/socioeconômico, conforme o caso o processo seletivo possua etapas adicionais tais como entrevista, faça-as também antes deste procedimento. No contexto empregado aqui, o parecer é o status da Inscrição , ou seja, a situação da inscrição e não da participação efetiva no programa']","1. Após o término das análises da documentação e dos formulários de inscrição, acesse o programa seguindo os passos indicados.
2. No menu, abra: ATIVIDADES ESTUDANTIS >> Serviço Social >> Programas >> Programas.
3. Na tela do programa, clique em Gerenciar Participações.
4. Selecione o aluno a adicionar e clique no botão Adicionar Participação.
5. Preencha as informações com a data e o motivo da entrada e em seguida clique em Enviar.
6. Aguarde a mensagem de confirmação exibida na barra de status da página.","Sim, depois de realizar a inscrição em um edital de benefícios, outra etapa importante nos 'Procedimentos do Aluno' é 'Assinar Termo de Compromisso'.",0.9999999999,0.0,1.0,0.3997304918830713
"Depois que eu mando meus documentos, quem é que olha isso tudo? Tipo, quem analisa minha papelada pra ver se tá tudo certo?","['. Por fim, selecione o perfil apropriado, assine com a senha de acesso ao Suap e clique no botão "" ENVIAR "". 7º PASSO: Você será redirecionado para a página com todas as solicitações, e nessa parte da página será exibido o número do processo gerado, conforme ilustrado na imagem abaixo: 8º PASSO: Pronto! O procedimento foi realizado com sucesso, e o processo foi enviado para o setor selecionado pelo usuário inicialmente. Caso você precise visualizar com mais detalhes, basta clicar na lupa, e você será direcionado para a tela com toda a análise, conforme ilustrado na imagem abaixo:\n\nEsta etapa deve ser realizada após a verificação da documentação, e, somente no caso de ter configurado a etapa de recursos no Período de Inscrição , onde os alunos terão a oportunidade de enviar novamente os documentos pendentes identificados na análise. Quem faz a análise? Assistente Social, Membros das comissões de Assistência Estudantis nos campi e Diretoria de Assistência Estudantis (Reitoria) Análise do pedido de recurso Acessando a página de acompanhamento de recursos 1. Acesse o Acompanhamento de Recursos No menu, abra: ATIVIDADES ESTUDANTIS >> Serviço Social >> Programas >> Inscrições >> Analisar Recursos 2. Aplique os filtros desejados ou deixe-os em branco para exibir todos os recursos 3\n\n. 3º PASSO: O coordenador deverá clicar no botão "" Adicionar "", o que o redirecionará para outra página. 4º PASSO: Preencha todos os campos obrigatórios e, se necessário, adicione informações complementares. 5º PASSO: Na continuação da tela, preencha os dados do Orientador -1- e os dados da Defesa -2- . 6º PASSO: Preencha os dados da Banca -1- Presidente, -2- Examinador Interno e -3- Segundo Examinador. É importante observar que alguns tipos de examinadores e suplentes podem ser pessoas externas à Instituição, portanto, o cadastro desses membros deverá ocorrer de forma antecipada, conforme as orientações do cadastro específico. Após preencher os dados, clique em "" Salvar ""']","Assistente Social, Membros das comissões de Assistência Estudantis nos campi e Diretoria de Assistência Estudantis (Reitoria) são responsáveis por analisar a documentação dos alunos. Para acompanhar recursos, acesse: ATIVIDADES ESTUDANTIS >> Serviço Social >> Programas >> Inscrições >> Analisar Recursos.",A análise da documentação enviada pelos estudantes é realizada pelo setor de Serviço Social ou pela Comissão de Assistência Estudantil do IFPI.,0.9999999999,1.0,0.0,0.4219409440035532
Vi que tem 'Tipo de Programa' quando o pessoal cadastra. Que tipo de benefício pode ter? É só um tipo ou tem vários?,"['. Tipo de Auxílio Valor da Parcela do Auxílio Número de Parcelas Ano Letivo Período Letivo em que o Aluno Receberá o Auxílio 3. Informe os ""Filtros"": As opções de filtro dão flexibilidade e possibilitam selecionar o conjunto de alunos que serão contemplados com o auxílio selecionado. Período de Inscrição : selecione o período de inscrição referente ao programa que os alunos participam. Permite selecionar mais de um período, desta forma, em campus onde a seleção é dividida em duas etapas (novos inscritos e reavaliação/renovação) é possível selecionar os dois períodos para ordenar de forma conjunta; 4. Clique no botão "" Buscar "" Aplicando a contemplação em lote 5\n\nApós adicionar o estudante como participante de programa, é necessário inserir as informações sobre os valores dos auxílios deferidos. Aqui é fundamental que cada equipe responsável verifique qual procedimento atende melhor a sua demanda. A contemplação dos valores pode ser feita individualmente , ou seja, ao final da seleção, após ter adicionado a Participação , ou em lote , com a seleção de parâmetros como modalidade de auxílio, valor e quantidade da parcela e ano/semestre letivo. Quem faz? Assistente Social, Coordenador e Diretoria de Assuntos Estudantis (Reitoria) Contemplação Individual 1. Acesse as Inscrições No menu, abra: ATIVIDADES ESTUDANTIS >> Serviço Social >> Programas >> Programas 2. Filtre o Programa 3\n\nO conceito de edital , utilizado nas Resoluções do POLAE ( IFPI ), no Suap, são considerados identificados com a nomenclatura de "" programas "", como o sistema foi construído pelo IFRN. Na prática, ao cadastrar o Programa , você estará cadastrando o edital, conforme as resoluções do IFPI. Quem Faz: Assistente Social, Coordenador e Diretoria de Assistência Estudantil (Reitoria) Adicione um Programa No menu, abra: ATIVIDADES ESTUDANTIS >> Serviço Social >> Programas >> Programas >> acione o botão Adicionar Programa Preencha as Informações Tipo de Programa : Escolha o tipo de benefício a ser concedido, ex: ""Benefício Permanente"" Título: Sigla do Campus + Edital Nº XX/ANO - Nº Semestre']","Existem diferentes tipos de benefícios que podem ser cadastrados como ""Tipo de Programa"" no SUAP, tais como ""Benefício Permanente"". Não há uma lista específica de tipos de benefícios mencionada no contexto fornecido.","Ao cadastrar um programa, é necessário escolher o 'Tipo de Programa', que se refere ao tipo de benefício a ser concedido. Um exemplo mencionado é 'Benefício Permanente', mas podem existir outros tipos.",0.9999999999,1.0,0.6666666666666666,0.0
"Quando eu procuro um edital, a descrição é importante, né? Oq normalmente tem que ter na descrição de um edital pra eu saber se é pra mim?","['Definição dos critérios que serão utilizados para avaliar os projetos submetidos. Ação executada pelo Gerente Sistêmico de Projetos de Ensino ou Coordenador de Projetos de Ensino. 1º PASSO: Acesso o menu ""Ensino :: Projetos :: Editais :: Gerenciar Editais"" 2º PASSO: Vejo a página ""Editais"" 3º PASSO: Olho para a listagem 4º PASSO: Olho a linha ""Nome do edital"" 5º PASSO: Clico no ícone de exibição 6º PASSO: Vejo a página ""Nome do edital - Edital de Ensino"" 7º PASSO: Clico na aba ""Critérios de Avaliação da Qualificação do Projeto"" 8º PASSO: Clico no botão ""Adicionar Critério de Avaliação"" 9º PASSO: Preencho o formulário com os dados 10º PASSO: Clico no botão ""Salvar"" 11º PASSO: Vejo mensagem de sucesso ""Critério de avaliação adicionado com sucesso.""\n\nDefinição dos critérios que serão utilizados para avaliar os projetos submetidos. Ação executada pelo Gerente Sistêmico de Projetos de Ensino ou Coordenador de Projetos de Ensino. 1º PASSO: Acesso o menu ""Ensino :: Projetos :: Editais :: Gerenciar Editais"" 2º PASSO: Vejo a página ""Editais"" 3º PASSO: Olho para a listagem 4º PASSO: Olho a linha ""Nome do edital"" 5º PASSO: Clico no ícone de exibição 6º PASSO: Vejo a página ""Nome do edital - Edital de Ensino"" 7º PASSO: Clico na aba ""Critérios de Avaliação da Qualificação do Projeto"" 8º PASSO: Clico no botão ""Adicionar Critério de Avaliação"" 9º PASSO: Preencho o formulário com os dados 10º PASSO: Clico no botão ""Salvar"" 11º PASSO: Vejo mensagem de sucesso ""Critério de avaliação adicionado com sucesso.""\n\nO Plano de Oferta define a abrangência do edital. Apenas servidores dos campi inseridos no Plano de Oferta poderão submeter projetos. Ação executada pelo Gerente Sistêmico de Projetos de Ensino ou Coordenador de Projetos de Ensino. 1º PASSO: Acesso o menu ""Ensino :: Projetos :: Editais :: Gerenciar Editais"" 2º PASSO: Vejo a página ""Editais"" 3º PASSO: Olho para a listagem 4º PASSO: Olho a linha ""Nome do edital"" 5º PASSO: Clico no ícone de exibição 6º PASSO: Vejo a página ""Nome do edital - Edital de Ensino"" 7º PASSO: Clico na aba ""Plano de Oferta por Campus"" 8º PASSO: Clico no botão ""Adicionar Oferta"" 9º PASSO: Preencho o formulário com os dados 10º PASSO: Clico no botão ""Salvar"" 11º PASSO: Vejo mensagem de sucesso ""Oferta adicionada com sucesso.""']",Não encontrei essa informação nos manuais do SUAP disponíveis.,"A descrição de um edital (programa) deve conter dados básicos como o número, período de vigência, data de inscrição, as modalidades de auxílios ofertados, o público-alvo e outras informações relevantes que o campus considere necessárias.",0.9999999999,1.0,0.0,0.0
Vi uma parada de 'Atendimentos Incluídos'. Oq é isso? É tipo os auxílios que o edital dá?,"['O conceito de edital , utilizado nas Resoluções do POLAE ( IFPI ), no Suap, são considerados identificados com a nomenclatura de "" programas "", como o sistema foi construído pelo IFRN. Na prática, ao cadastrar o Programa , você estará cadastrando o edital, conforme as resoluções do IFPI. Quem Faz: Assistente Social, Coordenador e Diretoria de Assistência Estudantil (Reitoria) Adicione um Programa No menu, abra: ATIVIDADES ESTUDANTIS >> Serviço Social >> Programas >> Programas >> acione o botão Adicionar Programa Preencha as Informações Tipo de Programa : Escolha o tipo de benefício a ser concedido, ex: ""Benefício Permanente"" Título: Sigla do Campus + Edital Nº XX/ANO - Nº Semestre\n\n. Permite selecionar mais de um período, desta forma, em campus onde a seleção é dividida em duas etapas (novos inscritos e reavaliação/renovação) é possível selecionar os dois períodos para exibir as listas de contemplados de forma conjunta; Tipo de Auxílio : selecione o tipo auxílio com o qual os alunos foram contemplados; Valor Atual da Parcela do Auxílio : informe o valor da parcela que foi contemplado aos alunos; 3. Clique no botão "" Buscar "" Acessando os detalhes dos atendimentos Com base no(s) período(s) de inscrição indicado(s) na tela anterior, é exibida a lista de alunos contemplados e seus respectivos auxílios, número de parcelas e valores. 4\n\n. Exemplo: CANG Edital 01/2023 - 1 Semestre Descrição : Nesse campo é necessário informar os dados básicos do edital (número, período de vigência, data de inscrição, modalidade de auxílios ofertados, público e outras informações que o campus julgas necessário) Campus : Selecionar a sigla do campus correspondente. Atendimentos Incluídos : Selecionar os auxílios oferecidos no edital, inclusive o de mesmo nome do beneficio ofertado , e clicar em ""escolher"". Caso haja alguma seleção errada, selecionar a modalidade e selecionar ""remover"". Impedir que aluno solicite benefício ? NÃO SELECIONAR Público-Alvo : Selecionar a sigla do campus correspondente e clicar em ""escolher"" Acione o botão Salvar Benefícios POLAE - Procedimentos do setor de Serviço Social ou Comissão de Assistência Estudantil']","O campo ""Atendimentos Incluídos"" refere-se aos auxílios oferecidos no edital, que devem ser selecionados, inclusive o de mesmo nome do benefício ofertado. É importante escolher corretamente os auxílios e, caso haja alguma seleção errada, é possível remover a modalidade selecionada.",'Atendimentos Incluídos' se refere aos auxílios que são oferecidos dentro de um edital (programa). É onde são selecionadas as modalidades de auxílio que o estudante poderá receber.,0.9999999999,0.5,0.75,0.677704798249993
Eu vi que tem que 'Assinar Termo de Compromisso'. Mas oq acontece depois? Alguém tem que 'Validar Termo de Compromisso'? Oq significa isso?,"['Esse procedimento deve ser realizado pelos estudantes selecionados para participação em programas Assinar Termo de Compromisso Na tela inicial do SUAP clique na mensagem de notificações ATRIBUÍDOS A MIM Você será direcionado para o documento que deverá ser lido e após, clique em: ""Declaro estar de acordo com o Termo de Compromisso"": em seguida em Salvar Caso o Estudante beneficiado seja menor de idade , deverá anexar também o formulário de termo de compromisso fornecido pelo serviço social contendo os dados e assinatura do seu responsável legal. Mensagem termo de compromisso registrado com sucesso.\n\nApós os alunos participantes de programas e menores de idade preencherem e anexar o documento no sistema, o profissional do Serviço Social precisa validar o termo de compromisso assinado pelo responsável legal do estudante. Na tela inicial do SUAP clique na mensagem de notificações ATRIBUÍDOS A MEUS GRUPOS Na tela de inscrições você pode filtrar por: Campus (seu campus), Situação do Parecer (Deferido), Validação do Termo de Compromisso (Pendente). Visualize o termo anexado e clique em Validar Termo de Compromisso. Se estiver em conformidade selecione Validado na caixa de seleção, caso contrário, selecione Invalidado e informe a justificativa na caixa de texto e clique em salvar\n\n. Clique no alerta para acessar o documento. Certifique-se de verificar todas as informações do documento antes de prosseguir com a assinatura. 3º PASSO: Na página de Documentos de Texto, localize a Lupa na coluna ""Ações"" ao lado do documento que você deseja visualizar e clique nela. 4º PASSO: Na página seguinte, você verá o documento que precisa ser assinado. Localize o botão ""Assinar"" que fica no canto superior direito. Clique nele para iniciar o processo de assinatura. Certifique-se de seguir todas as instruções na tela com atenção e de fornecer todas as informações necessárias antes de concluir o processo de assinatura."" 5º PASSO: Depois de clicar em ""Assinar com senha"", você será redirecionado para a próxima tela. Aqui, localize o botão ""Definir Identificador"" e clique nele']","Sim, após os alunos participantes de programas e menores de idade assinarem o Termo de Compromisso no sistema, o profissional do Serviço Social precisa validar o termo assinado pelo responsável legal do estudante. Isso significa que o profissional do Serviço Social irá verificar se o termo está em conformidade com as exigências estabelecidas, como a presença da assinatura do responsável legal e demais informações necessárias. Se estiver tudo correto, o profissional do Serviço Social selecionará a opção ""Validado"". Caso contrário, selecionará ""Invalidado"" e informará a justificativa.","Sim, depois que você, como aluno, assina o Termo de Compromisso, o setor de Serviço Social ou a Comissão de Assistência Estudantil precisa 'Validar Termo de Compromisso' para formalizar sua participação no programa.",0.9999999999,1.0,1.0,0.5635593546210094
"Tipo, qual o fluxo geral pra eu entrar num desses programas de benefício? Me inscrevo, e depois? Oq mais acontece?","['Quem faz : Aluno Para realizar os procedimentos a seguir é necessário está logado no sistema SUAP, para mais informações ver: Como fazer Login no SUAP Edu ? Inscrever-se em um Programa Na tela inicial do SUAP na seção de notificações ( Fique Atento! ), inscreva-se clicando no programa com período de inscrição aberto. Para inscrever-se em editais de Benefícios é obrigatório está com a caracterização socioeconômica atualizada Preencha a caraterização socioeconômica e o questionário de inscrição e em seguida clique e Enviar Na próxima seção, preencha corretamente os dados da inscrição com atenção ao quadro de composição do grupo familiar ao final, clique novamente em Continuar Anexe a documentação comprobatória e clique em Continuar Os tipos de arquivos permitidos são: .pdf, .jpeg, .jpg,\n\n. Tipo de Auxílio Valor da Parcela do Auxílio Número de Parcelas Ano Letivo Período Letivo em que o Aluno Receberá o Auxílio 3. Informe os ""Filtros"": As opções de filtro dão flexibilidade e possibilitam selecionar o conjunto de alunos que serão contemplados com o auxílio selecionado. Período de Inscrição : selecione o período de inscrição referente ao programa que os alunos participam. Permite selecionar mais de um período, desta forma, em campus onde a seleção é dividida em duas etapas (novos inscritos e reavaliação/renovação) é possível selecionar os dois períodos para ordenar de forma conjunta; 4. Clique no botão "" Buscar "" Aplicando a contemplação em lote 5\n\nApós adicionar o estudante como participante de programa, é necessário inserir as informações sobre os valores dos auxílios deferidos. Aqui é fundamental que cada equipe responsável verifique qual procedimento atende melhor a sua demanda. A contemplação dos valores pode ser feita individualmente , ou seja, ao final da seleção, após ter adicionado a Participação , ou em lote , com a seleção de parâmetros como modalidade de auxílio, valor e quantidade da parcela e ano/semestre letivo. Quem faz? Assistente Social, Coordenador e Diretoria de Assuntos Estudantis (Reitoria) Contemplação Individual 1. Acesse as Inscrições No menu, abra: ATIVIDADES ESTUDANTIS >> Serviço Social >> Programas >> Programas 2. Filtre o Programa 3']","1. Acesse o sistema SUAP e faça login.
2. Na tela inicial, inscreva-se em um programa de benefício com período de inscrição aberto.
3. Preencha a caracterização socioeconômica, o questionário de inscrição e os dados da inscrição com atenção.
4. Anexe a documentação comprobatória.
5. Após adicionar o estudante como participante do programa, insira as informações sobre os valores dos auxílios deferidos.
6. A contemplação dos valores pode ser feita individualmente ou em lote, selecionando parâmetros como modalidade de auxílio, valor e quantidade da parcela e ano/semestre letivo.","O fluxo para o aluno envolve 'Realizando Inscrição em um Edital de Benefícios' e 'Assinar Termo de Compromisso'. Depois disso, a equipe do Serviço Social ou Comissão de Assistência Estudantil analisa sua documentação e adiciona sua participação no programa.",0.9999999999,1.0,1.0,0.683805896608069
"Quando eu vejo o nome de um edital, tipo 'CANG Edital 01/2023', oq essas siglas significam? É o nome do campus e o número do edital, né?","['. Exemplo: CANG Edital 01/2023 - 1 Semestre Descrição : Nesse campo é necessário informar os dados básicos do edital (número, período de vigência, data de inscrição, modalidade de auxílios ofertados, público e outras informações que o campus julgas necessário) Campus : Selecionar a sigla do campus correspondente. Atendimentos Incluídos : Selecionar os auxílios oferecidos no edital, inclusive o de mesmo nome do beneficio ofertado , e clicar em ""escolher"". Caso haja alguma seleção errada, selecionar a modalidade e selecionar ""remover"". Impedir que aluno solicite benefício ? NÃO SELECIONAR Público-Alvo : Selecionar a sigla do campus correspondente e clicar em ""escolher"" Acione o botão Salvar Benefícios POLAE - Procedimentos do setor de Serviço Social ou Comissão de Assistência Estudantil\n\nO conceito de edital , utilizado nas Resoluções do POLAE ( IFPI ), no Suap, são considerados identificados com a nomenclatura de "" programas "", como o sistema foi construído pelo IFRN. Na prática, ao cadastrar o Programa , você estará cadastrando o edital, conforme as resoluções do IFPI. Quem Faz: Assistente Social, Coordenador e Diretoria de Assistência Estudantil (Reitoria) Adicione um Programa No menu, abra: ATIVIDADES ESTUDANTIS >> Serviço Social >> Programas >> Programas >> acione o botão Adicionar Programa Preencha as Informações Tipo de Programa : Escolha o tipo de benefício a ser concedido, ex: ""Benefício Permanente"" Título: Sigla do Campus + Edital Nº XX/ANO - Nº Semestre\n\n. Configure o Período Cadastrar o cronograma divulgado em edital com a inserção das informações sobre o período de inscrições, análise e resultado final. Edital : Selecionar o edital que será identificado como por exemplo: ""Programa Benefício Permanente - ANO"" Campus : Selecionar o campus a que se refere o edital Programas Vinculados : Pesquisar o nome do edital cadastrado Período de Inscrição Data de Início das Inscrições : Definir o dia e horário de início das inscrições Data de Término das Inscrições : Definir o dia e horário final das inscrições Análise das Inscrições : Deve ser posterior ao término do período de inscrição. Após esta data o aluno não poderá adicionar documentos à inscrição. Deverá aguardar o período para recursos caso precise adicionar documentos à inscrição']","Sim, as siglas presentes no nome do edital, como ""CANG Edital 01/2023"", representam a sigla do campus e o número do edital, respectivamente.","Isso mesmo! O título de um programa (edital) geralmente segue o formato 'Sigla do Campus + Edital Nº XX/ANO - Nº Semestre'. No exemplo 'CANG Edital 01/2023 - 1 Semestre', 'CANG' é a sigla do campus, '01/2023' é o número e ano do edital, e '1 Semestre' indica o período.",0.9999999999,1.0,0.5,0.7026176994279015
"E aí, depois que eu faço uma solicitação no Catálogo Digital, oq acontece? Tipo, quem vê primeiro?","['Manual de recebimento de solicitação de serviço no Catálogo Digital 1º PASSO: O servidor irá clicar em ""CATÁLOGO DIGITAL"" e, em seguida, clicará em ""Solicitações"", o que o redirecionará para outra página. 1.1º PASSO: Outra forma de ter acesso às solicitações dos usuários externos é na página inicial. Aparecerá a caixa de texto ""SOLICITAÇÃO DO CATÁLOGO DIGITAL"", bastando clicar na solicitação para ser redirecionado para a página seguinte, conforme imagem abaixo: 2º PASSO: O servidor irá visualizar todas as solicitações aguardando validação. Para iniciar a análise da solicitação do usuário externo, o servidor deverá clicar na lupa, conforme ilustrado na imagem abaixo: 3º PASSO: Nessa página, o usuário pode escolher entre ""Assumir o atendimento"" ou ""Atribuir o atendimento a outro usuário""\n\n. 4º PASSO: Após assumir o atendimento da solicitação, o usuário será redirecionado para a próxima página, onde deverá avaliar as informações fornecidas pelo usuário externo. Na tela abaixo, o servidor poderá indeferir a solicitação caso ela não esteja de acordo com o padrão. 4.1º PASSO: O usuário deverá fazer a avaliação dos dados, clicando em ""OK"" se a informação estiver correta. Caso a informação não seja compatível com o dado informado, o usuário poderá clicar em ""C.P"" (Com problema) e justificar o motivo. Ao finalizar a avaliação, o usuário deverá clicar em ""Salvar"". Lembrete: Às vezes, o procedimento possui mais de uma etapa. Portanto, é necessário avaliar as duas abas da solicitação. 5º PASSO: Após salvar a avaliação, o botão "" EXECUTAR "" aparecerá ao lado do botão "" SALVAR ""\n\n. 2º Passo: O prestador de serviço deverá preencher o formulário de solicitação de mudança de senha e, em seguida, clicar em ""Enviar"" . 3º Passo: Quando o e-mail chegar na caixa de entrada, o prestador de serviço deverá abri-lo e clicar no link para gerar sua senha de acesso. 4º Passo: No menu lateral esquerdo, clique em ""DOCUMENTOS/PROCESSOS"" e, em seguida, selecione ""Documentos Eletrônicos - Dashboard"" . Na tela seguinte, clique em ""Assinaturas"" e depois em ""Documentos Esperando minha assinatura"" . 5º Passo: Você será redirecionado para uma página contendo todos os documentos que foram compartilhados e aguardam sua assinatura. Clique no ícone da lupa ao lado do documento para visualizá-lo. Observe que a situação do documento estará como ""aguardando assinatura""']","Depois que você faz uma solicitação no Catálogo Digital, o servidor irá visualizar todas as solicitações aguardando validação e poderá assumir o atendimento da solicitação. Em seguida, o servidor deverá avaliar as informações fornecidas pelo usuário externo e poderá indeferir a solicitação caso não esteja de acordo com o padrão. Lembre-se de que é necessário avaliar as duas abas da solicitação, salvar a avaliação e, então, o botão ""EXECUTAR"" aparecerá ao lado do botão ""SALVAR"".","Depois que você faz uma solicitação no Catálogo Digital, um servidor vai acessar o sistema. Ele pode clicar em 'CATÁLOGO DIGITAL' e depois em 'Solicitações', ou acessar pela caixa 'SOLICITAÇÃO DO CATÁLOGO DIGITAL' na página inicial, e então vai ver sua solicitação aguardando validação.",0.9999999999,0.6666666666666666,1.0,0.6228450402913414
"Tô confuso, depois que o servidor vê minha solicitação, como ele faz pra analisar? Tem que clicar em algo?","['. 4º PASSO: Após assumir o atendimento da solicitação, o usuário será redirecionado para a próxima página, onde deverá avaliar as informações fornecidas pelo usuário externo. Na tela abaixo, o servidor poderá indeferir a solicitação caso ela não esteja de acordo com o padrão. 4.1º PASSO: O usuário deverá fazer a avaliação dos dados, clicando em ""OK"" se a informação estiver correta. Caso a informação não seja compatível com o dado informado, o usuário poderá clicar em ""C.P"" (Com problema) e justificar o motivo. Ao finalizar a avaliação, o usuário deverá clicar em ""Salvar"". Lembrete: Às vezes, o procedimento possui mais de uma etapa. Portanto, é necessário avaliar as duas abas da solicitação. 5º PASSO: Após salvar a avaliação, o botão "" EXECUTAR "" aparecerá ao lado do botão "" SALVAR ""\n\n. Por fim, selecione o perfil apropriado, assine com a senha de acesso ao Suap e clique no botão "" ENVIAR "". 7º PASSO: Você será redirecionado para a página com todas as solicitações, e nessa parte da página será exibido o número do processo gerado, conforme ilustrado na imagem abaixo: 8º PASSO: Pronto! O procedimento foi realizado com sucesso, e o processo foi enviado para o setor selecionado pelo usuário inicialmente. Caso você precise visualizar com mais detalhes, basta clicar na lupa, e você será direcionado para a tela com toda a análise, conforme ilustrado na imagem abaixo:\n\nManual de recebimento de solicitação de serviço no Catálogo Digital 1º PASSO: O servidor irá clicar em ""CATÁLOGO DIGITAL"" e, em seguida, clicará em ""Solicitações"", o que o redirecionará para outra página. 1.1º PASSO: Outra forma de ter acesso às solicitações dos usuários externos é na página inicial. Aparecerá a caixa de texto ""SOLICITAÇÃO DO CATÁLOGO DIGITAL"", bastando clicar na solicitação para ser redirecionado para a página seguinte, conforme imagem abaixo: 2º PASSO: O servidor irá visualizar todas as solicitações aguardando validação. Para iniciar a análise da solicitação do usuário externo, o servidor deverá clicar na lupa, conforme ilustrado na imagem abaixo: 3º PASSO: Nessa página, o usuário pode escolher entre ""Assumir o atendimento"" ou ""Atribuir o atendimento a outro usuário""']","Após assumir o atendimento da solicitação, o servidor deverá avaliar as informações fornecidas pelo usuário externo. Para isso, ele deve clicar em ""OK"" se a informação estiver correta ou em ""C.P"" (Com problema) para justificar o motivo caso a informação não seja compatível com o dado informado. Ao finalizar a avaliação, o servidor deve clicar em ""Salvar"".","Para o servidor começar a analisar sua solicitação, ele precisa clicar na lupa que aparece ao lado da sua solicitação.",0.9999999999,1.0,1.0,0.4379198329898588
"Tipo, qualquer um pode pegar minha solicitação pra resolver ou ele pode passar pra outra pessoa? Tô meio perdido.","['. 4º PASSO: Após assumir o atendimento da solicitação, o usuário será redirecionado para a próxima página, onde deverá avaliar as informações fornecidas pelo usuário externo. Na tela abaixo, o servidor poderá indeferir a solicitação caso ela não esteja de acordo com o padrão. 4.1º PASSO: O usuário deverá fazer a avaliação dos dados, clicando em ""OK"" se a informação estiver correta. Caso a informação não seja compatível com o dado informado, o usuário poderá clicar em ""C.P"" (Com problema) e justificar o motivo. Ao finalizar a avaliação, o usuário deverá clicar em ""Salvar"". Lembrete: Às vezes, o procedimento possui mais de uma etapa. Portanto, é necessário avaliar as duas abas da solicitação. 5º PASSO: Após salvar a avaliação, o botão "" EXECUTAR "" aparecerá ao lado do botão "" SALVAR ""\n\nManual de recebimento de solicitação de serviço no Catálogo Digital 1º PASSO: O servidor irá clicar em ""CATÁLOGO DIGITAL"" e, em seguida, clicará em ""Solicitações"", o que o redirecionará para outra página. 1.1º PASSO: Outra forma de ter acesso às solicitações dos usuários externos é na página inicial. Aparecerá a caixa de texto ""SOLICITAÇÃO DO CATÁLOGO DIGITAL"", bastando clicar na solicitação para ser redirecionado para a página seguinte, conforme imagem abaixo: 2º PASSO: O servidor irá visualizar todas as solicitações aguardando validação. Para iniciar a análise da solicitação do usuário externo, o servidor deverá clicar na lupa, conforme ilustrado na imagem abaixo: 3º PASSO: Nessa página, o usuário pode escolher entre ""Assumir o atendimento"" ou ""Atribuir o atendimento a outro usuário""\n\n. Por fim, selecione o perfil apropriado, assine com a senha de acesso ao Suap e clique no botão "" ENVIAR "". 7º PASSO: Você será redirecionado para a página com todas as solicitações, e nessa parte da página será exibido o número do processo gerado, conforme ilustrado na imagem abaixo: 8º PASSO: Pronto! O procedimento foi realizado com sucesso, e o processo foi enviado para o setor selecionado pelo usuário inicialmente. Caso você precise visualizar com mais detalhes, basta clicar na lupa, e você será direcionado para a tela com toda a análise, conforme ilustrado na imagem abaixo:']","1. O servidor pode escolher entre ""Assumir o atendimento"" ou ""Atribuir o atendimento a outro usuário"" ao analisar a solicitação.
2. Após assumir o atendimento, o servidor pode redirecionar a solicitação para outro usuário, se necessário.",O servidor que está visualizando sua solicitação pode tanto 'Assumir o atendimento' para ele mesmo quanto 'Atribuir o atendimento a outro usuário'.,0.9999999999,1.0,0.5,0.2716333193790065
"E se eu preencher algo errado, o servidor pode simplesmente cancelar minha solicitação? Tô com medo de fazer besteira.","['. 4º PASSO: Após assumir o atendimento da solicitação, o usuário será redirecionado para a próxima página, onde deverá avaliar as informações fornecidas pelo usuário externo. Na tela abaixo, o servidor poderá indeferir a solicitação caso ela não esteja de acordo com o padrão. 4.1º PASSO: O usuário deverá fazer a avaliação dos dados, clicando em ""OK"" se a informação estiver correta. Caso a informação não seja compatível com o dado informado, o usuário poderá clicar em ""C.P"" (Com problema) e justificar o motivo. Ao finalizar a avaliação, o usuário deverá clicar em ""Salvar"". Lembrete: Às vezes, o procedimento possui mais de uma etapa. Portanto, é necessário avaliar as duas abas da solicitação. 5º PASSO: Após salvar a avaliação, o botão "" EXECUTAR "" aparecerá ao lado do botão "" SALVAR ""\n\n. Para acessar uma solicitação, o coordenador irá clicar no ícone de lupa para deferir ou indeferir. 3º PASSO: na página de Atividades de Aprofundamento e/ou Atividades complementares, o coordenador irá avaliar a solicitação do discente e clicar no botão "" Deferir "" caso aprove ou "" Indeferir "" caso indefira. 4º PASSO: Ao clicar em "" Deferir "", a solicitação do discente será aprovada e sairá da caixa de espera. Porém, se a avaliação for o "" Indeferimento "", o coordenador precisará justificar sua decisão no campo ""Razão do Indeferimento"" e, em seguida, clicar no botão "" Salvar "". 5º PASSO: Caso seja necessário, o indeferimento pode ser desfeito pelo coordenador, clicando no botão Cancelar Indeferimento.\n\n. 4º PASSO: Na tela de registro de ausência, o servidor vai selecionar o diário do professor ausente e preencher a data e o horário da ausência. 5º PASSO: Após fazer a inserção da ausência, o registro ficará registrado na aba ""Ausências Docentes"". Caso o cadastro tenha sido feito de forma equivocada, o servidor pode solicitar o cancelamento clicando no botão ""Solicitar Cancelamento"". É importante lembrar que o coordenador do curso é quem valida o cancelamento. 6º PASSO: Ao solicitar o cancelamento, na tela aparecerá o status de ""Avaliação de Cancelamento Pendente"", que ficará aguardando até o coordenador avaliar. A solicitação de cancelamento de ausência será realizada somente pelo servidor da CODIS caso tenha sido feita de maneira equivocada']","1. Caso você preencha algo errado em uma solicitação de ausência, o servidor pode solicitar o cancelamento clicando no botão ""Solicitar Cancelamento"".
2. O cancelamento da ausência só será validado pelo coordenador do curso.
3. O status da solicitação de cancelamento ficará como ""Avaliação de Cancelamento Pendente"" até que o coordenador avalie.
4. A solicitação de cancelamento de ausência só pode ser feita pelo servidor da CODIS se tiver sido feita de maneira equivocada.","Sim, se as informações que você forneceu não estiverem de acordo com o padrão, o servidor poderá indeferir sua solicitação.",0.9999999999,1.0,1.0,0.46284835972651495
"Vi que o servidor pode clicar em 'C.P', oq é isso? Tipo, pra que serve?","['. Descrição: Utilize a ferramenta de busca para localizar rapidamente o menu Professor dentro da seção Ensino. ----------------------------------------------------------------------------------------------------------------------------------- 2º PASSO - Adicionar Professor de Serviço: Na tela seguinte, o servidor vai clicar no botão ""Adicionar Professor de Serviço"" que fica no canto superior esquerdo. Descrição: Este botão dará acesso ao formulário de cadastro do novo professor prestador\n\nCadastro do servidor membro do projeto de ensino. Ação executada pelo Servidor (coordenador do projeto). 1º PASSO: Acesso o menu ""Ensino :: Projetos :: Meus Projetos"" 2º PASSO: Vejo a página ""Meus Projetos"" 3º PASSO: Clico no botão ""Visualizar"" 4º PASSO: Vejo a página ""Projeto de Ensino"" 5º PASSO: Clico na aba ""Equipe"" 6º PASSO: Clico no botão ""Adicionar Servidor"" 7º PASSO: Preencho o formulário com os dados 8º PASSO: Clico no botão ""Salvar"" 9º PASSO: Vejo mensagem de sucesso ""Participante adicionado com sucesso.""\n\nCadastro do servidor membro do projeto de ensino. Ação executada pelo Servidor (coordenador do projeto). 1º PASSO: Acesso o menu ""Ensino :: Projetos :: Meus Projetos"" 2º PASSO: Vejo a página ""Meus Projetos"" 3º PASSO: Clico no botão ""Visualizar"" 4º PASSO: Vejo a página ""Projeto de Ensino"" 5º PASSO: Clico na aba ""Equipe"" 6º PASSO: Clico no botão ""Adicionar Servidor"" 7º PASSO: Preencho o formulário com os dados 8º PASSO: Clico no botão ""Salvar"" 9º PASSO: Vejo mensagem de sucesso ""Participante adicionado com sucesso.""']",Não encontrei essa informação nos manuais do SUAP disponíveis.,"Quando o servidor clica em 'C.P', significa 'Com problema'. Ele usa isso quando a informação que você forneceu não é compatível com o dado informado, e ele precisa justificar o motivo.",0.9999999999,0.5,0.0,0.0
"Depois que o servidor avalia tudo e salva, oq ele faz em seguida? Tem um botão pra clicar?","['. 4º PASSO: Após assumir o atendimento da solicitação, o usuário será redirecionado para a próxima página, onde deverá avaliar as informações fornecidas pelo usuário externo. Na tela abaixo, o servidor poderá indeferir a solicitação caso ela não esteja de acordo com o padrão. 4.1º PASSO: O usuário deverá fazer a avaliação dos dados, clicando em ""OK"" se a informação estiver correta. Caso a informação não seja compatível com o dado informado, o usuário poderá clicar em ""C.P"" (Com problema) e justificar o motivo. Ao finalizar a avaliação, o usuário deverá clicar em ""Salvar"". Lembrete: Às vezes, o procedimento possui mais de uma etapa. Portanto, é necessário avaliar as duas abas da solicitação. 5º PASSO: Após salvar a avaliação, o botão "" EXECUTAR "" aparecerá ao lado do botão "" SALVAR ""\n\n. 5º PASSO: Após salvar a avaliação, o botão "" EXECUTAR "" aparecerá ao lado do botão "" SALVAR "". O usuário deverá clicar em ""Executar"". 6º PASSO: Ao clicar em ""Executar"", o usuário será redirecionado para a página de ""Solicitação de Protocolo Eletrônico"". Nesta fase, será necessário informar o tipo do documento, o nível de acesso. No exemplo fornecido, o usuário externo anexou dois documentos, portanto, será necessário fornecer os dados para ambos. Além disso, é necessário selecionar para qual setor a solicitação será encaminhada, clicando em ""Buscar usando o Autocompletar"" e informando o setor de destino do processo. Por fim, selecione o perfil apropriado, assine com a senha de acesso ao Suap e clique no botão "" ENVIAR ""\n\n. Além disso, é necessário selecionar o "" Responsável pela Publicação "" e, em seguida, clicar em "" Salvar "". 4º PASSO: Agora que o relatório foi aprovado, as informações detalhadas serão exibidas nos "" Dados da Avaliação "". Caso deseje, há a opção de "" Cancelar Aprovação do Relatório "". 5º PASSO: Caso queira ver suas avaliações, basta clicar na aba ""Minhas Avaliações"".']","1. Após salvar a avaliação, o servidor deve clicar no botão ""EXECUTAR"" que aparecerá ao lado do botão ""SALVAR"".","Depois que o servidor salva a avaliação da sua solicitação, vai aparecer um botão chamado 'EXECUTAR' ao lado do botão 'SALVAR', e ele precisará clicar nele.",0.9999999999,1.0,1.0,0.6161445731909931
"Se eu anexei uns documentos na minha solicitação, oq o servidor faz com eles? Tem que preencher algo?","['Cadastro de documento diverso relacionado ao projeto. Ação executada pelo Servidor (coordenador do projeto). 1º PASSO: Acesso o menu ""Ensino :: Projetos :: Meus Projetos"" 2º PASSO: Vejo a página ""Meus Projetos"" 3º PASSO: Clico no botão ""Visualizar"" 4º PASSO: Vejo a página ""Projeto de Ensino"" 5º PASSO: Clico na aba ""Anexos"" 6º PASSO: Clico no botão ""Adicionar Anexo"" 7º PASSO: Preencho o formulário com os dados 8º PASSO: Clico no botão ""Salvar"" 9º PASSO: Vejo mensagem de sucesso ""Anexo cadastrado com sucesso.""\n\nCadastro de documento diverso relacionado ao projeto. Ação executada pelo Servidor (coordenador do projeto). 1º PASSO: Acesso o menu ""Ensino :: Projetos :: Meus Projetos"" 2º PASSO: Vejo a página ""Meus Projetos"" 3º PASSO: Clico no botão ""Visualizar"" 4º PASSO: Vejo a página ""Projeto de Ensino"" 5º PASSO: Clico na aba ""Anexos"" 6º PASSO: Clico no botão ""Adicionar Anexo"" 7º PASSO: Preencho o formulário com os dados 8º PASSO: Clico no botão ""Salvar"" 9º PASSO: Vejo mensagem de sucesso ""Anexo cadastrado com sucesso.""\n\n. 5º PASSO: Após salvar a avaliação, o botão "" EXECUTAR "" aparecerá ao lado do botão "" SALVAR "". O usuário deverá clicar em ""Executar"". 6º PASSO: Ao clicar em ""Executar"", o usuário será redirecionado para a página de ""Solicitação de Protocolo Eletrônico"". Nesta fase, será necessário informar o tipo do documento, o nível de acesso. No exemplo fornecido, o usuário externo anexou dois documentos, portanto, será necessário fornecer os dados para ambos. Além disso, é necessário selecionar para qual setor a solicitação será encaminhada, clicando em ""Buscar usando o Autocompletar"" e informando o setor de destino do processo. Por fim, selecione o perfil apropriado, assine com a senha de acesso ao Suap e clique no botão "" ENVIAR ""']","O servidor deve informar o tipo do documento, o nível de acesso, o setor de destino do processo e selecionar o perfil apropriado. Após preencher essas informações, deve assinar com a senha de acesso ao SUAP e clicar no botão ""ENVIAR"".","Se você anexou documentos, o servidor precisará informar o tipo e o nível de acesso para cada um deles na página de 'Solicitação de Protocolo Eletrônico'.",0.9999999999,1.0,1.0,0.5224764502504999
Como o servidor sabe pra qual setor mandar minha solicitação? Ele digita o nome do setor?,"['. Outra opção é acessar o link “ Abrir Chamado ” disponível na página inicial do SUAP. 2º PASSO: Ao clicar em "" Abrir Chamado "", o servidor será redirecionado para a página de abertura de chamados, onde deve escolher a categoria apropriada, como "" Tecnologia da Informação "", para garantir que a solicitação seja encaminhada ao setor correto. 3º PASSO: Após selecionar a Área de Serviço , o servidor verá uma lista de Categorias para escolher. Cada Categoria representa um tipo de solicitação relacionado à Área escolhida. Dentro de cada Categoria, serão listados os Grupos de Serviços correspondentes e, para cada Grupo, serão apresentados os Serviços oferecidos. É importante destacar que todas as Categorias, Grupos e Serviços já estarão previamente cadastrados no SUAP\n\n. No campo ""Nome de Registro"" , insira o nome do prestador. É importante lembrar que os campos CPF, Sexo, Nacionalidade e Setor são obrigatórios. 3.1.b - No campo ""Setor"" , selecione o setor ""SETOR EXTERNO-IFPI"" , pois não há um setor específico para esses tipos de prestadores de serviço. No campo ""E-mail Secundário"", adicione o e-mail secundário do prestador para que, no primeiro acesso ao Suap, ele possa solicitar a senha de acesso. Após preencher todos os campos obrigatórios, clique em ""Salvar"" . 4º Passo: Para adicionar o setor e a função do prestador, consulte o nome do mesmo na lista de prestadores cadastrados. Você pode fazer isso acessando a opção ""Acesse o Cadastro"" na barra central acima ou clicando na lupa ao lado do lápis\n\nManual de recebimento de solicitação de serviço no Catálogo Digital 1º PASSO: O servidor irá clicar em ""CATÁLOGO DIGITAL"" e, em seguida, clicará em ""Solicitações"", o que o redirecionará para outra página. 1.1º PASSO: Outra forma de ter acesso às solicitações dos usuários externos é na página inicial. Aparecerá a caixa de texto ""SOLICITAÇÃO DO CATÁLOGO DIGITAL"", bastando clicar na solicitação para ser redirecionado para a página seguinte, conforme imagem abaixo: 2º PASSO: O servidor irá visualizar todas as solicitações aguardando validação. Para iniciar a análise da solicitação do usuário externo, o servidor deverá clicar na lupa, conforme ilustrado na imagem abaixo: 3º PASSO: Nessa página, o usuário pode escolher entre ""Assumir o atendimento"" ou ""Atribuir o atendimento a outro usuário""']","Sim, o servidor deve escolher a categoria apropriada, como ""Tecnologia da Informação"", ao abrir o chamado. Em seguida, deve selecionar a Área de Serviço e, dentro dela, escolher a Categoria que representa o tipo de solicitação desejada. Não é necessário digitar o nome do setor, pois as opções de setores já estarão disponíveis para seleção.","O servidor precisa selecionar o setor de destino da sua solicitação clicando em 'Buscar usando o Autocompletar' e informando o nome do setor. Depois ele seleciona o perfil, assina com a senha do Suap e clica em 'ENVIAR'.",0.9999999999,0.5,0.6,0.7454379650190666
"E o número do processo, como eu vejo? Tipo, depois que o servidor envia, aparece onde?","['. Por fim, selecione o perfil apropriado, assine com a senha de acesso ao Suap e clique no botão "" ENVIAR "". 7º PASSO: Você será redirecionado para a página com todas as solicitações, e nessa parte da página será exibido o número do processo gerado, conforme ilustrado na imagem abaixo: 8º PASSO: Pronto! O procedimento foi realizado com sucesso, e o processo foi enviado para o setor selecionado pelo usuário inicialmente. Caso você precise visualizar com mais detalhes, basta clicar na lupa, e você será direcionado para a tela com toda a análise, conforme ilustrado na imagem abaixo:\n\n. Clique em Não sou um robô e depois clique em Enviar para consultar Passo 03: Na tela abaixo são listados todos os processos pesquisados pelo usuário, onde pode visualizar o processo com mais detalhes dos trâmites, documentos e a opção “visualizar processo”. OBSERVAÇÃO: processos que contenham documentos públicos serão visualizados na integralidade, contudo, caso contenham documentos restritos, com hipótese legal justificada, a visualização do processo será parcial, sendo visualizados os documentos públicos e tendo limitação de visualização para os documentos restritos. O módulo SUAP ainda não possui a funcionalidade de publicação de documentos restritos com uso de tarjamento nos dados sensíveis como no SEI.\n\n. Para isso, o servidor deve acessar o menu ENSINO >> Comunicador >> Caixa de Saída, onde poderá visualizar todas as mensagens enviadas e o status de entrega de cada uma delas.']","Para visualizar o número do processo gerado após o envio, basta acessar a página com todas as solicitações. Nessa parte da página, o número do processo será exibido conforme ilustrado na imagem.","Depois que o procedimento é finalizado e o processo é gerado, o número do processo será exibido na página com todas as solicitações.",0.9999999999,1.0,0.6666666666666666,0.7933146138045831
"Se eu quiser ver os detalhes da minha solicitação depois que já foi enviada, tem como? Onde clico?","['. Por fim, selecione o perfil apropriado, assine com a senha de acesso ao Suap e clique no botão "" ENVIAR "". 7º PASSO: Você será redirecionado para a página com todas as solicitações, e nessa parte da página será exibido o número do processo gerado, conforme ilustrado na imagem abaixo: 8º PASSO: Pronto! O procedimento foi realizado com sucesso, e o processo foi enviado para o setor selecionado pelo usuário inicialmente. Caso você precise visualizar com mais detalhes, basta clicar na lupa, e você será direcionado para a tela com toda a análise, conforme ilustrado na imagem abaixo:\n\n. 4º PASSO: Após assumir o atendimento da solicitação, o usuário será redirecionado para a próxima página, onde deverá avaliar as informações fornecidas pelo usuário externo. Na tela abaixo, o servidor poderá indeferir a solicitação caso ela não esteja de acordo com o padrão. 4.1º PASSO: O usuário deverá fazer a avaliação dos dados, clicando em ""OK"" se a informação estiver correta. Caso a informação não seja compatível com o dado informado, o usuário poderá clicar em ""C.P"" (Com problema) e justificar o motivo. Ao finalizar a avaliação, o usuário deverá clicar em ""Salvar"". Lembrete: Às vezes, o procedimento possui mais de uma etapa. Portanto, é necessário avaliar as duas abas da solicitação. 5º PASSO: Após salvar a avaliação, o botão "" EXECUTAR "" aparecerá ao lado do botão "" SALVAR ""\n\n. 2º Passo: O prestador de serviço deverá preencher o formulário de solicitação de mudança de senha e, em seguida, clicar em ""Enviar"" . 3º Passo: Quando o e-mail chegar na caixa de entrada, o prestador de serviço deverá abri-lo e clicar no link para gerar sua senha de acesso. 4º Passo: No menu lateral esquerdo, clique em ""DOCUMENTOS/PROCESSOS"" e, em seguida, selecione ""Documentos Eletrônicos - Dashboard"" . Na tela seguinte, clique em ""Assinaturas"" e depois em ""Documentos Esperando minha assinatura"" . 5º Passo: Você será redirecionado para uma página contendo todos os documentos que foram compartilhados e aguardam sua assinatura. Clique no ícone da lupa ao lado do documento para visualizá-lo. Observe que a situação do documento estará como ""aguardando assinatura""']","1. Clique na lupa ao lado da solicitação enviada;
2. Você será redirecionado para a tela com toda a análise da solicitação.","Sim, se você precisar visualizar os detalhes da sua solicitação depois de enviada, basta clicar na lupa que você será direcionado para a tela com toda a análise.",0.9999999999,1.0,1.0,0.5108444026244943
Solicito o procedimento detalhado para o cadastramento de um novo edital de seleção de projetos de ensino no sistema.,"['Cadastro do edital para seleção de projetos de ensino. Ação executada pelo Gerente Sistêmico de Projetos de Ensino ou Coordenador de Projetos de Ensino. 1º PASSO: Acesso o menu ""Ensino :: Projetos :: Editais :: Gerenciar Editais"" 2º PASSO: Vejo a página ""Editais"" 3º PASSO: Clico no botão ""Adicionar Edital"" 4º PASSO: Vejo a página ""Adicionar Edital"" 5º PASSO: Preencho o formulário com os dados 6º PASSO: Clico no botão ""Salvar"" 7º PASSO: Vejo mensagem de sucesso ""Edital cadastrado com sucesso.""\n\nCadastro do edital para seleção de projetos de ensino. Ação executada pelo Gerente Sistêmico de Projetos de Ensino ou Coordenador de Projetos de Ensino. 1º PASSO: Acesso o menu ""Ensino :: Projetos :: Editais :: Gerenciar Editais"" 2º PASSO: Vejo a página ""Editais"" 3º PASSO: Clico no botão ""Adicionar Edital"" 4º PASSO: Vejo a página ""Adicionar Edital"" 5º PASSO: Preencho o formulário com os dados 6º PASSO: Clico no botão ""Salvar"" 7º PASSO: Vejo mensagem de sucesso ""Edital cadastrado com sucesso.""\n\n. Ação executada pelo Gerente Sistêmico de Projetos de Ensino ou Coordenador de Projetos de Ensino. 1º PASSO: Acesso o menu ""Ensino :: Projetos :: Editais :: Gerenciar Editais"" 2º PASSO: Vejo a página ""Editais"" 3º PASSO: Olho para a listagem 4º PASSO: Olho a linha ""Nome do edital"" 5º PASSO: Clico no ícone de exibição 6º PASSO: Vejo a página ""Nome do edital - Edital de Ensino"" 7º PASSO: Clico na aba ""Fonte de Recursos"" 8º PASSO: Clico no botão ""Adicionar Recurso"" 9º PASSO: Preencho o formulário com os dados 10º PASSO: Clico no botão ""Salvar"" 11º PASSO: Vejo mensagem de sucesso ""Recurso adicionado com sucesso.""']","1. Acesse o menu ""Ensino :: Projetos :: Editais :: Gerenciar Editais""
2. Clique no botão ""Adicionar Edital""
3. Preencha o formulário com os dados necessários
4. Clique no botão ""Salvar""
5. Verifique a mensagem de sucesso ""Edital cadastrado com sucesso.""","Para cadastrar um novo edital, o Gerente Sistêmico de Projetos de Ensino ou Coordenador de Projetos de Ensino deve acessar o menu 'Ensino :: Projetos :: Editais :: Gerenciar Editais', clicar em 'Adicionar Edital', preencher o formulário com os dados pertinentes e, em seguida, clicar em 'Salvar'. Uma mensagem de sucesso confirmará o cadastro.",0.9999999999,1.0,1.0,0.48231767872967996
Quais perfis de usuário são autorizados a realizar o cadastro de editais de projetos de ensino?,"['Cadastro do edital para seleção de projetos de ensino. Ação executada pelo Gerente Sistêmico de Projetos de Ensino ou Coordenador de Projetos de Ensino. 1º PASSO: Acesso o menu ""Ensino :: Projetos :: Editais :: Gerenciar Editais"" 2º PASSO: Vejo a página ""Editais"" 3º PASSO: Clico no botão ""Adicionar Edital"" 4º PASSO: Vejo a página ""Adicionar Edital"" 5º PASSO: Preencho o formulário com os dados 6º PASSO: Clico no botão ""Salvar"" 7º PASSO: Vejo mensagem de sucesso ""Edital cadastrado com sucesso.""\n\nCadastro do edital para seleção de projetos de ensino. Ação executada pelo Gerente Sistêmico de Projetos de Ensino ou Coordenador de Projetos de Ensino. 1º PASSO: Acesso o menu ""Ensino :: Projetos :: Editais :: Gerenciar Editais"" 2º PASSO: Vejo a página ""Editais"" 3º PASSO: Clico no botão ""Adicionar Edital"" 4º PASSO: Vejo a página ""Adicionar Edital"" 5º PASSO: Preencho o formulário com os dados 6º PASSO: Clico no botão ""Salvar"" 7º PASSO: Vejo mensagem de sucesso ""Edital cadastrado com sucesso.""\n\nDefinição dos critérios que serão utilizados para avaliar os projetos submetidos. Ação executada pelo Gerente Sistêmico de Projetos de Ensino ou Coordenador de Projetos de Ensino. 1º PASSO: Acesso o menu ""Ensino :: Projetos :: Editais :: Gerenciar Editais"" 2º PASSO: Vejo a página ""Editais"" 3º PASSO: Olho para a listagem 4º PASSO: Olho a linha ""Nome do edital"" 5º PASSO: Clico no ícone de exibição 6º PASSO: Vejo a página ""Nome do edital - Edital de Ensino"" 7º PASSO: Clico na aba ""Critérios de Avaliação da Qualificação do Projeto"" 8º PASSO: Clico no botão ""Adicionar Critério de Avaliação"" 9º PASSO: Preencho o formulário com os dados 10º PASSO: Clico no botão ""Salvar"" 11º PASSO: Vejo mensagem de sucesso ""Critério de avaliação adicionado com sucesso.""']",Os perfis de usuário autorizados a realizar o cadastro de editais de projetos de ensino são o Gerente Sistêmico de Projetos de Ensino e o Coordenador de Projetos de Ensino.,O cadastro de editais para seleção de projetos de ensino é uma ação executada pelo Gerente Sistêmico de Projetos de Ensino ou pelo Coordenador de Projetos de Ensino.,0.9999999999,1.0,1.0,0.9891839507221417
Qual a sequência de passos para incluir um campus no Plano de Oferta de um edital já existente?,"['O Plano de Oferta define a abrangência do edital. Apenas servidores dos campi inseridos no Plano de Oferta poderão submeter projetos. Ação executada pelo Gerente Sistêmico de Projetos de Ensino ou Coordenador de Projetos de Ensino. 1º PASSO: Acesso o menu ""Ensino :: Projetos :: Editais :: Gerenciar Editais"" 2º PASSO: Vejo a página ""Editais"" 3º PASSO: Olho para a listagem 4º PASSO: Olho a linha ""Nome do edital"" 5º PASSO: Clico no ícone de exibição 6º PASSO: Vejo a página ""Nome do edital - Edital de Ensino"" 7º PASSO: Clico na aba ""Plano de Oferta por Campus"" 8º PASSO: Clico no botão ""Adicionar Oferta"" 9º PASSO: Preencho o formulário com os dados 10º PASSO: Clico no botão ""Salvar"" 11º PASSO: Vejo mensagem de sucesso ""Oferta adicionada com sucesso.""\n\nO Plano de Oferta define a abrangência do edital. Apenas servidores dos campi inseridos no Plano de Oferta poderão submeter projetos. Ação executada pelo Gerente Sistêmico de Projetos de Ensino ou Coordenador de Projetos de Ensino. 1º PASSO: Acesso o menu ""Ensino :: Projetos :: Editais :: Gerenciar Editais"" 2º PASSO: Vejo a página ""Editais"" 3º PASSO: Olho para a listagem 4º PASSO: Olho a linha ""Nome do edital"" 5º PASSO: Clico no ícone de exibição 6º PASSO: Vejo a página ""Nome do edital - Edital de Ensino"" 7º PASSO: Clico na aba ""Plano de Oferta por Campus"" 8º PASSO: Clico no botão ""Adicionar Oferta"" 9º PASSO: Preencho o formulário com os dados 10º PASSO: Clico no botão ""Salvar"" 11º PASSO: Vejo mensagem de sucesso ""Oferta adicionada com sucesso.""\n\n. Exemplo: CANG Edital 01/2023 - 1 Semestre Descrição : Nesse campo é necessário informar os dados básicos do edital (número, período de vigência, data de inscrição, modalidade de auxílios ofertados, público e outras informações que o campus julgas necessário) Campus : Selecionar a sigla do campus correspondente. Atendimentos Incluídos : Selecionar os auxílios oferecidos no edital, inclusive o de mesmo nome do beneficio ofertado , e clicar em ""escolher"". Caso haja alguma seleção errada, selecionar a modalidade e selecionar ""remover"". Impedir que aluno solicite benefício ? NÃO SELECIONAR Público-Alvo : Selecionar a sigla do campus correspondente e clicar em ""escolher"" Acione o botão Salvar Benefícios POLAE - Procedimentos do setor de Serviço Social ou Comissão de Assistência Estudantil']","1. Acesse o menu ""Ensino :: Projetos :: Editais :: Gerenciar Editais"".
2. Na página ""Editais"", clique no ícone de exibição do edital desejado.
3. Na página do edital, clique na aba ""Plano de Oferta por Campus"".
4. Clique no botão ""Adicionar Oferta"".
5. Preencha o formulário com os dados necessários.
6. Clique no botão ""Salvar"".
7. Verifique a mensagem de sucesso ""Oferta adicionada com sucesso"".","Para incluir um campus no Plano de Oferta, acesse 'Ensino :: Projetos :: Editais :: Gerenciar Editais', localize o edital na listagem e clique no ícone de exibição. Na página do edital, selecione a aba 'Plano de Oferta por Campus', clique em 'Adicionar Oferta', preencha os dados no formulário e salve. Uma mensagem confirmará a adição da oferta.",0.9999999999,1.0,1.0,0.4798862055843846
Gostaria de compreender a finalidade e o impacto do 'Plano de Oferta por Campus' em um edital.,"['O Plano de Oferta define a abrangência do edital. Apenas servidores dos campi inseridos no Plano de Oferta poderão submeter projetos. Ação executada pelo Gerente Sistêmico de Projetos de Ensino ou Coordenador de Projetos de Ensino. 1º PASSO: Acesso o menu ""Ensino :: Projetos :: Editais :: Gerenciar Editais"" 2º PASSO: Vejo a página ""Editais"" 3º PASSO: Olho para a listagem 4º PASSO: Olho a linha ""Nome do edital"" 5º PASSO: Clico no ícone de exibição 6º PASSO: Vejo a página ""Nome do edital - Edital de Ensino"" 7º PASSO: Clico na aba ""Plano de Oferta por Campus"" 8º PASSO: Clico no botão ""Adicionar Oferta"" 9º PASSO: Preencho o formulário com os dados 10º PASSO: Clico no botão ""Salvar"" 11º PASSO: Vejo mensagem de sucesso ""Oferta adicionada com sucesso.""\n\nO Plano de Oferta define a abrangência do edital. Apenas servidores dos campi inseridos no Plano de Oferta poderão submeter projetos. Ação executada pelo Gerente Sistêmico de Projetos de Ensino ou Coordenador de Projetos de Ensino. 1º PASSO: Acesso o menu ""Ensino :: Projetos :: Editais :: Gerenciar Editais"" 2º PASSO: Vejo a página ""Editais"" 3º PASSO: Olho para a listagem 4º PASSO: Olho a linha ""Nome do edital"" 5º PASSO: Clico no ícone de exibição 6º PASSO: Vejo a página ""Nome do edital - Edital de Ensino"" 7º PASSO: Clico na aba ""Plano de Oferta por Campus"" 8º PASSO: Clico no botão ""Adicionar Oferta"" 9º PASSO: Preencho o formulário com os dados 10º PASSO: Clico no botão ""Salvar"" 11º PASSO: Vejo mensagem de sucesso ""Oferta adicionada com sucesso.""\n\n. Exemplo: CANG Edital 01/2023 - 1 Semestre Descrição : Nesse campo é necessário informar os dados básicos do edital (número, período de vigência, data de inscrição, modalidade de auxílios ofertados, público e outras informações que o campus julgas necessário) Campus : Selecionar a sigla do campus correspondente. Atendimentos Incluídos : Selecionar os auxílios oferecidos no edital, inclusive o de mesmo nome do beneficio ofertado , e clicar em ""escolher"". Caso haja alguma seleção errada, selecionar a modalidade e selecionar ""remover"". Impedir que aluno solicite benefício ? NÃO SELECIONAR Público-Alvo : Selecionar a sigla do campus correspondente e clicar em ""escolher"" Acione o botão Salvar Benefícios POLAE - Procedimentos do setor de Serviço Social ou Comissão de Assistência Estudantil']","O Plano de Oferta por Campus define a abrangência do edital, permitindo que apenas servidores dos campi inseridos nesse plano possam submeter projetos. Isso impacta diretamente na seleção dos participantes e na organização das ações relacionadas ao edital, garantindo que apenas os servidores dos campi específicos possam participar.","O Plano de Oferta por Campus tem como finalidade definir a abrangência do edital. Sua inclusão é crucial, pois somente os servidores dos campi que forem inseridos neste plano estarão habilitados a submeter projetos para o edital em questão.",0.9999999999,1.0,0.4,0.2423502556800674
Qual o fluxo operacional para o registro das fontes de recurso associadas a um edital?,"['. Ação executada pelo Gerente Sistêmico de Projetos de Ensino ou Coordenador de Projetos de Ensino. 1º PASSO: Acesso o menu ""Ensino :: Projetos :: Editais :: Gerenciar Editais"" 2º PASSO: Vejo a página ""Editais"" 3º PASSO: Olho para a listagem 4º PASSO: Olho a linha ""Nome do edital"" 5º PASSO: Clico no ícone de exibição 6º PASSO: Vejo a página ""Nome do edital - Edital de Ensino"" 7º PASSO: Clico na aba ""Fonte de Recursos"" 8º PASSO: Clico no botão ""Adicionar Recurso"" 9º PASSO: Preencho o formulário com os dados 10º PASSO: Clico no botão ""Salvar"" 11º PASSO: Vejo mensagem de sucesso ""Recurso adicionado com sucesso.""\n\n. Ação executada pelo Gerente Sistêmico de Projetos de Ensino ou Coordenador de Projetos de Ensino. 1º PASSO: Acesso o menu ""Ensino :: Projetos :: Editais :: Gerenciar Editais"" 2º PASSO: Vejo a página ""Editais"" 3º PASSO: Olho para a listagem 4º PASSO: Olho a linha ""Nome do edital"" 5º PASSO: Clico no ícone de exibição 6º PASSO: Vejo a página ""Nome do edital - Edital de Ensino"" 7º PASSO: Clico na aba ""Fonte de Recursos"" 8º PASSO: Clico no botão ""Adicionar Recurso"" 9º PASSO: Preencho o formulário com os dados 10º PASSO: Clico no botão ""Salvar"" 11º PASSO: Vejo mensagem de sucesso ""Recurso adicionado com sucesso.""\n\nCadastro do edital para seleção de projetos de ensino. Ação executada pelo Gerente Sistêmico de Projetos de Ensino ou Coordenador de Projetos de Ensino. 1º PASSO: Acesso o menu ""Ensino :: Projetos :: Editais :: Gerenciar Editais"" 2º PASSO: Vejo a página ""Editais"" 3º PASSO: Clico no botão ""Adicionar Edital"" 4º PASSO: Vejo a página ""Adicionar Edital"" 5º PASSO: Preencho o formulário com os dados 6º PASSO: Clico no botão ""Salvar"" 7º PASSO: Vejo mensagem de sucesso ""Edital cadastrado com sucesso.""']","1. Acesse o menu ""Ensino :: Projetos :: Editais :: Gerenciar Editais""
2. Na página ""Editais"", clique no ícone de exibição do edital desejado
3. Na página do edital, clique na aba ""Fonte de Recursos""
4. Clique no botão ""Adicionar Recurso""
5. Preencha o formulário com os dados necessários
6. Clique no botão ""Salvar""
7. Verifique a mensagem de sucesso ""Recurso adicionado com sucesso.""","Para registrar as fontes de recurso, acesse 'Ensino :: Projetos :: Editais :: Gerenciar Editais', selecione o edital desejado clicando no ícone de exibição. Na página do edital, vá para a aba 'Fonte de Recursos', clique em 'Adicionar Recurso', preencha o formulário com as informações necessárias e clique em 'Salvar'. A confirmação virá com a mensagem de sucesso.",0.9999999999,0.6666666666666666,1.0,0.41928962249687374
Qual a interpretação do valor a ser inserido no campo 'Fontes de Recurso' de um edital e sua aplicabilidade?,"['O valor informado deverá ser o máximo que cada projeto aprovado poderá gastar na respectiva despesa(rubrica). Este valor servirá como base para o coordenador do projeto definir a memória de cálculo e o plano de desembolso. Ação executada pelo Gerente Sistêmico de Projetos de Ensino ou Coordenador de Projetos de Ensino\n\nO valor informado deverá ser o máximo que cada projeto aprovado poderá gastar na respectiva despesa(rubrica). Este valor servirá como base para o coordenador do projeto definir a memória de cálculo e o plano de desembolso. Ação executada pelo Gerente Sistêmico de Projetos de Ensino ou Coordenador de Projetos de Ensino\n\n. Ação executada pelo Gerente Sistêmico de Projetos de Ensino ou Coordenador de Projetos de Ensino. 1º PASSO: Acesso o menu ""Ensino :: Projetos :: Editais :: Gerenciar Editais"" 2º PASSO: Vejo a página ""Editais"" 3º PASSO: Olho para a listagem 4º PASSO: Olho a linha ""Nome do edital"" 5º PASSO: Clico no ícone de exibição 6º PASSO: Vejo a página ""Nome do edital - Edital de Ensino"" 7º PASSO: Clico na aba ""Fonte de Recursos"" 8º PASSO: Clico no botão ""Adicionar Recurso"" 9º PASSO: Preencho o formulário com os dados 10º PASSO: Clico no botão ""Salvar"" 11º PASSO: Vejo mensagem de sucesso ""Recurso adicionado com sucesso.""']",O valor a ser inserido no campo 'Fontes de Recurso' de um edital é o máximo que cada projeto aprovado poderá gastar na respectiva despesa (rubrica). Esse valor servirá como base para o coordenador do projeto definir a memória de cálculo e o plano de desembolso. Essa ação é executada pelo Gerente Sistêmico de Projetos de Ensino ou Coordenador de Projetos de Ensino.,"O valor informado nas Fontes de Recurso representa o montante máximo que cada projeto aprovado está autorizado a despender em sua respectiva rubrica de despesa. Este dado é fundamental, pois servirá de base para que o coordenador do projeto elabore a memória de cálculo e o plano de desembolso.",0.9999999999,1.0,1.0,0.41646799157542186
Qual a finalidade da seção 'Cadastro dos Critérios de Avaliação do Edital'?,"['Definição dos critérios que serão utilizados para avaliar os projetos submetidos. Ação executada pelo Gerente Sistêmico de Projetos de Ensino ou Coordenador de Projetos de Ensino. 1º PASSO: Acesso o menu ""Ensino :: Projetos :: Editais :: Gerenciar Editais"" 2º PASSO: Vejo a página ""Editais"" 3º PASSO: Olho para a listagem 4º PASSO: Olho a linha ""Nome do edital"" 5º PASSO: Clico no ícone de exibição 6º PASSO: Vejo a página ""Nome do edital - Edital de Ensino"" 7º PASSO: Clico na aba ""Critérios de Avaliação da Qualificação do Projeto"" 8º PASSO: Clico no botão ""Adicionar Critério de Avaliação"" 9º PASSO: Preencho o formulário com os dados 10º PASSO: Clico no botão ""Salvar"" 11º PASSO: Vejo mensagem de sucesso ""Critério de avaliação adicionado com sucesso.""\n\nDefinição dos critérios que serão utilizados para avaliar os projetos submetidos. Ação executada pelo Gerente Sistêmico de Projetos de Ensino ou Coordenador de Projetos de Ensino. 1º PASSO: Acesso o menu ""Ensino :: Projetos :: Editais :: Gerenciar Editais"" 2º PASSO: Vejo a página ""Editais"" 3º PASSO: Olho para a listagem 4º PASSO: Olho a linha ""Nome do edital"" 5º PASSO: Clico no ícone de exibição 6º PASSO: Vejo a página ""Nome do edital - Edital de Ensino"" 7º PASSO: Clico na aba ""Critérios de Avaliação da Qualificação do Projeto"" 8º PASSO: Clico no botão ""Adicionar Critério de Avaliação"" 9º PASSO: Preencho o formulário com os dados 10º PASSO: Clico no botão ""Salvar"" 11º PASSO: Vejo mensagem de sucesso ""Critério de avaliação adicionado com sucesso.""\n\nInclusão de mais um avaliador na comissão de avaliação do edital. Ação executada pelo Gerente Sistêmico de Projetos de Ensino ou Coordenador de Projetos de Ensino. 1º PASSO: Acesso o menu ""Ensino :: Projetos :: Editais :: Comissão de Avaliação"" 2º PASSO: Vejo a página ""Comissões de Avaliação"" 3º PASSO: Olho para a listagem 4º PASSO: Olho a linha ""Nome do edital - Edital de Ensino"" 5º PASSO: Clico no ícone de edição 6º PASSO: Vejo a página ""Editar Comissão do Nome do edital"" 7º PASSO: Preencho o formulário com os dados 8º PASSO: Clico no botão ""Salvar"" 9º PASSO: Vejo mensagem de sucesso ""Atualização realizada com sucesso.""']",A finalidade da seção 'Cadastro dos Critérios de Avaliação do Edital' é definir os critérios que serão utilizados para avaliar os projetos submetidos.,"A seção 'Cadastro dos Critérios de Avaliação do Edital' destina-se à definição dos parâmetros e diretrizes que serão empregados na análise e julgamento dos projetos submetidos, assegurando a padronização do processo avaliativo.",0.9999999999,1.0,1.0,0.9937412985124899
Qual é o caminho inicial para acessar a gestão de editais no sistema?,"['. Ação executada pelo Gerente Sistêmico de Projetos de Ensino ou Coordenador de Projetos de Ensino. 1º PASSO: Acesso o menu ""Ensino :: Projetos :: Editais :: Gerenciar Editais"" 2º PASSO: Vejo a página ""Editais"" 3º PASSO: Olho para a listagem 4º PASSO: Olho a linha ""Nome do edital"" 5º PASSO: Clico no ícone de exibição 6º PASSO: Vejo a página ""Nome do edital - Edital de Ensino"" 7º PASSO: Clico na aba ""Fonte de Recursos"" 8º PASSO: Clico no botão ""Adicionar Recurso"" 9º PASSO: Preencho o formulário com os dados 10º PASSO: Clico no botão ""Salvar"" 11º PASSO: Vejo mensagem de sucesso ""Recurso adicionado com sucesso.""\n\n. Ação executada pelo Gerente Sistêmico de Projetos de Ensino ou Coordenador de Projetos de Ensino. 1º PASSO: Acesso o menu ""Ensino :: Projetos :: Editais :: Gerenciar Editais"" 2º PASSO: Vejo a página ""Editais"" 3º PASSO: Olho para a listagem 4º PASSO: Olho a linha ""Nome do edital"" 5º PASSO: Clico no ícone de exibição 6º PASSO: Vejo a página ""Nome do edital - Edital de Ensino"" 7º PASSO: Clico na aba ""Fonte de Recursos"" 8º PASSO: Clico no botão ""Adicionar Recurso"" 9º PASSO: Preencho o formulário com os dados 10º PASSO: Clico no botão ""Salvar"" 11º PASSO: Vejo mensagem de sucesso ""Recurso adicionado com sucesso.""\n\nCadastro do edital para seleção de projetos de ensino. Ação executada pelo Gerente Sistêmico de Projetos de Ensino ou Coordenador de Projetos de Ensino. 1º PASSO: Acesso o menu ""Ensino :: Projetos :: Editais :: Gerenciar Editais"" 2º PASSO: Vejo a página ""Editais"" 3º PASSO: Clico no botão ""Adicionar Edital"" 4º PASSO: Vejo a página ""Adicionar Edital"" 5º PASSO: Preencho o formulário com os dados 6º PASSO: Clico no botão ""Salvar"" 7º PASSO: Vejo mensagem de sucesso ""Edital cadastrado com sucesso.""']","O caminho inicial para acessar a gestão de editais no sistema é: ""Ensino :: Projetos :: Editais :: Gerenciar Editais"".","Para acessar a gestão de editais, o usuário deve navegar pelo menu 'Ensino :: Projetos :: Editais :: Gerenciar Editais'. Esta ação direcionará à página 'Editais', onde as operações subsequentes podem ser realizadas.",0.9999999999,1.0,0.25,1.0
"Se um campus não estiver listado no 'Plano de Oferta por Campus' de um edital, quais são as implicações para os servidores desse campus?","['O Plano de Oferta define a abrangência do edital. Apenas servidores dos campi inseridos no Plano de Oferta poderão submeter projetos. Ação executada pelo Gerente Sistêmico de Projetos de Ensino ou Coordenador de Projetos de Ensino. 1º PASSO: Acesso o menu ""Ensino :: Projetos :: Editais :: Gerenciar Editais"" 2º PASSO: Vejo a página ""Editais"" 3º PASSO: Olho para a listagem 4º PASSO: Olho a linha ""Nome do edital"" 5º PASSO: Clico no ícone de exibição 6º PASSO: Vejo a página ""Nome do edital - Edital de Ensino"" 7º PASSO: Clico na aba ""Plano de Oferta por Campus"" 8º PASSO: Clico no botão ""Adicionar Oferta"" 9º PASSO: Preencho o formulário com os dados 10º PASSO: Clico no botão ""Salvar"" 11º PASSO: Vejo mensagem de sucesso ""Oferta adicionada com sucesso.""\n\nO Plano de Oferta define a abrangência do edital. Apenas servidores dos campi inseridos no Plano de Oferta poderão submeter projetos. Ação executada pelo Gerente Sistêmico de Projetos de Ensino ou Coordenador de Projetos de Ensino. 1º PASSO: Acesso o menu ""Ensino :: Projetos :: Editais :: Gerenciar Editais"" 2º PASSO: Vejo a página ""Editais"" 3º PASSO: Olho para a listagem 4º PASSO: Olho a linha ""Nome do edital"" 5º PASSO: Clico no ícone de exibição 6º PASSO: Vejo a página ""Nome do edital - Edital de Ensino"" 7º PASSO: Clico na aba ""Plano de Oferta por Campus"" 8º PASSO: Clico no botão ""Adicionar Oferta"" 9º PASSO: Preencho o formulário com os dados 10º PASSO: Clico no botão ""Salvar"" 11º PASSO: Vejo mensagem de sucesso ""Oferta adicionada com sucesso.""\n\n. Exemplo: CANG Edital 01/2023 - 1 Semestre Descrição : Nesse campo é necessário informar os dados básicos do edital (número, período de vigência, data de inscrição, modalidade de auxílios ofertados, público e outras informações que o campus julgas necessário) Campus : Selecionar a sigla do campus correspondente. Atendimentos Incluídos : Selecionar os auxílios oferecidos no edital, inclusive o de mesmo nome do beneficio ofertado , e clicar em ""escolher"". Caso haja alguma seleção errada, selecionar a modalidade e selecionar ""remover"". Impedir que aluno solicite benefício ? NÃO SELECIONAR Público-Alvo : Selecionar a sigla do campus correspondente e clicar em ""escolher"" Acione o botão Salvar Benefícios POLAE - Procedimentos do setor de Serviço Social ou Comissão de Assistência Estudantil']","Os servidores desse campus não poderão submeter projetos no edital, pois apenas os campi inseridos no Plano de Oferta poderão fazê-lo.","Se um campus não estiver inserido no 'Plano de Oferta por Campus', os servidores vinculados a essa unidade não terão a permissão para submeter projetos para o edital em questão, pois o plano delimita a abrangência permitida.",0.9999999999,1.0,1.0,0.0
"Após acessar a página 'Editais', qual o comando para iniciar o processo de inclusão de um novo edital?","['. Ação executada pelo Gerente Sistêmico de Projetos de Ensino ou Coordenador de Projetos de Ensino. 1º PASSO: Acesso o menu ""Ensino :: Projetos :: Editais :: Gerenciar Editais"" 2º PASSO: Vejo a página ""Editais"" 3º PASSO: Olho para a listagem 4º PASSO: Olho a linha ""Nome do edital"" 5º PASSO: Clico no ícone de exibição 6º PASSO: Vejo a página ""Nome do edital - Edital de Ensino"" 7º PASSO: Clico na aba ""Fonte de Recursos"" 8º PASSO: Clico no botão ""Adicionar Recurso"" 9º PASSO: Preencho o formulário com os dados 10º PASSO: Clico no botão ""Salvar"" 11º PASSO: Vejo mensagem de sucesso ""Recurso adicionado com sucesso.""\n\n. Ação executada pelo Gerente Sistêmico de Projetos de Ensino ou Coordenador de Projetos de Ensino. 1º PASSO: Acesso o menu ""Ensino :: Projetos :: Editais :: Gerenciar Editais"" 2º PASSO: Vejo a página ""Editais"" 3º PASSO: Olho para a listagem 4º PASSO: Olho a linha ""Nome do edital"" 5º PASSO: Clico no ícone de exibição 6º PASSO: Vejo a página ""Nome do edital - Edital de Ensino"" 7º PASSO: Clico na aba ""Fonte de Recursos"" 8º PASSO: Clico no botão ""Adicionar Recurso"" 9º PASSO: Preencho o formulário com os dados 10º PASSO: Clico no botão ""Salvar"" 11º PASSO: Vejo mensagem de sucesso ""Recurso adicionado com sucesso.""\n\nCadastro do edital para seleção de projetos de ensino. Ação executada pelo Gerente Sistêmico de Projetos de Ensino ou Coordenador de Projetos de Ensino. 1º PASSO: Acesso o menu ""Ensino :: Projetos :: Editais :: Gerenciar Editais"" 2º PASSO: Vejo a página ""Editais"" 3º PASSO: Clico no botão ""Adicionar Edital"" 4º PASSO: Vejo a página ""Adicionar Edital"" 5º PASSO: Preencho o formulário com os dados 6º PASSO: Clico no botão ""Salvar"" 7º PASSO: Vejo mensagem de sucesso ""Edital cadastrado com sucesso.""']","Após acessar a página 'Editais', o comando para iniciar o processo de inclusão de um novo edital é clicar no botão ""Adicionar Edital"".","Após navegar até a página 'Editais', para iniciar a inclusão de um novo edital, deve-se clicar no botão 'Adicionar Edital'. Esta ação conduzirá à página 'Adicionar Edital', onde o preenchimento dos dados será efetuado.",0.9999999999,1.0,1.0,0.8691042311670008
"E aí, tô querendo reservar o rango, mas tô meio perdido. Oq eu faço pra reservar a comida pelo SUAP, tipo, com minha conta?","['Acesse sua conta do suap Acesse o menu: ATIVIDADES ESTUDANTIS - Restaurante Institucional - Reservar Refeições Clique no botão Reservar da refeição disponível para reserva Nota: Para que a reserva seja realizada com sucesso é necessário atender os requisitos abaixo: - Aluno precisa está matriculado - A quantidade de reservas não podem ser igual a quantidade da refeição liberada - Aguarde o início das reservas - Reservar antes do horário de encerramento das reservas Reserva realizada com sucesso Área do Aluno\n\nAcesse a página inicial do Suap (página de Login IFPI ) e vá em ATIVIDADES ESTUDANTIS - Refeições Selecione o campus e depois clique no botão Enviar Caso exista refeições liberadas para reservas, clique no botão Reservar Informe sua matrícula e data de nascimento Se tudo ocorrer bem, a reserva será realizada com sucesso Área do Aluno\n\nAcesse sua conta do SUAP Clique no seu perfil/nome localizado no canto superior esquerdo. Nota: O acesso do aluno ao espaço físico do restaurante institucional se dá por meio da leitura do código de barra da carteirinha. Clique no botão Documentos Clique no botão Imprimir Carteirinha Nota: O aluno poderá usar a carteirinha no celular ou impressa Área do Aluno']","Para reservar a refeição pelo SUAP com sua conta, siga estes passos:
1. Acesse sua conta do SUAP e vá em ATIVIDADES ESTUDANTIS - Restaurante Institucional - Reservar Refeições.
2. Clique no botão Reservar da refeição disponível para reserva.
3. Certifique-se de atender aos requisitos necessários para a reserva.
4. Aguarde o início das reservas e reserve antes do horário de encerramento das reservas.
5. Caso haja refeições liberadas para reservas, selecione o campus, clique em Enviar e depois em Reservar.
6. Informe sua matrícula e data de nascimento para concluir a reserva com sucesso.","Para reservar refeição com sua conta do SUAP, você precisa acessar o menu: ATIVIDADES ESTUDANTIS - Restaurante Institucional - Reservar Refeições. Depois, é só clicar no botão 'Reservar' da refeição disponível.",0.9999999999,1.0,1.0,0.821532591467072
"Mano, tentei reservar a comida e não foi. Oq precisa pra minha reserva dar certo? Tem alguma condição ou algo assim?","['Acesse sua conta do suap Acesse o menu: ATIVIDADES ESTUDANTIS - Restaurante Institucional - Reservar Refeições Clique no botão Reservar da refeição disponível para reserva Nota: Para que a reserva seja realizada com sucesso é necessário atender os requisitos abaixo: - Aluno precisa está matriculado - A quantidade de reservas não podem ser igual a quantidade da refeição liberada - Aguarde o início das reservas - Reservar antes do horário de encerramento das reservas Reserva realizada com sucesso Área do Aluno\n\nAcesse o menu: ATIVIDADES ESTUDANTIS - Restaurante Institucional - Minhas Reservas Busque a reserva que deseja cancelar Clique no botão Cancelar Nota: O aluno pode cancelar sua reserva até 30 min antes do horário de encerramento das reservas. - Caso o aluno faça uma reserva e não consumir, ele fica sem poder reservar posteriormente o mesmo tipo de refeição não consumida até que se justifique no setor responsável. Área do Aluno\n\nAcesse o menu: ATIVIDADES ESTUDANTIS - Restaurante Institucional - Minhas Reservas Busque pela reserva Clique no botão Ver Justificativa Tela da Justificativa Área do Aluno']","Para que a reserva da refeição no Restaurante Institucional seja realizada com sucesso, é necessário atender aos seguintes requisitos: estar matriculado, reservar antes do horário de encerramento das reservas, aguardar o início das reservas e a quantidade de reservas não pode ser igual à quantidade da refeição liberada. Certifique-se de seguir essas condições para que sua reserva seja efetuada com sucesso.","Para que sua reserva seja realizada com sucesso, você precisa estar matriculado, a quantidade de reservas não pode ser igual à quantidade de refeições liberadas, aguardar o início das reservas e reservar antes do horário de encerramento das reservas.",0.9999999999,1.0,1.0,0.5924043270239576
"Puts, esqueci minha senha do SUAP, mas tô com fome. Tem como reservar a refeição sem logar na conta? Tipo, sem acesso mesmo?","['Acesse sua conta do suap Acesse o menu: ATIVIDADES ESTUDANTIS - Restaurante Institucional - Reservar Refeições Clique no botão Reservar da refeição disponível para reserva Nota: Para que a reserva seja realizada com sucesso é necessário atender os requisitos abaixo: - Aluno precisa está matriculado - A quantidade de reservas não podem ser igual a quantidade da refeição liberada - Aguarde o início das reservas - Reservar antes do horário de encerramento das reservas Reserva realizada com sucesso Área do Aluno\n\nFaça o login no SUAP : Acesse: ATIVIDADES ESTUDANTIS - Restaurante Institucional - Refeições : Preencha o formulário e salve : Área Nutricionista\n\nAcesse a página inicial do Suap (página de Login IFPI ) e vá em ATIVIDADES ESTUDANTIS - Refeições Selecione o campus e depois clique no botão Enviar Caso exista refeições liberadas para reservas, clique no botão Reservar Informe sua matrícula e data de nascimento Se tudo ocorrer bem, a reserva será realizada com sucesso Área do Aluno']",Não encontrei essa informação nos manuais do SUAP disponíveis.,"Sim, é possível reservar refeição sem acesso à sua conta do SUAP. Você deve ir na página inicial do SUAP (página de Login IFPI), depois em ATIVIDADES ESTUDANTIS - Refeições. Selecione o campus, clique no botão 'Enviar', e se houver refeições liberadas para reservas, clique no botão 'Reservar'. Aí é só informar sua matrícula e data de nascimento.",0.9999999999,1.0,0.0,0.0
"Fiz umas reservas, mas não lembro quais. Onde eu vejo minhas reservas que já fiz? Tipo, pra buscar elas.",['Acesse o menu: ATIVIDADES ESTUDANTIS - Restaurante Institucional - Minhas Reservas Busque pela reserva Clique no botão Ver Justificativa Tela da Justificativa Área do Aluno\n\nAcesse: ATIVIDADES ESTUDANTIS - Restaurante Institucional - Reservas Refeições Preencha a o formulário de justificativa e salve. Visualizar justificativa Tela da Justificativa\n\nAcesse o menu: ATIVIDADES ESTUDANTIS - Restaurante Institucional - Minhas Reservas Área do Aluno'],"1. Acesse o menu: ATIVIDADES ESTUDANTIS - Restaurante Institucional - Minhas Reservas
2. Busque pela reserva que deseja visualizar.","Para buscar suas reservas, acesse o menu: ATIVIDADES ESTUDANTIS - Restaurante Institucional - Minhas Reservas.",0.9999999999,1.0,1.0,0.6636800744338246
"Putz, reservei a comida mas não vou conseguir ir. Como eu faço pra cancelar a reserva? Tem algum lugar específico?","['Acesse o menu: ATIVIDADES ESTUDANTIS - Restaurante Institucional - Minhas Reservas Busque a reserva que deseja cancelar Clique no botão Cancelar Nota: O aluno pode cancelar sua reserva até 30 min antes do horário de encerramento das reservas. - Caso o aluno faça uma reserva e não consumir, ele fica sem poder reservar posteriormente o mesmo tipo de refeição não consumida até que se justifique no setor responsável. Área do Aluno\n\nAcesse sua conta do suap Acesse o menu: ATIVIDADES ESTUDANTIS - Restaurante Institucional - Reservar Refeições Clique no botão Reservar da refeição disponível para reserva Nota: Para que a reserva seja realizada com sucesso é necessário atender os requisitos abaixo: - Aluno precisa está matriculado - A quantidade de reservas não podem ser igual a quantidade da refeição liberada - Aguarde o início das reservas - Reservar antes do horário de encerramento das reservas Reserva realizada com sucesso Área do Aluno\n\nAcesse o menu: ATIVIDADES ESTUDANTIS - Restaurante Institucional - Minhas Reservas Busque pela reserva Clique no botão Ver Justificativa Tela da Justificativa Área do Aluno']","Para cancelar a reserva da refeição no Restaurante Institucional, siga os passos abaixo:
1. Acesse sua conta no SUAP.
2. Vá em ATIVIDADES ESTUDANTIS - Restaurante Institucional - Minhas Reservas.
3. Busque pela reserva que deseja cancelar.
4. Clique no botão Cancelar.
Lembre-se que o cancelamento deve ser feito até 30 minutos antes do horário de encerramento das reservas.","Para cancelar uma reserva, acesse o menu: ATIVIDADES ESTUDANTIS - Restaurante Institucional - Minhas Reservas. Busque a reserva que deseja cancelar e clique no botão 'Cancelar'.",0.9999999999,1.0,0.8333333333333334,0.7138720756599488
"E aí, até quando eu posso cancelar a reserva da comida? Tipo, tem um limite de tempo ou posso cancelar a qualquer hora?","['Acesse o menu: ATIVIDADES ESTUDANTIS - Restaurante Institucional - Minhas Reservas Busque a reserva que deseja cancelar Clique no botão Cancelar Nota: O aluno pode cancelar sua reserva até 30 min antes do horário de encerramento das reservas. - Caso o aluno faça uma reserva e não consumir, ele fica sem poder reservar posteriormente o mesmo tipo de refeição não consumida até que se justifique no setor responsável. Área do Aluno\n\nAcesse sua conta do suap Acesse o menu: ATIVIDADES ESTUDANTIS - Restaurante Institucional - Reservar Refeições Clique no botão Reservar da refeição disponível para reserva Nota: Para que a reserva seja realizada com sucesso é necessário atender os requisitos abaixo: - Aluno precisa está matriculado - A quantidade de reservas não podem ser igual a quantidade da refeição liberada - Aguarde o início das reservas - Reservar antes do horário de encerramento das reservas Reserva realizada com sucesso Área do Aluno\n\nAcesse o menu: ATIVIDADES ESTUDANTIS - Restaurante Institucional - Minhas Reservas Busque pela reserva Clique no botão Ver Justificativa Tela da Justificativa Área do Aluno']",Você pode cancelar sua reserva até 30 minutos antes do horário de encerramento das reservas.,Você pode cancelar sua reserva até 30 minutos antes do horário de encerramento das reservas.,0.9999999999,1.0,1.0,0.7206148255991514
"Mano, e se eu reservar a comida e não for buscar? Tipo, qual é a bronca? Fico de castigo ou oq?","['Acesse o menu: ATIVIDADES ESTUDANTIS - Restaurante Institucional - Minhas Reservas Busque a reserva que deseja cancelar Clique no botão Cancelar Nota: O aluno pode cancelar sua reserva até 30 min antes do horário de encerramento das reservas. - Caso o aluno faça uma reserva e não consumir, ele fica sem poder reservar posteriormente o mesmo tipo de refeição não consumida até que se justifique no setor responsável. Área do Aluno\n\nEscolha o tipo de Refeição Deixe o cursor do mouse no campo ""Matrícula"" Passe o leitor de código de barras no código de barras da carteirinha do aluno Nota: Caso o aluno tenha reserva da refeição informada, seu acesso será liberado; caso contrário, seu acesso não permitido. Sistema de Controle de Acesso ao Restaurante Institucional\n\nAcesse sua conta do suap Acesse o menu: ATIVIDADES ESTUDANTIS - Restaurante Institucional - Reservar Refeições Clique no botão Reservar da refeição disponível para reserva Nota: Para que a reserva seja realizada com sucesso é necessário atender os requisitos abaixo: - Aluno precisa está matriculado - A quantidade de reservas não podem ser igual a quantidade da refeição liberada - Aguarde o início das reservas - Reservar antes do horário de encerramento das reservas Reserva realizada com sucesso Área do Aluno']","Se o aluno fizer uma reserva de refeição e não consumir, ele ficará sem poder reservar posteriormente o mesmo tipo de refeição não consumida até que se justifique no setor responsável.","Caso você faça uma reserva e não consumir, você fica sem poder reservar posteriormente o mesmo tipo de refeição não consumida até que se justifique no setor responsável.",0.9999999999,1.0,0.5,0.6085230025746544
"E aí, vi que tem tipo uma carteirinha pro restaurante. Como eu faço pra imprimir essa carteirinha pra entrar no restaurante?","['Tela do Sistema Controle de Acesso ao Restaurante Institucional Nota: Com a carteirinha em mãos, aponte o código de barra no leitor de código de barra do Sistema Controle de acesso ao Restaurante Institucional que se encontra posicionado na entrada do restaurante.\n\nAcesse sua conta do SUAP Clique no seu perfil/nome localizado no canto superior esquerdo. Nota: O acesso do aluno ao espaço físico do restaurante institucional se dá por meio da leitura do código de barra da carteirinha. Clique no botão Documentos Clique no botão Imprimir Carteirinha Nota: O aluno poderá usar a carteirinha no celular ou impressa Área do Aluno\n\nClique no botão ""Opções"" no canto superior esquerdo da tela Clique em ""Campus"" Clique em ""Cadastrar"" Sistema de Controle de Acesso ao Restaurante Institucional']","1. Acesse sua conta no SUAP.
2. Clique no seu perfil/nome no canto superior esquerdo.
3. Clique em ""Documentos"".
4. Clique em ""Imprimir Carteirinha"".","O manual menciona a funcionalidade 'Imprimir Carteirinha para Acesso ao Restaurante Institucional' na área do aluno. No entanto, o trecho fornecido não detalha os passos específicos para realizar a impressão.",0.9999999999,0.5,1.0,0.3288559130725078
"Se eu não comer a comida que reservei, tem que justificar, né? Mas como eu faço pra visualizar essas justificativas que eu fiz? Tipo, onde vejo se deu certo?",['Acesse: ATIVIDADES ESTUDANTIS - Restaurante Institucional - Reservas Refeições Preencha a o formulário de justificativa e salve. Visualizar justificativa Tela da Justificativa\n\nAcesse o menu: ATIVIDADES ESTUDANTIS - Restaurante Institucional - Minhas Reservas Busque pela reserva Clique no botão Ver Justificativa Tela da Justificativa Área do Aluno\n\nAcesse: ATIVIDADES ESTUDANTIS - Restaurante Institucional - Reservas Refeições Preencha a o formulário de justificativa e salve. Visualizar justificativa Tela da Justificativa Área Nutricionista'],"Para visualizar as justificativas que você fez para reservas de refeições no Restaurante Institucional, siga os passos abaixo:

1. Acesse o menu: ATIVIDADES ESTUDANTIS - Restaurante Institucional - Minhas Reservas.
2. Busque pela reserva que deseja verificar.
3. Clique no botão ""Ver Justificativa"" para visualizar a justificativa associada à reserva.
4. A tela exibida será a ""Tela da Justificativa"" na ""Área do Aluno"" ou na ""Área Nutricionista"", dependendo do perfil de acesso.

Dessa forma, você poderá verificar se a justificativa foi registrada com sucesso.","O manual informa que na Área do Aluno é possível 'Visualizar Justificativa de Reservas de Refeições não Consumidas'. Contudo, o texto não descreve o procedimento passo a passo para acessar essa visualização.",0.9999999999,0.5,1.0,0.7030527702350767
"E aí, calouro aqui, tô meio perdido. Oq eu consigo fazer no sistema do restaurante institucional, tipo, quais são as opções pra mim?","['Clique no botão ""Opções"" no canto superior esquerdo da tela Clique em ""Campus"" Clique em ""Cadastrar"" Sistema de Controle de Acesso ao Restaurante Institucional\n\nSistema de Controle de Acesso ao Restaurante Institucional\n\nClique no botão ""Opções"" no canto superior esquerdo da tela Clique em ""Sincronizar com Suap"" Clique em ""Puxar Reservas Refeições"" Sistema de Controle de Acesso ao Restaurante Institucional']","1. Clique no botão ""Opções"" no canto superior esquerdo da tela.
2. Clique em ""Campus"".
3. Clique em ""Cadastrar"".
4. Clique em ""Sincronizar com Suap"".
5. Clique em ""Puxar Reservas Refeições"".","Como aluno, você pode 'Reservar Refeição com Acesso a Conta do Suap', 'Reservar Refeição sem Acesso a Conta do Suap', 'Buscar Reservas', 'Cancelar Reserva', 'Visualizar Justificativa de Reservas de Refeições não Consumidas' e 'Imprimir Carteirinha para Acesso ao Restaurante Institucional'.",0.9999999999,1.0,1.0,0.33354666830610324
"Tô tentando achar o SUAP no site do IFPI, mas não acho o link. Onde fica, tipo?","['O primeiro passo é saber o caminho para acessar o sistema SUAP. Pelo site do IFPI é possível encontrar o link que leva ao sistema. 1º PASSO : Procurando a palavra IFPI no Google, o site do instituto aparece na primeira posição da lista de resultados. 2º PASSO : Digitando "" ifpi.edu.br "" na barra de endereços. Tem-se o acesso direto ao site do IFPI. 3º PASSO : Navegando pelo menu esquerdo do site até a parte área do servidor, encontra-se o Link "" SUAP "" que leva ao sistema. 4º PASSO : Para acessar o sistema SUAP é necessário estar autenticado.\n\nAcessar o sistema SUAP de forma direta 1º PASSO : Ao tentar encontrar o sistema SUAP pelo Google, é importante observar se o link está ligado ao IFPI 2º PASSO : Digitando "" suap.ifpi.edu.br "" na barra de endereços. Tem-se o acesso direto ao sistema SUAP\n\nPasso 01 : Na página inicial do Suap, acessada em suap.ifpi.edu.br , vá até o menu lateral esquerdo e clique em Processos Eletrônicos. Essa funcionalidade também está disponível no portal institucional ifpi.edu.br , no menu Consulta de Processos https://www.ifpi.edu.br/consulta-de-processos , opção Consulta de processos eletrônicos. Passo 02 : Na página digite os dados do processo que você deseja consultar. Será exigido pelo módulo pelo menos um campo preenchido. O usuário poderá fazer a pesquisa com o Número do processo , o Tipo de processo ou mesmo o Assunto , nesse último caso o campo de consulta deverá ser preenchido com no mínimo três palavras']","1. Procurar a palavra IFPI no Google e acessar o site do instituto.
2. Digitar ""ifpi.edu.br"" na barra de endereços para acessar o site do IFPI.
3. Navegar pelo menu esquerdo do site até a área do servidor e encontrar o link ""SUAP"" que leva ao sistema.","Pra achar o link do SUAP pelo site do IFPI, você precisa primeiro procurar 'IFPI' no Google ou digitar 'ifpi.edu.br'. Depois, navegue pelo menu esquerdo do site até a 'área do servidor', e lá você encontra o link 'SUAP'.",0.9999999999,1.0,1.0,0.7891023415099966
"Tem um jeito mais rápido de entrar no SUAP? Tipo, um link direto?","['Acessar o sistema SUAP de forma direta 1º PASSO : Ao tentar encontrar o sistema SUAP pelo Google, é importante observar se o link está ligado ao IFPI 2º PASSO : Digitando "" suap.ifpi.edu.br "" na barra de endereços. Tem-se o acesso direto ao sistema SUAP\n\n. Após o acesso, o examinador externo poderá visualizar a ata e assinar eletronicamente o documento. 2º PASSO: Ao clicar no link, o examinador será redirecionado para a página de acesso ao SUAP . Para o primeiro acesso, é necessário clicar em ""Esqueceu a senha"". Em seguida, o examinador deve criar uma nova senha e, posteriormente, acessar a página do SUAP . 3º PASSO: Ao clicar no link, o examinador será redirecionado para a página de redefinição de senha. O examinador deve criar uma nova senha, inserindo seu nome de usuário (que é o CPF do examinador), CPF e completar a verificação ""Não sou um robô"". Em seguida, clique em ""Enviar"". Um link para a redefinição de senha será gerado e enviado para o endereço de e-mail cadastrado\n\nQuem faz : Aluno Para realizar os procedimentos a seguir é necessário está logado no sistema SUAP, para mais informações ver: Como fazer Login no SUAP Edu ? Inscrever-se em um Programa Na tela inicial do SUAP na seção de notificações ( Fique Atento! ), inscreva-se clicando no programa com período de inscrição aberto. Para inscrever-se em editais de Benefícios é obrigatório está com a caracterização socioeconômica atualizada Preencha a caraterização socioeconômica e o questionário de inscrição e em seguida clique e Enviar Na próxima seção, preencha corretamente os dados da inscrição com atenção ao quadro de composição do grupo familiar ao final, clique novamente em Continuar Anexe a documentação comprobatória e clique em Continuar Os tipos de arquivos permitidos são: .pdf, .jpeg, .jpg,']","Sim, para acessar o SUAP de forma direta, basta digitar ""suap.ifpi.edu.br"" na barra de endereços do navegador. Isso garantirá o acesso direto ao sistema SUAP do IFPI.","Sim, você pode acessar o SUAP de forma direta digitando 'suap.ifpi.edu.br' na barra de endereços do seu navegador.",0.9999999999,1.0,0.5,0.8007313114290197
"Qual é o meu usuário pra logar no SUAP? Sou aluno, tô perdido.","['O passo a passo para fazer o processo de autenticação do usuário no sistema SUAP 1º PASSO : Dependendo do caso, o usuário vai ser o SIAPE para o servidor, MATRÍCULA no caso do aluno e o CPF para os terceirizados, bolsistas e afins. 2º PASSO : O processo de autenticação sendo bem-sucedido. O acesso às funcionalidades do sistema será liberado da forma apresentada na tela abaixo, constando no menu esquerdo a foto com o nome do usuário logado e o link "" SAIR "" para fechar a sessão. Caso apareça uma tela com uma mensagem de erro, o usuário deverá rever: - A senha ou usuário estão errados; - O usuário não está cadastrado no sistema; - O usuário está inativo ou sem permissões de acessar o sistema;\n\nAcesse sua conta do SUAP Clique no seu perfil/nome localizado no canto superior esquerdo. Nota: O acesso do aluno ao espaço físico do restaurante institucional se dá por meio da leitura do código de barra da carteirinha. Clique no botão Documentos Clique no botão Imprimir Carteirinha Nota: O aluno poderá usar a carteirinha no celular ou impressa Área do Aluno\n\nQuem faz : Aluno Para realizar os procedimentos a seguir é necessário está logado no sistema SUAP, para mais informações ver: Como fazer Login no SUAP Edu ? Inscrever-se em um Programa Na tela inicial do SUAP na seção de notificações ( Fique Atento! ), inscreva-se clicando no programa com período de inscrição aberto. Para inscrever-se em editais de Benefícios é obrigatório está com a caracterização socioeconômica atualizada Preencha a caraterização socioeconômica e o questionário de inscrição e em seguida clique e Enviar Na próxima seção, preencha corretamente os dados da inscrição com atenção ao quadro de composição do grupo familiar ao final, clique novamente em Continuar Anexe a documentação comprobatória e clique em Continuar Os tipos de arquivos permitidos são: .pdf, .jpeg, .jpg,']","1. Se você é aluno, o seu usuário para logar no SUAP é a sua MATRÍCULA. 
2. Acesse sua conta do SUAP e clique no seu perfil/nome localizado no canto superior esquerdo.","Pra você que é aluno, o usuário para fazer login no SUAP é a sua MATRÍCULA.",0.9999999999,1.0,0.5,0.8918705694692162
"Tô tentando logar no SUAP, mas dá erro. Oq pode ser?","['O passo a passo para fazer o processo de autenticação do usuário no sistema SUAP 1º PASSO : Dependendo do caso, o usuário vai ser o SIAPE para o servidor, MATRÍCULA no caso do aluno e o CPF para os terceirizados, bolsistas e afins. 2º PASSO : O processo de autenticação sendo bem-sucedido. O acesso às funcionalidades do sistema será liberado da forma apresentada na tela abaixo, constando no menu esquerdo a foto com o nome do usuário logado e o link "" SAIR "" para fechar a sessão. Caso apareça uma tela com uma mensagem de erro, o usuário deverá rever: - A senha ou usuário estão errados; - O usuário não está cadastrado no sistema; - O usuário está inativo ou sem permissões de acessar o sistema;\n\n. OBSERVAÇÃO: Caso essa opção não esteja disponível, é provável que o usuário não possua as devidas permissões necessárias no SUAP. Para resolver esse problema, abra um chamado na central de serviços como mostra o tutorial Abrindo chamados na Central de Serviços solicitando a adição do perfil necessário para ter acesso a essa funcionalidade. 3º PASSO: Na tela seguinte, informe sua senha do SUAP, o certificado gerado em seu nome e a senha do certificado. Após inserir todas essas informações corretamente, clique no botão verde "" Enviar "". 4º PASSO: Se o processo for bem-sucedido, você verá uma tela com uma tarja verde no topo exibindo a mensagem "" Sessão de assinatura eletrônica iniciada com sucesso ""\n\nQuem faz : Aluno Para realizar os procedimentos a seguir é necessário está logado no sistema SUAP, para mais informações ver: Como fazer Login no SUAP Edu ? Inscrever-se em um Programa Na tela inicial do SUAP na seção de notificações ( Fique Atento! ), inscreva-se clicando no programa com período de inscrição aberto. Para inscrever-se em editais de Benefícios é obrigatório está com a caracterização socioeconômica atualizada Preencha a caraterização socioeconômica e o questionário de inscrição e em seguida clique e Enviar Na próxima seção, preencha corretamente os dados da inscrição com atenção ao quadro de composição do grupo familiar ao final, clique novamente em Continuar Anexe a documentação comprobatória e clique em Continuar Os tipos de arquivos permitidos são: .pdf, .jpeg, .jpg,']","O erro ao tentar logar no SUAP pode ocorrer por diferentes motivos, como senha ou usuário incorretos, usuário não cadastrado, usuário inativo ou sem permissões de acesso. Certifique-se de inserir corretamente suas informações e, se o problema persistir, abra um chamado na central de serviços para solicitar as devidas permissões necessárias.","Se aparecer uma mensagem de erro ao tentar logar, pode ser que a senha ou o usuário estejam errados, que seu usuário não esteja cadastrado no sistema, ou que esteja inativo/sem permissões.",0.9999999999,1.0,0.75,0.8533405355882638
"Esqueci minha senha do SUAP, e agora? Tem como mudar?","['. Em seguida, clique em ""Enviar"". Um link para a redefinição de senha será gerado e enviado para o endereço de e-mail cadastrado. 4º PASSO: Basta acessar o seu e-mail e proceder com a troca da senha para poder fazer o primeiro acesso ao Suap e realizar a avaliação da ata. ====================================================================================================== ABERTURA DE CHAMADO PARA SINCRONIZAR PRESTADOR DE SERVIÇO/AVALIADOR EXTERNO 1º PASSO: Para abrir um chamado, acesse o SUAP e vá até o menu Central de Serviços -> Abrir Chamado no menu principal. Outra opção é acessar o link “ Abrir Chamado ” disponível na página inicial do SUAP\n\n. Após o acesso, o examinador externo poderá visualizar a ata e assinar eletronicamente o documento. 2º PASSO: Ao clicar no link, o examinador será redirecionado para a página de acesso ao SUAP . Para o primeiro acesso, é necessário clicar em ""Esqueceu a senha"". Em seguida, o examinador deve criar uma nova senha e, posteriormente, acessar a página do SUAP . 3º PASSO: Ao clicar no link, o examinador será redirecionado para a página de redefinição de senha. O examinador deve criar uma nova senha, inserindo seu nome de usuário (que é o CPF do examinador), CPF e completar a verificação ""Não sou um robô"". Em seguida, clique em ""Enviar"". Um link para a redefinição de senha será gerado e enviado para o endereço de e-mail cadastrado\n\n. 3º PASSO: Ao clicar no link, o examinador será redirecionado para a página de redefinição de senha. O examinador deve criar uma nova senha, inserindo seu nome de usuário (que é o CPF do examinador), CPF e completar a verificação ""Não sou um robô"". Em seguida, clique em ""Enviar"". Um link para a redefinição de senha será gerado e enviado para o endereço de e-mail cadastrado. 4º PASSO: Basta acessar o seu e-mail e proceder com a troca da senha para poder fazer o primeiro acesso ao Suap e realizar a avaliação da ata.']","1. Acesse a página de redefinição de senha no SUAP.
2. Insira seu nome de usuário (CPF), CPF e complete a verificação ""Não sou um robô"".
3. Clique em ""Enviar"" para gerar um link de redefinição de senha enviado para o seu e-mail cadastrado.
4. Acesse seu e-mail, siga as instruções para trocar a senha e assim poder fazer o primeiro acesso ao SUAP.","Sim, se a senha estiver errada ou desatualizada, o sistema oferece a opção de alterar a senha pelo link que aparece destacado na tela.",0.9999999999,0.0,1.0,0.8157483420742085
"Pra alterar a senha, oq eles pedem? Só a senha antiga?","['. 5º PASSO : O formulário para alterar a senha disponível de forma bastante explicativa. 6º PASSO : Mensagem de senha alterada com sucesso Se alguma das credenciais do requisitante estiver errada. O sistema irá rejeitar a solicitação com uma mensagem destacada em vermelho.\n\nEsta sessão demonstra que o usuário poderá restabelecer o acesso ao sistema, recuperando a senha esquecida ou aumentando a segurança pela criação de uma senha mais forte e atualizada. 1º PASSO : A mensagem mostrada na tela abaixo sinaliza que a senha está errada ou desatualizada. O sistema oferece a opção de alterar a senha pelo link destacado. 2º PASSO : Por questões de segurança, o requerente deverá informar as suas credenciais de Usuário e CPF. 3º PASSO : Com a solicitação de senha sendo bem sucedida, serão enviadas as instruções para o e-mail do requerente cadastrado no sistema. 4º PASSO : A mensagem no e-mail conterá um link que levará o requerente ao formulário de alteração da senha do usuário. 5º PASSO : O formulário para alterar a senha disponível de forma bastante explicativa\n\n. 3º PASSO: Ao clicar no link, o examinador será redirecionado para a página de redefinição de senha. O examinador deve criar uma nova senha, inserindo seu nome de usuário (que é o CPF do examinador), CPF e completar a verificação ""Não sou um robô"". Em seguida, clique em ""Enviar"". Um link para a redefinição de senha será gerado e enviado para o endereço de e-mail cadastrado. 4º PASSO: Basta acessar o seu e-mail e proceder com a troca da senha para poder fazer o primeiro acesso ao Suap e realizar a avaliação da ata.']","Não. Para alterar a senha, o sistema pede que o requerente informe as suas credenciais de Usuário e CPF.","Por questões de segurança, para alterar a senha, você deverá informar suas credenciais de Usuário e CPF.",0.9999999999,1.0,0.5,0.6456587561055365
"Depois de pedir pra mudar a senha, onde recebo as instruções?","['. 5º PASSO : O formulário para alterar a senha disponível de forma bastante explicativa. 6º PASSO : Mensagem de senha alterada com sucesso Se alguma das credenciais do requisitante estiver errada. O sistema irá rejeitar a solicitação com uma mensagem destacada em vermelho.\n\n. 2º Passo: O prestador de serviço deverá preencher o formulário de solicitação de mudança de senha e, em seguida, clicar em ""Enviar"" . 3º Passo: Quando o e-mail chegar na caixa de entrada, o prestador de serviço deverá abri-lo e clicar no link para gerar sua senha de acesso. 4º Passo: No menu lateral esquerdo, clique em ""DOCUMENTOS/PROCESSOS"" e, em seguida, selecione ""Documentos Eletrônicos - Dashboard"" . Na tela seguinte, clique em ""Assinaturas"" e depois em ""Documentos Esperando minha assinatura"" . 5º Passo: Você será redirecionado para uma página contendo todos os documentos que foram compartilhados e aguardam sua assinatura. Clique no ícone da lupa ao lado do documento para visualizá-lo. Observe que a situação do documento estará como ""aguardando assinatura""\n\nEsta sessão demonstra que o usuário poderá restabelecer o acesso ao sistema, recuperando a senha esquecida ou aumentando a segurança pela criação de uma senha mais forte e atualizada. 1º PASSO : A mensagem mostrada na tela abaixo sinaliza que a senha está errada ou desatualizada. O sistema oferece a opção de alterar a senha pelo link destacado. 2º PASSO : Por questões de segurança, o requerente deverá informar as suas credenciais de Usuário e CPF. 3º PASSO : Com a solicitação de senha sendo bem sucedida, serão enviadas as instruções para o e-mail do requerente cadastrado no sistema. 4º PASSO : A mensagem no e-mail conterá um link que levará o requerente ao formulário de alteração da senha do usuário. 5º PASSO : O formulário para alterar a senha disponível de forma bastante explicativa']","1. Após solicitar a mudança de senha, as instruções serão enviadas para o e-mail cadastrado no sistema do requerente.","Com a solicitação de senha sendo bem-sucedida, as instruções para a alteração serão enviadas para o e-mail do requerente que está cadastrado no sistema.",0.9999999999,1.0,0.5,0.8230774061671795
"Oq vem no e-mail pra mudar a senha? Tipo, um código?","['. 5º PASSO : O formulário para alterar a senha disponível de forma bastante explicativa. 6º PASSO : Mensagem de senha alterada com sucesso Se alguma das credenciais do requisitante estiver errada. O sistema irá rejeitar a solicitação com uma mensagem destacada em vermelho.\n\nEsta sessão demonstra que o usuário poderá restabelecer o acesso ao sistema, recuperando a senha esquecida ou aumentando a segurança pela criação de uma senha mais forte e atualizada. 1º PASSO : A mensagem mostrada na tela abaixo sinaliza que a senha está errada ou desatualizada. O sistema oferece a opção de alterar a senha pelo link destacado. 2º PASSO : Por questões de segurança, o requerente deverá informar as suas credenciais de Usuário e CPF. 3º PASSO : Com a solicitação de senha sendo bem sucedida, serão enviadas as instruções para o e-mail do requerente cadastrado no sistema. 4º PASSO : A mensagem no e-mail conterá um link que levará o requerente ao formulário de alteração da senha do usuário. 5º PASSO : O formulário para alterar a senha disponível de forma bastante explicativa\n\n. 2º Passo: O prestador de serviço deverá preencher o formulário de solicitação de mudança de senha e, em seguida, clicar em ""Enviar"" . 3º Passo: Quando o e-mail chegar na caixa de entrada, o prestador de serviço deverá abri-lo e clicar no link para gerar sua senha de acesso. 4º Passo: No menu lateral esquerdo, clique em ""DOCUMENTOS/PROCESSOS"" e, em seguida, selecione ""Documentos Eletrônicos - Dashboard"" . Na tela seguinte, clique em ""Assinaturas"" e depois em ""Documentos Esperando minha assinatura"" . 5º Passo: Você será redirecionado para uma página contendo todos os documentos que foram compartilhados e aguardam sua assinatura. Clique no ícone da lupa ao lado do documento para visualizá-lo. Observe que a situação do documento estará como ""aguardando assinatura""']",Não encontrei essa informação nos manuais do SUAP disponíveis.,A mensagem no e-mail conterá um link que vai te levar ao formulário de alteração da senha do usuário.,0.9999999999,1.0,0.0,0.0
"Tentei mudar a senha, mas deu erro. Tipo, não aceitou minhas infos. Oq pode ser?","['. 5º PASSO : O formulário para alterar a senha disponível de forma bastante explicativa. 6º PASSO : Mensagem de senha alterada com sucesso Se alguma das credenciais do requisitante estiver errada. O sistema irá rejeitar a solicitação com uma mensagem destacada em vermelho.\n\nEsta sessão demonstra que o usuário poderá restabelecer o acesso ao sistema, recuperando a senha esquecida ou aumentando a segurança pela criação de uma senha mais forte e atualizada. 1º PASSO : A mensagem mostrada na tela abaixo sinaliza que a senha está errada ou desatualizada. O sistema oferece a opção de alterar a senha pelo link destacado. 2º PASSO : Por questões de segurança, o requerente deverá informar as suas credenciais de Usuário e CPF. 3º PASSO : Com a solicitação de senha sendo bem sucedida, serão enviadas as instruções para o e-mail do requerente cadastrado no sistema. 4º PASSO : A mensagem no e-mail conterá um link que levará o requerente ao formulário de alteração da senha do usuário. 5º PASSO : O formulário para alterar a senha disponível de forma bastante explicativa\n\n. 2º Passo: O prestador de serviço deverá preencher o formulário de solicitação de mudança de senha e, em seguida, clicar em ""Enviar"" . 3º Passo: Quando o e-mail chegar na caixa de entrada, o prestador de serviço deverá abri-lo e clicar no link para gerar sua senha de acesso. 4º Passo: No menu lateral esquerdo, clique em ""DOCUMENTOS/PROCESSOS"" e, em seguida, selecione ""Documentos Eletrônicos - Dashboard"" . Na tela seguinte, clique em ""Assinaturas"" e depois em ""Documentos Esperando minha assinatura"" . 5º Passo: Você será redirecionado para uma página contendo todos os documentos que foram compartilhados e aguardam sua assinatura. Clique no ícone da lupa ao lado do documento para visualizá-lo. Observe que a situação do documento estará como ""aguardando assinatura""']","1. Verifique se a mensagem na tela sinaliza que a senha está errada ou desatualizada.
2. Informe suas credenciais de Usuário e CPF corretamente.
3. Aguarde as instruções que serão enviadas para o seu e-mail cadastrado no sistema.
4. Abra o e-mail recebido e clique no link para acessar o formulário de alteração de senha.
5. Preencha o formulário de solicitação de mudança de senha e clique em ""Enviar"".","Se alguma das credenciais que você informou estiver errada, o sistema irá rejeitar a solicitação com uma mensagem destacada em vermelho.",0.9999999999,1.0,0.8,0.3711168809910816
Eu consigo entrar no SUAP usando o GOV.BR? Tô acostumado a usar ele.,"['Acessar o sistema SUAP de forma direta 1º PASSO : Ao tentar encontrar o sistema SUAP pelo Google, é importante observar se o link está ligado ao IFPI 2º PASSO : Digitando "" suap.ifpi.edu.br "" na barra de endereços. Tem-se o acesso direto ao sistema SUAP\n\nObjetivo: Fornecer instruções claras e precisas para que o usuário externo possa assinar digitalmente um documento no PEN Suap, seguindo um passo a passo simples e fácil de entender. 1º PASSO: O usuário deverá acessar o SUAP (acesse aqui) utilizando sua conta do G o v . B R . 2º PASSO: O usuário deverá realizar o login através do portal do G o v . B R . Para isso, será necessário informar o número do CPF como usuário e, em seguida, clicar em Continuar. O sistema redirecionará o usuário para a página de autenticação do G o v . B R . 3º PASSO: Na tela seguinte, o usuário deverá digitar a sua senha cadastrada no G o v . B R e clicar em ""Entrar"" para acessar o SUAP\n\n. B R . 3º PASSO: Na tela seguinte, o usuário deverá digitar a sua senha cadastrada no G o v . B R e clicar em ""Entrar"" para acessar o SUAP . 4º PASSO: Ao acessar a página inicial do SUAP , o usuário será notificado com uma mensagem informando que há um Documento Eletrônico aguardando assinatura na seção ""ATRIBUÍDOS A MIM"" . Clique sobre a mensagem para acessar o documento e realizar a assinatura eletrônica. 5º PASSO: Na tela seguinte, o usuário deve clicar no ícone de lupa, localizado na coluna ""Ações"" , ao lado do documento que deseja assinar, para acessar a tela de assinatura. 6º PASSO: Após ler o conteúdo do documento, o usuário deve clicar no botão ""Assinar"" e, em seguida, selecionar a opção assinar ""Com G o v']","Sim, você consegue entrar no SUAP utilizando o GOV.BR. Basta acessar o SUAP utilizando sua conta do GOV.BR e seguir os passos de login descritos no manual.","O texto informa que o sistema aceita a autenticação feita utilizando o Gov.br, e que essa é uma ação executada pelo Monitor do Projeto (servidor).",0.9999999999,0.5,1.0,0.7232684794219071
"E aí, tipo, eu sou calouro e tô meio perdido. Pra me inscrever nas competições, sou eu mesmo que faço ou tem que pedir pra alguém?","['. Responsabilidade: Organizar e acompanhar as modalidades do seu campus. 👨\u200d🏫 Professor O professor tem acesso para inscrever alunos ou equipes nas competições. Pode: Visualizar as competições disponíveis; Cadastrar, editar e acompanhar as inscrições dos participantes; Enviar, editar ou excluir os documentos necessários dos seus inscritos. Responsabilidade: Garantir que seus alunos estejam devidamente inscritos e com a documentação correta. 👩\u200d🎓 Aluno O aluno pode fazer e gerenciar sua própria inscrição . Pode: Criar, visualizar, editar ou excluir sua inscrição; Enviar, atualizar ou remover seus próprios documentos. Responsabilidade: Cuidar da própria inscrição e garantir que todos os documentos estejam em ordem.\n\nPara o aluno ser adicionado como participante em um programa, é preciso registrar que a documentação dele foi entregue. Quem Faz: Assistente Social, Coordenador e Diretoria de Assistência Estudantil (Reitoria) Acessando a documentação do Aluno 1. Acesse as Inscrições No menu, abra: ATIVIDADES ESTUDANTIS >> Serviço Social >> Programas >> Inscrições 2. Filtre pelo Programa 3\n\nCadastro do aluno membro do projeto de ensino. Ação executada pelo Servidor (coordenador do projeto). 1º PASSO: Acesso o menu ""Ensino :: Projetos :: Meus Projetos"" 2º PASSO: Vejo a página ""Meus Projetos"" 3º PASSO: Clico no botão ""Visualizar"" 4º PASSO: Vejo a página ""Projeto de Ensino"" 5º PASSO: Clico na aba ""Equipe"" 6º PASSO: Clico no botão ""Adicionar Aluno"" 7º PASSO: Preencho o formulário com os dados 8º PASSO: Clico no botão ""Salvar"" 9º PASSO: Vejo mensagem de sucesso ""Participante adicionado com sucesso.""']","O aluno pode fazer e gerenciar sua própria inscrição nas competições. Você mesmo pode criar, visualizar, editar ou excluir sua inscrição, além de enviar, atualizar ou remover seus próprios documentos. Portanto, você é responsável por cuidar da sua inscrição e garantir que todos os documentos estejam em ordem.","Como aluno, você pode fazer e gerenciar sua própria inscrição nas competições esportivas do SUAP. Não precisa pedir para outra pessoa.",0.9999999999,0.5,0.8,0.5718278127754954
"Pô, me inscrevi, mas esqueci de anexar um doc. Consigo eu mesmo arrumar isso ou tenho que falar com o professor?","['. b) AGENDAR REPOSIÇÃO: Se houver uma data de reposição especificada, o coordenador deve marcar essa data. O professor inserirá a aula na data determinada. Essa opção é editável, permitindo ao professor remarcar a data, se necessário. c) DEVOLVER: Se houver algum erro no documento fornecido pelo professor, a coordenação devolve para que seja inserido um novo documento justificando a ausência. d) INDEFERIR: A justificativa não é aceita.\n\nCadastro de documento diverso relacionado ao projeto. Ação executada pelo Servidor (coordenador do projeto). 1º PASSO: Acesso o menu ""Ensino :: Projetos :: Meus Projetos"" 2º PASSO: Vejo a página ""Meus Projetos"" 3º PASSO: Clico no botão ""Visualizar"" 4º PASSO: Vejo a página ""Projeto de Ensino"" 5º PASSO: Clico na aba ""Anexos"" 6º PASSO: Clico no botão ""Adicionar Anexo"" 7º PASSO: Preencho o formulário com os dados 8º PASSO: Clico no botão ""Salvar"" 9º PASSO: Vejo mensagem de sucesso ""Anexo cadastrado com sucesso.""\n\nCadastro de documento diverso relacionado ao projeto. Ação executada pelo Servidor (coordenador do projeto). 1º PASSO: Acesso o menu ""Ensino :: Projetos :: Meus Projetos"" 2º PASSO: Vejo a página ""Meus Projetos"" 3º PASSO: Clico no botão ""Visualizar"" 4º PASSO: Vejo a página ""Projeto de Ensino"" 5º PASSO: Clico na aba ""Anexos"" 6º PASSO: Clico no botão ""Adicionar Anexo"" 7º PASSO: Preencho o formulário com os dados 8º PASSO: Clico no botão ""Salvar"" 9º PASSO: Vejo mensagem de sucesso ""Anexo cadastrado com sucesso.""']","Você pode realizar a ação de adicionar um documento relacionado ao projeto seguindo os passos descritos no contexto. Não é necessário falar com o professor para isso. Basta acessar o menu ""Ensino :: Projetos :: Meus Projetos"", visualizar o projeto, clicar na aba ""Anexos"", adicionar o anexo e salvar.","Sim, como aluno, você pode enviar, atualizar ou remover seus próprios documentos relacionados à sua inscrição a qualquer momento.",0.0,1.0,1.0,0.7078649758513821
"Onde eu vejo quais competições estão rolando pra eu me inscrever? Tipo, tem uma lista em algum lugar?","['. Responsabilidade: Organizar e acompanhar as modalidades do seu campus. 👨\u200d🏫 Professor O professor tem acesso para inscrever alunos ou equipes nas competições. Pode: Visualizar as competições disponíveis; Cadastrar, editar e acompanhar as inscrições dos participantes; Enviar, editar ou excluir os documentos necessários dos seus inscritos. Responsabilidade: Garantir que seus alunos estejam devidamente inscritos e com a documentação correta. 👩\u200d🎓 Aluno O aluno pode fazer e gerenciar sua própria inscrição . Pode: Criar, visualizar, editar ou excluir sua inscrição; Enviar, atualizar ou remover seus próprios documentos. Responsabilidade: Cuidar da própria inscrição e garantir que todos os documentos estejam em ordem.\n\n🏆 Coordenador de Competições Esportivas Sistêmico Este é o perfil com acesso total ao sistema . Ele atua como administrador geral das competições esportivas. Pode: Criar, editar e excluir competições; Gerenciar modalidades esportivas, polos (locais) e tipos de documentos aceitos; Configurar o sistema como um todo; Gerenciar inscrições de qualquer participante. Responsabilidade: Garantir o funcionamento das competições em toda a instituição. 🎯 Coordenador de Competições Esportivas de Campus Este perfil cuida apenas das competições realizadas no seu campus . Pode: Visualizar as competições ativas; Adicionar, editar ou remover modalidades esportivas do seu campus; Ajustar modalidades padrão conforme a necessidade local. Responsabilidade: Organizar e acompanhar as modalidades do seu campus\n\n.ifpi.edu.br/centralservicos/listar_area_servico/ , selecione a aba criada para essa finalidade. 1º Passo: No menu lateral, acesse a opção ADMINISTRAÇÃO e selecione Cadastros. Em seguida, clique em Prestadores de Serviço . 2º Passo: Na tela de Prestadores de Serviço, clique no botão Adicionar Prestadores de serviço , localizado no canto superior direito da página. A URL para acessar essa tela é https://suap.ifpi.edu.br/admin/comum/prestadorservico/ 3º Passo A (Estagiários e Terceirizados): Na tela de cadastro, preencha os dados do Prestador de Serviço solicitados. No campo ""Nome de Registro "", insira o nome do prestador. É importante lembrar que os campos CPF, Sexo, Nacionalidade e Setor são obrigatórios. 3.1']","Para visualizar as competições disponíveis e se inscrever, o professor deve acessar o sistema. Já o aluno pode fazer e gerenciar sua própria inscrição. Não há menção a uma lista específica de competições disponíveis para consulta.",Você pode visualizar as competições disponíveis no sistema SUAP para então criar sua inscrição.,0.9999999999,1.0,0.3333333333333333,0.7214262556925112
"Se eu me inscrever em algo e depois mudar de ideia, consigo editar os dados da minha inscrição ou até mesmo cancelar?","['Acesse o menu: ATIVIDADES ESTUDANTIS - Restaurante Institucional - Minhas Reservas Busque a reserva que deseja cancelar Clique no botão Cancelar Nota: O aluno pode cancelar sua reserva até 30 min antes do horário de encerramento das reservas. - Caso o aluno faça uma reserva e não consumir, ele fica sem poder reservar posteriormente o mesmo tipo de refeição não consumida até que se justifique no setor responsável. Área do Aluno\n\nPermite a atualização da data de término prevista do projeto. Ação executada pelo Servidor (coordenador do projeto). 1º PASSO: Acesso o menu ""Ensino :: Projetos :: Meus Projetos"" 2º PASSO: Vejo a página ""Meus Projetos"" 3º PASSO: Clico no botão ""Visualizar"" 4º PASSO: Vejo a página ""Projeto de Ensino"" 5º PASSO: Clico na aba ""Dados do Projeto"" 6º PASSO: Clico no botão ""Editar Projeto"" 7º PASSO: Vejo a página ""Editar Projeto"" 8º PASSO: Preencho o formulário com os dados 9º PASSO: Clico no botão ""Salvar"" 10º PASSO: Vejo mensagem de sucesso ""Projeto editado com sucesso.""\n\nPermite a atualização da data de término prevista do projeto. Ação executada pelo Servidor (coordenador do projeto). 1º PASSO: Acesso o menu ""Ensino :: Projetos :: Meus Projetos"" 2º PASSO: Vejo a página ""Meus Projetos"" 3º PASSO: Clico no botão ""Visualizar"" 4º PASSO: Vejo a página ""Projeto de Ensino"" 5º PASSO: Clico na aba ""Dados do Projeto"" 6º PASSO: Clico no botão ""Editar Projeto"" 7º PASSO: Vejo a página ""Editar Projeto"" 8º PASSO: Preencho o formulário com os dados 9º PASSO: Clico no botão ""Salvar"" 10º PASSO: Vejo mensagem de sucesso ""Projeto editado com sucesso.""']","Sim, é possível editar os dados da sua inscrição em um projeto. Para isso, siga os passos: Acesse o menu ""Ensino :: Projetos :: Meus Projetos"", visualize o projeto desejado, clique na aba ""Dados do Projeto"", edite as informações necessárias no formulário e salve as alterações. No entanto, para cancelar uma reserva no Restaurante Institucional, basta acessar o menu ""ATIVIDADES ESTUDANTIS - Restaurante Institucional - Minhas Reservas"", buscar a reserva que deseja cancelar e clicar no botão ""Cancelar"". Lembre-se que o cancelamento deve ser feito até 30 minutos antes do horário de encerramento das reservas.","Sim, como aluno, você tem a permissão para criar, visualizar, editar ou excluir sua própria inscrição.",0.9999999999,0.0,0.4,0.7037449780504147
"Meu professor falou que pode me inscrever, mas eu vi aqui que dá pra eu mesmo fazer. Qual que é o certo? Ele ou eu?","['. Responsabilidade: Organizar e acompanhar as modalidades do seu campus. 👨\u200d🏫 Professor O professor tem acesso para inscrever alunos ou equipes nas competições. Pode: Visualizar as competições disponíveis; Cadastrar, editar e acompanhar as inscrições dos participantes; Enviar, editar ou excluir os documentos necessários dos seus inscritos. Responsabilidade: Garantir que seus alunos estejam devidamente inscritos e com a documentação correta. 👩\u200d🎓 Aluno O aluno pode fazer e gerenciar sua própria inscrição . Pode: Criar, visualizar, editar ou excluir sua inscrição; Enviar, atualizar ou remover seus próprios documentos. Responsabilidade: Cuidar da própria inscrição e garantir que todos os documentos estejam em ordem.\n\nPara o aluno ser adicionado como participante em um programa, é preciso registrar que a documentação dele foi entregue. Quem Faz: Assistente Social, Coordenador e Diretoria de Assistência Estudantil (Reitoria) Acessando a documentação do Aluno 1. Acesse as Inscrições No menu, abra: ATIVIDADES ESTUDANTIS >> Serviço Social >> Programas >> Inscrições 2. Filtre pelo Programa 3\n\nQuem faz : Aluno Para realizar os procedimentos a seguir é necessário está logado no sistema SUAP, para mais informações ver: Como fazer Login no SUAP Edu ? Inscrever-se em um Programa Na tela inicial do SUAP na seção de notificações ( Fique Atento! ), inscreva-se clicando no programa com período de inscrição aberto. Para inscrever-se em editais de Benefícios é obrigatório está com a caracterização socioeconômica atualizada Preencha a caraterização socioeconômica e o questionário de inscrição e em seguida clique e Enviar Na próxima seção, preencha corretamente os dados da inscrição com atenção ao quadro de composição do grupo familiar ao final, clique novamente em Continuar Anexe a documentação comprobatória e clique em Continuar Os tipos de arquivos permitidos são: .pdf, .jpeg, .jpg,']","O professor pode inscrever alunos nas competições, mas o aluno também pode fazer e gerenciar sua própria inscrição. Portanto, tanto o professor quanto o aluno podem realizar a inscrição, cada um com suas responsabilidades específicas.","Você, como aluno, pode fazer e gerenciar sua própria inscrição. O professor também tem acesso para inscrever alunos ou equipes, então ambos podem realizar a inscrição, mas você tem autonomia sobre a sua.",0.9999999999,0.6666666666666666,0.75,0.5339931509276111
"Depois que me inscrevo, quem é o responsável pra ver se tá tudo certinho com minha inscrição e meus documentos?","['Este processo consiste em analisar as repostas do formulário de inscrição preenchido pelo aluno, tal como a caracterização socioeconômica do mesmo. Quem Faz: Assistente Social, Coordenador e Diretoria de Assistência Estudantil (Reitoria) Na tela de inscrições, Localize o Candidato e clique no botão Comprovante de Inscrição Visualize os dados da inscrição e caracterização socioeconômica do candidato Após a análise e aplicação dos critérios, você deve seguir para a emissão do parecer sobre a inscrição. Benefícios POLAE - Procedimentos do setor de Serviço Social ou Comissão de Assistência Estudantil\n\n. Responsabilidade: Organizar e acompanhar as modalidades do seu campus. 👨\u200d🏫 Professor O professor tem acesso para inscrever alunos ou equipes nas competições. Pode: Visualizar as competições disponíveis; Cadastrar, editar e acompanhar as inscrições dos participantes; Enviar, editar ou excluir os documentos necessários dos seus inscritos. Responsabilidade: Garantir que seus alunos estejam devidamente inscritos e com a documentação correta. 👩\u200d🎓 Aluno O aluno pode fazer e gerenciar sua própria inscrição . Pode: Criar, visualizar, editar ou excluir sua inscrição; Enviar, atualizar ou remover seus próprios documentos. Responsabilidade: Cuidar da própria inscrição e garantir que todos os documentos estejam em ordem.\n\n. Localize o Candidato e clique no botão Documentação do Aluno Visualize a documentação enviada pelo aluno clicando em Documentação Caso a documentação esteja em conformidade , retorne a página da inscrição do aluno e registre a entrega da documentação selecionando o aluno e clicando em Ação >> Registrar entrega de documentação >> Aplicar Registre a data da entrega e clique em Enviar Se toda documentação for entregue e realizado o registro acima, você poderá avançar para a próxima etapa: Visualizar respostas do aluno no Formulário de Caracterização/Inscrição Caso seja identificado alguma pendência na documentação, você poderá possibilitar ao aluno o reenvio do arquivo, alterando o parecer para Pendente de Documentação clicando em adicionar parecer > Pendente de documentação > Salvar']","O responsável por verificar se está tudo certinho com sua inscrição e seus documentos é o Assistente Social, Coordenador e Diretoria de Assistência Estudantil (Reitoria). Eles analisam as respostas do formulário de inscrição e a caracterização socioeconômica do aluno, podendo registrar a entrega da documentação e emitir parecer sobre a inscrição.","A responsabilidade de cuidar da sua própria inscrição e garantir que todos os documentos estejam em ordem é sua, como aluno.",0.9999999999,1.0,0.5,0.8506680966574547
"Sei que posso me inscrever, mas o professor consegue ver minha inscrição ou mexer nela? Tipo, ele pode editar meus dados?","['. Responsabilidade: Organizar e acompanhar as modalidades do seu campus. 👨\u200d🏫 Professor O professor tem acesso para inscrever alunos ou equipes nas competições. Pode: Visualizar as competições disponíveis; Cadastrar, editar e acompanhar as inscrições dos participantes; Enviar, editar ou excluir os documentos necessários dos seus inscritos. Responsabilidade: Garantir que seus alunos estejam devidamente inscritos e com a documentação correta. 👩\u200d🎓 Aluno O aluno pode fazer e gerenciar sua própria inscrição . Pode: Criar, visualizar, editar ou excluir sua inscrição; Enviar, atualizar ou remover seus próprios documentos. Responsabilidade: Cuidar da própria inscrição e garantir que todos os documentos estejam em ordem.\n\nPara o aluno ser adicionado como participante em um programa, é preciso registrar que a documentação dele foi entregue. Quem Faz: Assistente Social, Coordenador e Diretoria de Assistência Estudantil (Reitoria) Acessando a documentação do Aluno 1. Acesse as Inscrições No menu, abra: ATIVIDADES ESTUDANTIS >> Serviço Social >> Programas >> Inscrições 2. Filtre pelo Programa 3\n\nCadastro do aluno membro do projeto de ensino. Ação executada pelo Servidor (coordenador do projeto). 1º PASSO: Acesso o menu ""Ensino :: Projetos :: Meus Projetos"" 2º PASSO: Vejo a página ""Meus Projetos"" 3º PASSO: Clico no botão ""Visualizar"" 4º PASSO: Vejo a página ""Projeto de Ensino"" 5º PASSO: Clico na aba ""Equipe"" 6º PASSO: Clico no botão ""Adicionar Aluno"" 7º PASSO: Preencho o formulário com os dados 8º PASSO: Clico no botão ""Salvar"" 9º PASSO: Vejo mensagem de sucesso ""Participante adicionado com sucesso.""']","O professor pode visualizar as competições disponíveis, cadastrar, editar e acompanhar as inscrições dos participantes, além de enviar, editar ou excluir os documentos necessários dos inscritos. No entanto, não há informações que indiquem que o professor pode editar diretamente os dados da inscrição de um aluno.","Sim, o professor tem acesso para cadastrar, editar e acompanhar as inscrições dos participantes, além de enviar, editar ou excluir os documentos necessários dos seus inscritos.",0.9999999999,1.0,0.8571428571428571,0.47871784503375076
Qual a diferença entre o que eu faço e o que um coordenador de competições faz com as inscrições? Ele consegue ver as minhas?,"['🏆 Coordenador de Competições Esportivas Sistêmico Este é o perfil com acesso total ao sistema . Ele atua como administrador geral das competições esportivas. Pode: Criar, editar e excluir competições; Gerenciar modalidades esportivas, polos (locais) e tipos de documentos aceitos; Configurar o sistema como um todo; Gerenciar inscrições de qualquer participante. Responsabilidade: Garantir o funcionamento das competições em toda a instituição. 🎯 Coordenador de Competições Esportivas de Campus Este perfil cuida apenas das competições realizadas no seu campus . Pode: Visualizar as competições ativas; Adicionar, editar ou remover modalidades esportivas do seu campus; Ajustar modalidades padrão conforme a necessidade local. Responsabilidade: Organizar e acompanhar as modalidades do seu campus\n\n. Responsabilidade: Organizar e acompanhar as modalidades do seu campus. 👨\u200d🏫 Professor O professor tem acesso para inscrever alunos ou equipes nas competições. Pode: Visualizar as competições disponíveis; Cadastrar, editar e acompanhar as inscrições dos participantes; Enviar, editar ou excluir os documentos necessários dos seus inscritos. Responsabilidade: Garantir que seus alunos estejam devidamente inscritos e com a documentação correta. 👩\u200d🎓 Aluno O aluno pode fazer e gerenciar sua própria inscrição . Pode: Criar, visualizar, editar ou excluir sua inscrição; Enviar, atualizar ou remover seus próprios documentos. Responsabilidade: Cuidar da própria inscrição e garantir que todos os documentos estejam em ordem.\n\n. 3º PASSO: O coordenador deverá clicar no botão "" Adicionar "", o que o redirecionará para outra página. 4º PASSO: Preencha todos os campos obrigatórios e, se necessário, adicione informações complementares. 5º PASSO: Na continuação da tela, preencha os dados do Orientador -1- e os dados da Defesa -2- . 6º PASSO: Preencha os dados da Banca -1- Presidente, -2- Examinador Interno e -3- Segundo Examinador. É importante observar que alguns tipos de examinadores e suplentes podem ser pessoas externas à Instituição, portanto, o cadastro desses membros deverá ocorrer de forma antecipada, conforme as orientações do cadastro específico. Após preencher os dados, clique em "" Salvar ""']","O Coordenador de Competições Esportivas Sistêmico tem acesso total ao sistema e pode gerenciar inscrições de qualquer participante, enquanto o Professor pode apenas cadastrar, editar e acompanhar as inscrições dos participantes. O Coordenador de Competições não consegue ver as inscrições feitas por um Professor, pois o Professor é responsável por garantir que seus alunos estejam devidamente inscritos e com a documentação correta.","Como aluno, você gerencia apenas sua própria inscrição. O Coordenador de Competições Esportivas Sistêmico tem acesso total e pode gerenciar inscrições de qualquer participante, incluindo a sua.",0.9999999999,1.0,0.8,0.6784235639702025
"Beleza, entendi que eu posso me inscrever. Mas tipo, qual o passo a passo? Onde clico pra começar a fazer minha inscrição no SUAP?","['Quem faz : Aluno Para realizar os procedimentos a seguir é necessário está logado no sistema SUAP, para mais informações ver: Como fazer Login no SUAP Edu ? Inscrever-se em um Programa Na tela inicial do SUAP na seção de notificações ( Fique Atento! ), inscreva-se clicando no programa com período de inscrição aberto. Para inscrever-se em editais de Benefícios é obrigatório está com a caracterização socioeconômica atualizada Preencha a caraterização socioeconômica e o questionário de inscrição e em seguida clique e Enviar Na próxima seção, preencha corretamente os dados da inscrição com atenção ao quadro de composição do grupo familiar ao final, clique novamente em Continuar Anexe a documentação comprobatória e clique em Continuar Os tipos de arquivos permitidos são: .pdf, .jpeg, .jpg,\n\n. observar os passos 9 e 10 acima. 1º PASSO: Para o examinador externo é aguardar o recebimento de um e-mail contendo o convite para participar da banca e assinar eletronicamente a ata de defesa. No e-mail, será informado um link para acessar a plataforma e redefinir a senha de acesso. Após o acesso, o examinador externo poderá visualizar a ata e assinar eletronicamente o documento. 2º PASSO: Ao clicar no link, o examinador será redirecionado para a página de acesso ao SUAP . Para o primeiro acesso, é necessário clicar em ""Esqueceu a senha"". Em seguida, o examinador deve criar uma nova senha e, posteriormente, acessar a página do SUAP . 3º PASSO: Ao clicar no link, o examinador será redirecionado para a página de redefinição de senha\n\nA definição do período de inscrição do edital se faz necessária para que a opção de inscrição esteja ativa no perfil de acesso do estudante no SUAP. Durante o período em que estiver aberta as inscrições, o estudante poderá alterar as informações, mesmo já tendo finalizado a inscrição. Eles preencherão o formulário de ""Caracterização Social"" e, posteriormente, podrão se inscrever nos programas. Quem faz? Assistente Social, Coordenador/Presidente de Comissão e Diretoria de Assistência Estudantil (Reitoria) Necessário ter um Edital cadastrado 1. Crie um Período de Inscrição No menu, abra: ATIVIDADES ESTUDANTIS >> Serviço Social >> Programas >> Período de Inscrição >> acione o botão ""Adicionar Período de Inscrição "" 2']","1. Acesse a tela inicial do SUAP e clique no programa com período de inscrição aberto na seção de notificações.
2. Preencha a caracterização socioeconômica e o questionário de inscrição.
3. Preencha corretamente os dados da inscrição, atentando-se ao quadro de composição do grupo familiar.
4. Anexe a documentação comprobatória.
5. Clique em ""Enviar"" e em seguida em ""Continuar"" para finalizar a inscrição.","Para se inscrever, você deve acessar o sistema SUAP, encontrar a seção de Competições Esportivas e lá você terá a opção de 'Criar' sua inscrição, visualizar as competições disponíveis e preencher os dados necessários.",0.0,1.0,1.0,0.4754892763831533
Ouvi falar de um 'Coordenador de Campus'. O que ele faz exatamente? Ele mexe nas minhas inscrições ou só nas competições?,"['. Responsabilidade: Organizar e acompanhar as modalidades do seu campus. 👨\u200d🏫 Professor O professor tem acesso para inscrever alunos ou equipes nas competições. Pode: Visualizar as competições disponíveis; Cadastrar, editar e acompanhar as inscrições dos participantes; Enviar, editar ou excluir os documentos necessários dos seus inscritos. Responsabilidade: Garantir que seus alunos estejam devidamente inscritos e com a documentação correta. 👩\u200d🎓 Aluno O aluno pode fazer e gerenciar sua própria inscrição . Pode: Criar, visualizar, editar ou excluir sua inscrição; Enviar, atualizar ou remover seus próprios documentos. Responsabilidade: Cuidar da própria inscrição e garantir que todos os documentos estejam em ordem.\n\n🏆 Coordenador de Competições Esportivas Sistêmico Este é o perfil com acesso total ao sistema . Ele atua como administrador geral das competições esportivas. Pode: Criar, editar e excluir competições; Gerenciar modalidades esportivas, polos (locais) e tipos de documentos aceitos; Configurar o sistema como um todo; Gerenciar inscrições de qualquer participante. Responsabilidade: Garantir o funcionamento das competições em toda a instituição. 🎯 Coordenador de Competições Esportivas de Campus Este perfil cuida apenas das competições realizadas no seu campus . Pode: Visualizar as competições ativas; Adicionar, editar ou remover modalidades esportivas do seu campus; Ajustar modalidades padrão conforme a necessidade local. Responsabilidade: Organizar e acompanhar as modalidades do seu campus\n\nApós adicionar o estudante como participante de programa, é necessário inserir as informações sobre os valores dos auxílios deferidos. Aqui é fundamental que cada equipe responsável verifique qual procedimento atende melhor a sua demanda. A contemplação dos valores pode ser feita individualmente , ou seja, ao final da seleção, após ter adicionado a Participação , ou em lote , com a seleção de parâmetros como modalidade de auxílio, valor e quantidade da parcela e ano/semestre letivo. Quem faz? Assistente Social, Coordenador e Diretoria de Assuntos Estudantis (Reitoria) Contemplação Individual 1. Acesse as Inscrições No menu, abra: ATIVIDADES ESTUDANTIS >> Serviço Social >> Programas >> Programas 2. Filtre o Programa 3']","O 'Coordenador de Campus' cuida das competições realizadas no seu campus. Ele pode visualizar as competições ativas, adicionar, editar ou remover modalidades esportivas do campus e ajustar modalidades padrão conforme a necessidade local. Ele não mexe nas suas inscrições, apenas organiza e acompanha as modalidades do campus em relação às competições esportivas.","O Coordenador de Competições Esportivas de Campus cuida apenas das competições realizadas no seu campus, organizando e acompanhando as modalidades. Ele não gerencia suas inscrições diretamente, mas sim o ambiente das competições locais.",0.9999999999,0.5,0.8888888888888888,0.7574153298582676
